Step,Action,Reason,Subtask,Memory
"[9, 9, 9]","['NavigateTo(ReservoirTaj)', 'NavigateTo(ReservoirLibre)', 'Explore()']","Alice should navigate to ReservoirTaj to collect sand for the chemical fire, EmberFire. Bob should navigate to ReservoirLibre to collect water for the non-chemical fires, AgniFire and DowntownFire. Charlie should explore to locate LostPersonThomas.","Alice is currently collecting sand from ReservoirTaj, Bob is currently collecting water from ReservoirLibre, Charlie is currently exploring to locate LostPersonThomas",EmberFire and regions are chemical type needing sand. AgniFire and DowntownFire and regions are non-chemical type needing water. ReservoirTaj has sand. ReservoirLibre has water. DepositFacility is empty.
"[9, 9, 9]","['GetSupply(ReservoirTaj)', 'GetSupply(ReservoirLibre)', 'NavigateTo(DowntownFire_Region_1)']","Alice has successfully navigated to ReservoirTaj and can now collect sand to use on EmberFire. Bob has successfully navigated to ReservoirLibre and can now collect water to use on AgniFire. Charlie has successfully explored and should now navigate to DowntownFire to prepare for extinguishing it with water, which will require collecting water first.","Alice is currently collecting sand from ReservoirTaj, Bob is currently collecting water from ReservoirLibre, Charlie is currently navigating to DowntownFire_Region_1",EmberFire and regions are chemical type needing sand. AgniFire and DowntownFire and regions are non-chemical type needing water. ReservoirTaj has sand. ReservoirLibre has water. DepositFacility is empty.
"[9, 9, 9]","['NavigateTo(EmberFire_Region_1)', 'NavigateTo(AgniFire_Region_1)', 'NavigateTo(ReservoirLibre)']","Alice, with sand in her inventory, should navigate to and extinguish the EmberFire_Region_1, which requires sand. Bob, with water in his inventory, should navigate to and extinguish the AgniFire_Region_1, which requires water. Charlie, with no resources, should navigate to ReservoirLibre to get water, then extinguish DowntownFire_Region_1.","Alice is currently navigating to EmberFire_Region_1, Bob is currently navigating to AgniFire_Region_1, Charlie is currently navigating to ReservoirLibre","EmberFire and regions are chemical type needing sand. AgniFire and DowntownFire and regions are non-chemical type needing water. ReservoirTaj has sand. ReservoirLibre has water. DepositFacility is empty. Alice is at co-ordinates: (5, 20) with sand. Bob is at co-ordinates: (9, 17) with water. Charlie is at co-ordinates: (25, 22) and needs to get water to extinguish DowntownFire."
"[9, 9, 9]","['UseSupply(EmberFire, Sand)', 'UseSupply(AgniFire, Water)', 'GetSupply(ReservoirLibre)']",Alice is already at EmberFire_Region_1 with sand and should use the supply to extinguish part of the EmberFire. Bob is already at AgniFire_Region_1 with water and should use the supply to extinguish part of the AgniFire. Charlie has successfully navigated to ReservoirLibre and should get a water supply to later extinguish the DowntownFire.,"Alice is currently extinguishing EmberFire using sand, Bob is currently extinguishing AgniFire using water, Charlie is currently replenishing water at ReservoirLibre after use","EmberFire and regions are chemical type needing sand. AgniFire and DowntownFire and regions are non-chemical type needing water. ReservoirTaj has sand. ReservoirLibre has water. DepositFacility is empty. Alice is at co-ordinates: (4, 12) with sand, near EmberFire_Region_1. Bob is at co-ordinates: (16, 17) with water, near AgniFire_Region_1. Charlie is at co-ordinates: (9, 17) and needs to get water to extinguish DowntownFire."
"[9, 9, 9]","['Explore()', 'Explore()', 'UseSupply(DowntownFire, Water)']","Alice and Bob have successfully extinguished their fires, so they can now focus on exploring to locate LostPersonThomas. Charlie should use their water supply on DowntownFire_Region_1 to reduce the fire intensity and prevent it from spreading.","Alice is currently exploring to locate LostPersonThomas, Bob is currently exploring to locate LostPersonThomas, Charlie is currently extinguishing DowntownFire_Region_1","EmberFire and regions are chemical type needing sand. AgniFire and DowntownFire and regions are non-chemical type needing water. Alice extinguished EmberFire. Bob extinguished AgniFire. Charlie is at co-ordinates: (9, 17) with water, ready to extinguish DowntownFire. ReservoirTaj has sand. ReservoirLibre has water. DepositFacility is empty."
"[9, 9, 9]","['NavigateTo(LostPersonThomas)', 'NavigateTo(LostPersonThomas)', 'NavigateTo(DowntownFire_Region_1)']",Alice and Bob need to navigate to LostPersonThomas to carry them. Charlie should navigate to DowntownFire_Region_1 to use the water supply to extinguish the fire.,"Alice and Bob are currently navigating to carry LostPersonThomas, Charlie is currently navigating to extinguish DowntownFire_Region_1","EmberFire and AgniFire are extinguished. Charlie is at co-ordinates: (9, 17) with water, ready to extinguish DowntownFire. ReservoirTaj has sand. ReservoirLibre has water. DepositFacility is empty. LostPersonThomas has been found and requires two agents to carry."
"[9, 9, 9]","['Carry(LostPersonThomas)', 'Carry(LostPersonThomas)', 'UseSupply(DowntownFire, Water)']","Alice and Bob have both successfully navigated to LostPersonThomas, and since LostPersonThomas requires two agents to carry, they can now both initiate the carry action. Charlie has successfully navigated to DowntownFire_Region_1 and is ready to use their water supply on it to extinguish the fire. As there are no more regions of the fire mentioned and Charlie is carrying water, Charlie should use the water on the center of the fire where they are currently located.","Alice and Bob are currently trying to carry LostPersonThomas, Charlie is currently trying to extinguish DowntownFire using water","EmberFire and AgniFire are extinguished. Charlie is at co-ordinates: (25, 22) with water, ready to extinguish DowntownFire. ReservoirTaj has sand. ReservoirLibre has water. DepositFacility is empty. LostPersonThomas has been found and requires two agents to carry."
"[9, 9, 9]","['NavigateTo(DepositFacility)', 'NavigateTo(DepositFacility)', 'Explore()']","Alice and Bob are both carrying LostPersonThomas and need to navigate to the DepositFacility to drop him off. Since Charlie has no current task and all fires are extinguished, he should continue exploration.","Alice and Bob are currently navigating to DepositFacility with LostPersonThomas, Charlie is currently exploring.","EmberFire and AgniFire are extinguished. DowntownFire is extinguished. Charlie is at co-ordinates: (25, 22). ReservoirTaj has sand. ReservoirLibre has water. DepositFacility is empty. LostPersonThomas has been found and is currently being carried by Alice and Bob."
"[9, 9, 9]","['DropOff(DepositFacility, LostPersonThomas)', 'DropOff(DepositFacility, LostPersonThomas)', 'Explore()']","Alice and Bob are both carrying LostPersonThomas and need to navigate to the DepositFacility to drop him off. Since they are already at or near the coordinates of the DepositFacility, they should perform the dropoff action. Charlie, being at a different location, should continue exploring the environment to complete the exploration subtask.","Alice and Bob are currently trying to drop LostPersonThomas in a deposit, Charlie is currently continuing exploration","EmberFire and AgniFire are extinguished. DowntownFire is extinguished. Charlie is at co-ordinates: (25, 22). ReservoirTaj has sand. ReservoirLibre has water. DepositFacility is empty. LostPersonThomas has been found and is currently being carried by Alice and Bob. Alice and Bob are at co-ordinates close to DepositFacility (12, 25) and (13, 24) respectively."
"[9, 9, 9]","['Done', 'Done', 'Done']","All fires mentioned in the task are extinguished, and LostPersonThomas has been successfully dropped off at the DepositFacility. The remaining subtasks involve collecting resources from the reservoirs, which is not necessary as all fires have been extinguished and no further exploration is required as the lost person has been found and secured. Therefore, all robots should report completion of their tasks.",Done,"EmberFire, AgniFire, and DowntownFire are extinguished. LostPersonThomas has been dropped off at DepositFacility. ReservoirTaj has sand. ReservoirLibre has water."
