Step,Action,Reason,Subtask,Memory
"[12, 12, 12, 12, 12]","['NavigateTo(ReservoirTaj)', 'NavigateTo(ReservoirLibre)', 'NavigateTo(ReservoirLibre)', 'Explore()', 'Explore()']",Alice should navigate to ReservoirTaj to collect Sand for EmberFire. Bob should navigate to ReservoirLibre to collect Water for AgniFire and DowntownFire. Charlie should assist Bob by also navigating to ReservoirLibre. David and Emma should explore the environment to locate LostPersonThomas.,"Alice is currently trying to collect sand from ReservoirTaj, Bob and Charlie are currently trying to collect water from ReservoirLibre, David and Emma are currently trying to locate LostPersonThomas","EmberFire requires Sand, AgniFire and DowntownFire require Water. ReservoirTaj contains Sand, ReservoirLibre contains Water. No person found yet."
"[12, 12, 12, 12, 12]","['GetSupply(ReservoirTaj)', 'GetSupply(ReservoirLibre)', 'GetSupply(ReservoirLibre)', 'Explore()', 'Explore()']","Alice, Bob, and Charlie are all close to the reservoirs containing the resources needed to extinguish the fires. They should collect these resources. David and Emma should continue to explore to find LostPersonThomas.","Alice is currently collecting sand from ReservoirTaj, Bob is currently collecting water from ReservoirLibre, Charlie is currently collecting water from ReservoirLibre, David is currently exploring, Emma is currently exploring","EmberFire requires Sand, AgniFire and DowntownFire require Water. ReservoirTaj contains Sand, ReservoirLibre contains Water. No person found yet."
"[12, 12, 12, 12, 12]","['UseSupply(EmberFire, Sand)', 'UseSupply(AgniFire, Water)', 'UseSupply(DowntownFire, Water)', 'NavigateTo(ReservoirLibre)', 'NavigateTo(ReservoirTaj)']","Alice can use her sand supply on EmberFire_Region_1 since she has 1 unit of sand. Bob and Charlie both can use their water supplies on AgniFire_Region_1 and DowntownFire_Region_1 respectively, as they both have 1 unit of water each. David has just finished exploring and can now collect water from ReservoirLibre to address the fires. Emma, who also finished exploring, should collect sand from ReservoirTaj to contribute to extinguishing EmberFire. Alice and Bob should later coordinate to carry LostPersonThomas after dealing with their respective fires.","Alice is currently trying to extinguish EmberFire_Region_1 using sand, Bob is currently trying to extinguish AgniFire_Region_1 using water, Charlie is currently trying to extinguish DowntownFire_Region_1 using water, David is currently trying to collect water from ReservoirLibre, Emma is currently trying to collect sand from ReservoirTaj","EmberFire requires Sand, AgniFire and DowntownFire require Water. ReservoirTaj contains Sand, ReservoirLibre contains Water. LostPersonThomas has been found and requires 2 agents to carry."
"[12, 12, 12, 12, 12]","['NavigateTo(EmberFire_Region_1)', 'NavigateTo(AgniFire_Region_1)', 'NavigateTo(DowntownFire_Region_1)', 'GetSupply(ReservoirLibre)', 'GetSupply(ReservoirTaj)']",Alice should navigate to EmberFire_Region_1 to use her sand supply. Bob should navigate to AgniFire_Region_1 to use his water supply. Charlie should navigate to DowntownFire_Region_1 to use his water supply. David should get water from ReservoirLibre to help extinguish AgniFire or DowntownFire. Emma should get sand from ReservoirTaj to help extinguish EmberFire.,"Alice is currently navigating to EmberFire_Region_1, Bob is currently navigating to AgniFire_Region_1, Charlie is currently navigating to DowntownFire_Region_1, David is currently getting water from ReservoirLibre, Emma is currently getting sand from ReservoirTaj","EmberFire requires Sand, AgniFire and DowntownFire require Water. ReservoirTaj contains Sand, ReservoirLibre contains Water. LostPersonThomas has been found and requires 2 agents to carry. Alice is at co-ordinates: (5, 20) with sand. Bob is at co-ordinates: (9, 17) with water. Charlie is at co-ordinates: (10, 16) with water. David is at co-ordinates: (10, 18) and has no resources. Emma is at co-ordinates: (6, 19) and has no resources."
"[12, 12, 12, 12, 12]","['UseSupply(EmberFire, Sand)', 'UseSupply(AgniFire, Water)', 'UseSupply(DowntownFire, Water)', 'Explore()', 'NavigateTo(DepositFacility)']",Alice should use her sand supply on the central low-intensity part of EmberFire. Bob should use his water supply on the central low-intensity part of AgniFire. Charlie should use his water supply on the central low-intensity part of DowntownFire. David should explore to help find LostPersonThomas. Emma should head towards the DepositFacility to assist in carrying LostPersonThomas.,"Alice is currently extinguishing EmberFire, Bob is currently extinguishing AgniFire, Charlie is currently extinguishing DowntownFire, David is currently locating LostPersonThomas, Emma is coordinating to carry LostPersonThomas.","Alice is at co-ordinates: (4, 12) with sand. Bob is at co-ordinates: (16, 17) with water. Charlie is at co-ordinates: (25, 22) with water. David is at co-ordinates: (10, 18) with water. Emma is at co-ordinates: (6, 19) with sand. LostPersonThomas has been found and requires 2 agents to carry. EmberFire requires Sand, while AgniFire and DowntownFire require Water. ReservoirTaj contains Sand, ReservoirLibre contains Water."
"[12, 12, 12, 12, 12]","['NavigateTo(LostPersonThomas)', 'NavigateTo(LostPersonThomas)', 'NavigateTo(LostPersonThomas)', 'ClearInventory()', 'NavigateTo(DepositFacility)']","All the fires have been successfully extinguished, and LostPersonThomas has been found. The next step is to coordinate two robots to carry LostPersonThomas to the deposit. Since Alice, Bob, and Charlie are not holding any resources or person, they are free to carry out the task of navigating to LostPersonThomas and carrying him. David should clear his inventory to assist in carrying the person. Emma should navigate to the deposit to be ready to help with the drop-off process once the others arrive with LostPersonThomas.","Alice, Bob, Charlie, and David are currently coordinating to carry LostPersonThomas, while Emma is navigating to the deposit in preparation for the drop-off.","All fires have been extinguished. LostPersonThomas has been found and requires 2 agents to carry. ReservoirTaj contains Sand, ReservoirLibre contains Water. DepositFacility is empty."
"[12, 12, 12, 12, 12]","['Carry(LostPersonThomas)', 'Carry(LostPersonThomas)', 'NavigateTo(DepositFacility)', 'NavigateTo(LostPersonThomas)', 'NavigateTo(LostPersonThomas)']","Alice and Bob have both successfully navigated to LostPersonThomas and are ready to carry him. Charlie has also navigated to LostPersonThomas successfully but as only two agents are required, Charlie can engage in another task. David and Emma are free to engage in other tasks or assist in carrying LostPersonThomas to the deposit if needed for efficiency.","Alice and Bob are currently carrying LostPersonThomas, David and Emma are currently navigating to help carry LostPersonThomas, Charlie is currently navigating to the deposit.","All fires have been extinguished. LostPersonThomas has been found and requires 2 agents to carry. ReservoirTaj contains Sand, ReservoirLibre contains Water. DepositFacility is empty."
"[12, 12, 12, 12, 12]","['NavigateTo(DepositFacility)', 'NavigateTo(DepositFacility)', 'Idle', 'Idle', 'Idle']",Alice and Bob are already carrying LostPersonThomas and need to navigate to the DepositFacility to drop him off. Charlie is already at the DepositFacility and can assist in the drop-off process or stand by for further tasks. David and Emma can explore to find any remaining tasks or assist with the drop-off if required.,"Alice and Bob are currently navigating to deposit with LostPersonThomas, while Charlie, David, and Emma are currently assisting with the drop-off or standing by.","All fires have been extinguished. LostPersonThomas has been found and requires 2 agents to carry. ReservoirTaj contains Sand, ReservoirLibre contains Water. DepositFacility is empty. Alice and Bob are carrying LostPersonThomas."
"[12, 12, 12, 12, 12]","['NavigateTo(DepositFacility)', 'NavigateTo(DepositFacility)', 'Idle', 'Idle', 'Idle']","Alice and Bob are currently carrying LostPersonThomas and need to navigate to the DepositFacility to drop him off. Since they are already carrying the person, they should move towards the deposit. Charlie should remain idle as his help is not required for carrying LostPersonThomas. David and Emma are far from the action and with all fires extinguished and no other lost persons to find, they should remain idle as well.","Alice and Bob are currently navigating to deposit with LostPersonThomas, Charlie is idle, David is idle, Emma is idle","All fires have been extinguished. LostPersonThomas has been found and requires 2 agents to carry. ReservoirTaj contains Sand, ReservoirLibre contains Water. DepositFacility is empty. Alice and Bob are carrying LostPersonThomas. Alice is at co-ordinates (13, 24). Bob is at co-ordinates (13, 26). Charlie is at co-ordinates (12, 25). David is at co-ordinates (25, 7). Emma is at co-ordinates (26, 6)."
"[12, 12, 12, 12, 12]","['NavigateTo(DepositFacility)', 'NavigateTo(DepositFacility)', 'NavigateTo(DepositFacility)', 'Explore()', 'Explore()']","Alice and Bob are already carrying LostPersonThomas and need to navigate to the DepositFacility to drop him off. Charlie should navigate to the DepositFacility to be ready for any further assistance or to take on a new subtask once Alice and Bob complete their current task. David and Emma, who are idle and not carrying anything, should start exploring the environment to ensure no other tasks are pending and to prepare for any new subtasks that may arise.","Alice and Bob are currently navigating to deposit with LostPersonThomas, Charlie is navigating to DepositFacility, David and Emma are exploring","All fires have been extinguished. LostPersonThomas has been found and requires 2 agents to carry. ReservoirTaj contains Sand, ReservoirLibre contains Water. DepositFacility is empty. Alice and Bob are carrying LostPersonThomas. Alice is at co-ordinates (14, 25). Bob is at co-ordinates (12, 24). Charlie is at co-ordinates (12, 25). David is at co-ordinates (25, 7). Emma is at co-ordinates (26, 6)."
"[12, 12, 12, 12, 12]","['NavigateTo(DepositFacility)', 'NavigateTo(DepositFacility)', 'NavigateTo(DepositFacility)', 'ClearInventory()', 'ClearInventory()']","Alice and Bob are already carrying LostPersonThomas and need to navigate to the DepositFacility to drop them off. Charlie should navigate to the DepositFacility as well to assist in dropping off LostPersonThomas since the open subtask is to empty inventory of persons for Alice, Bob, and Charlie. David and Emma should clear their inventory of any supplies to assist in future tasks as all fires have been extinguished.",Alice and Bob are currently navigating to DepositFacility with LostPersonThomas. Charlie is currently navigating to DepositFacility to assist. David and Emma are currently clearing their inventory.,"All fires have been extinguished. LostPersonThomas has been found and requires 2 agents to carry. ReservoirTaj contains Sand, ReservoirLibre contains Water. DepositFacility is empty. Alice and Bob are carrying LostPersonThomas. Alice is at co-ordinates (13, 24). Bob is at co-ordinates (13, 26). Charlie is at co-ordinates (12, 24). David is at co-ordinates (25, 27). Emma is at co-ordinates (26, 26)."
"[12, 12, 12, 12, 12]","['DropOff(DepositFacility, LostPersonThomas)', 'DropOff(DepositFacility, LostPersonThomas)', 'Idle', 'Idle', 'Idle']","Alice and Bob should continue to carry LostPersonThomas to the DepositFacility to drop them off since they have already successfully navigated there and they both are holding the person. Charlie, being at the deposit location already, should wait as he has no person to drop off and the fires are extinguished. David and Emma, who are not engaged in carrying the person, should remain idle as there are no other tasks to complete.","Alice and Bob are currently carrying LostPersonThomas, Charlie is waiting at the deposit, David and Emma are idle.","All fires have been extinguished. LostPersonThomas has been found and requires 2 agents to carry. ReservoirTaj contains Sand, ReservoirLibre contains Water. DepositFacility is empty. Alice and Bob are carrying LostPersonThomas. Alice is at co-ordinates (12, 25). Bob is at co-ordinates (14, 25). Charlie is at co-ordinates (13, 26). David is at co-ordinates (25, 27). Emma is at co-ordinates (26, 26)."
"[12, 12, 12, 12, 12]","['Done', 'Done', 'Done', 'Done', 'Done']",All subtasks have been completed successfully. All fires have been extinguished and LostPersonThomas has been found and dropped off. All robots can now report that they are done with the task.,"Alice, Bob, Charlie, David, and Emma are currently done with their tasks.","All fires have been extinguished. LostPersonThomas has been found and has been successfully dropped off at DepositFacility by Alice and Bob. Alice is at co-ordinates (12, 25). Bob is at co-ordinates (14, 25). Charlie is at co-ordinates (13, 26). David is at co-ordinates (25, 27). Emma is at co-ordinates (26, 26)."
