Step,Action,Reason,Subtask,Memory
"[34, 34]","['NavigateTo(ReservoirYork)', 'Explore()']","Alice should start by collecting water from ReservoirYork to extinguish the SussexFire, as it is non-chemical and requires water. Bob should explore to find LostPersonJacob and LostPersonZoe since no lost persons have been found yet.","Alice is currently trying to collect water from ReservoirYork, Bob is currently trying to explore to find LostPersonJacob and LostPersonZoe",SussexFire is non-chemical and requires water to be extinguished. ReservoirYork contains water. No people have been found yet.
"[34, 34]","['GetSupply(ReservoirYork)', 'Explore()']","Alice has successfully navigated to ReservoirYork and should now collect water to extinguish the SussexFire. Bob, having successfully explored without finding any lost people, should either continue exploring or begin to assist with the fire by collecting water.","Alice is currently collecting water from ReservoirYork, Bob is currently exploring to find LostPersonJacob and LostPersonZoe",SussexFire is non-chemical and requires water to be extinguished. ReservoirYork contains water. No people have been found yet.
"[34, 34]","['NavigateTo(ReservoirYork)', 'NavigateTo(ReservoirYork)']",Alice can navigate to ReservoirYork to collect more water since she has only 1 unit and may need more to extinguish the SussexFire. Bob needs to collect water from ReservoirYork to help extinguish the fire or to be prepared for carrying a lost person after the fire is managed.,"Alice is currently navigating to ReservoirYork to collect water, Bob is also collecting water from ReservoirYork",SussexFire is non-chemical and requires water to be extinguished. ReservoirYork contains water. LostPersonJacob and LostPersonZoe have been found and require 2 agents to carry.
"[34, 34]","['UseSupply(SussexFire, Water)', 'NavigateTo(ReservoirYork)']","Alice should use her water supply on SussexFire_Region_1 to lower the intensity of the fire. Bob should navigate to ReservoirYork to collect water, which is needed to extinguish the SussexFire.","Alice is currently trying to extinguish SussexFire_Region_1, Bob is currently trying to collect water from ReservoirYork","SussexFire is non-chemical and requires water to be extinguished. ReservoirYork contains water. LostPersonJacob and LostPersonZoe have been found and require 2 agents to carry. Alice is at co-ordinates (9, 18) with Water. Bob is at co-ordinates (8, 19) with no resources."
"[34, 34]","['NavigateTo(SussexFire_Region_1)', 'GetSupply(ReservoirYork)']","Alice needs to navigate to SussexFire_Region_1 to use water on it. Bob can collect water from ReservoirYork to help extinguish the fire in subsequent steps, and then both can coordinate to navigate to and carry the lost persons to a deposit.","Alice is currently trying to extinguish SussexFire_Region_1 using water, Bob is currently trying to collect water from ReservoirYork","SussexFire is non-chemical and requires water to be extinguished. ReservoirYork contains water. LostPersonJacob and LostPersonZoe have been found and require 2 agents to carry. Alice is at co-ordinates (9, 18) with Water. Bob is at co-ordinates (9, 20) with no resources."
"[34, 34]","['UseSupply(SussexFire, Water)', 'NavigateTo(SussexFire_Region_1)']","Alice should now use her water supply on the SussexFire_Region_1 to lower the fire's intensity. Bob should navigate to SussexFire_Region_1 so he can help extinguish the fire with his water supply in the next steps. Since the fires are the immediate threat, they should prioritize this before moving on to explore and carry the lost persons.",Alice is currently trying to extinguish SussexFire_Region_1 using water. Bob is currently navigating to SussexFire_Region_1 to assist in extinguishing the fire.,"SussexFire is non-chemical and requires water to be extinguished. ReservoirYork contains water. LostPersonJacob and LostPersonZoe have been found and each requires 2 agents to carry. Alice is at co-ordinates (17, 24) and has Water in her inventory. Bob is at co-ordinates (9, 20) and has Water in his inventory."
"[34, 34]","['Explore()', 'Explore()']","Since all regions of SussexFire have an intensity of None, the fire has been successfully extinguished. Both Alice and Bob should now focus on exploring to locate LostPersonJacob and LostPersonZoe, then carry them to the deposit. Alice can explore in one direction while Bob explores in another to cover more ground efficiently.","Alice is currently exploring to locate LostPersonJacob, Bob is currently exploring to locate LostPersonZoe",SussexFire is non-chemical and requires water to be extinguished. ReservoirYork contains water. LostPersonJacob and LostPersonZoe have been found and each requires 2 agents to carry. Alice and Bob need to explore to locate the lost persons and then carry them to a deposit.
"[34, 34]","['NavigateTo(LostPersonJacob)', 'NavigateTo(LostPersonZoe)']","Since both lost persons have been found, Alice and Bob should now focus on carrying them to the deposit. They should navigate to the deposit and perform the carry and dropoff actions.","Alice is currently navigating to carry LostPersonJacob, Bob is currently navigating to carry LostPersonZoe",SussexFire is non-chemical and requires water to be extinguished. ReservoirYork contains water. LostPersonJacob and LostPersonZoe have been found and each requires 2 agents to carry. Alice and Bob have explored and located LostPersonJacob and LostPersonZoe. The SussexFire has been extinguished.
"[34, 34]","['Carry(LostPersonJacob)', 'Carry(LostPersonZoe)']","Both Alice and Bob have successfully navigated to the lost persons. Now they should coordinate to carry them to the deposit. Since the fire has been extinguished and they hold no resources needed for fire extinguishing, they should focus on rescuing the lost persons.","Alice is currently trying to carry LostPersonJacob to deposit, Bob is currently trying to carry LostPersonZoe to deposit",SussexFire is non-chemical and requires water to be extinguished. ReservoirYork contains water. LostPersonJacob and LostPersonZoe have been found and each requires 2 agents to carry. Alice and Bob have explored and located LostPersonJacob and LostPersonZoe. The SussexFire has been extinguished.
"[34, 34]","['NavigateTo(DepositFacility)', 'NavigateTo(DepositFacility)']","Now that Alice and Bob have successfully carried LostPersonJacob and LostPersonZoe, they need to navigate to DepositFacility to drop them off. After that, they can collect water from ReservoirYork to extinguish any future fires. Since the SussexFire has been extinguished, there is no immediate need to collect water, but they should do so after the drop off in preparation for possible future tasks.",Alice and Bob are currently navigating to DepositFacility with LostPersonJacob and LostPersonZoe respectively.,SussexFire is non-chemical and requires water to be extinguished. ReservoirYork contains water. LostPersonJacob and LostPersonZoe have been found and each requires 2 agents to carry. Alice and Bob have explored and located LostPersonJacob and LostPersonZoe. The SussexFire has been extinguished. Alice and Bob are both holding LostPersonJacob and LostPersonZoe respectively.
"[34, 34]","['DropOff(DepositFacility, LostPersonJacob)', 'DropOff(DepositFacility, LostPersonZoe)']",Alice and Bob have successfully navigated to the DepositFacility with LostPersonJacob and LostPersonZoe. They should now drop off the lost persons in the deposit.,Alice and Bob are both currently trying to drop the lost persons they are carrying in the deposit.,"SussexFire is non-chemical and requires water to be extinguished. ReservoirYork contains water. LostPersonJacob and LostPersonZoe have been found and each requires 2 agents to carry. The SussexFire has been extinguished. Alice and Bob are both holding LostPersonJacob and LostPersonZoe respectively. Alice and Bob are at co-ordinates (11, 24) and (12, 23) near DepositFacility."
"[34, 34]","['NavigateTo(DepositFacility)', 'NavigateTo(DepositFacility)']",Alice and Bob need to navigate to DepositFacility to successfully drop off LostPersonJacob and LostPersonZoe respectively.,"Alice is currently navigating to DepositFacility to drop off LostPersonJacob, Bob is currently navigating to DepositFacility to drop off LostPersonZoe","SussexFire is non-chemical and requires water to be extinguished. ReservoirYork contains water. LostPersonJacob and LostPersonZoe have been found and each requires 2 agents to carry. The SussexFire has been extinguished. Alice and Bob are both holding LostPersonJacob and LostPersonZoe respectively. Alice and Bob are near DepositFacility at co-ordinates (11, 24) and (12, 23)."
"[34, 34]","['NavigateTo(DepositFacility)', 'NavigateTo(DepositFacility)']","Since Alice and Bob are both holding LostPersonJacob and LostPersonZoe and are near DepositFacility, they should both navigate to DepositFacility to be close enough to drop off the persons they are carrying.",Alice and Bob are currently trying to drop off LostPersonJacob and LostPersonZoe at DepositFacility,"SussexFire is non-chemical and requires water to be extinguished. ReservoirYork contains water. LostPersonJacob and LostPersonZoe have been found and each requires 2 agents to carry. The SussexFire has been extinguished. Alice and Bob are both holding LostPersonJacob and LostPersonZoe respectively. Alice and Bob are near DepositFacility at co-ordinates (12, 25) and (11, 24)."
"[34, 34]","['Move(Right)', 'Move(Left)']","Alice and Bob should both navigate to the DepositFacility so that they are together and in the right position to drop off LostPersonJacob and LostPersonZoe. Since the fire has been extinguished, the next step is to ensure the lost persons are safely dropped off at the deposit.","drop LostPersonJacob in deposit, drop LostPersonZoe in deposit","SussexFire is non-chemical and requires water to be extinguished. ReservoirYork contains water. LostPersonJacob and LostPersonZoe have been found and each requires 2 agents to carry. The SussexFire has been extinguished. Alice and Bob are both holding LostPersonJacob and LostPersonZoe respectively. Alice and Bob are near DepositFacility at co-ordinates (12, 23) and (12, 25)."
"[34, 34]","['NavigateTo(DepositFacility)', 'NavigateTo(DepositFacility)']","Alice and Bob both need to navigate to the DepositFacility to drop off LostPersonJacob and LostPersonZoe. Since they are both near the DepositFacility, they should perform the navigate action to reach the deposit and then perform the dropoff action together.","Alice is currently navigating to the DepositFacility to drop off LostPersonJacob, Bob is currently navigating to the DepositFacility to drop off LostPersonZoe","Alice and Bob are both holding LostPersonJacob and LostPersonZoe respectively and are near the DepositFacility at co-ordinates (13, 23) and (11, 25). SussexFire has been extinguished."
"[34, 34]","['DropOff(DepositFacility, LostPersonJacob)', 'DropOff(DepositFacility, LostPersonZoe)']","Since Alice and Bob have successfully navigated to the DepositFacility and are currently holding LostPersonJacob and LostPersonZoe, they both need to perform the 'DropOff' action together at the deposit to complete the task.","Alice is currently dropping off LostPersonJacob at DepositFacility, Bob is currently dropping off LostPersonZoe at DepositFacility","SussexFire has been extinguished. Alice and Bob are both holding LostPersonJacob and LostPersonZoe respectively and are near the DepositFacility at co-ordinates (11, 24) and (12, 23)."
"[34, 34]","['NavigateTo(DepositFacility)', 'NavigateTo(DepositFacility)']","Alice and Bob should both navigate to the DepositFacility so they can be close enough to drop off LostPersonJacob and LostPersonZoe. After successfully dropping off the lost persons, they can move on to collecting water from the ReservoirYork as per the open subtasks.","Alice and Bob are currently navigating to DepositFacility with LostPersonJacob and LostPersonZoe,","SussexFire has been extinguished. Alice and Bob are both holding LostPersonJacob and LostPersonZoe respectively and are near the DepositFacility at co-ordinates (11, 24) and (12, 23)."
"[34, 34]","['NavigateTo(DepositFacility)', 'NavigateTo(DepositFacility)']","Alice and Bob should navigate to the DepositFacility and perform the dropoff action together since they are both carrying the lost persons and are close to the DepositFacility. Once the lost persons are dropped off, they can move on to other subtasks such as collecting water from ReservoirYork.",Alice and Bob are currently trying to drop LostPersonJacob and LostPersonZoe in DepositFacility,SussexFire has been extinguished. Alice and Bob are both holding LostPersonJacob and LostPersonZoe respectively and need to navigate to the DepositFacility to drop them off.
"[34, 34]","['DropOff(DepositFacility, LostPersonJacob)', 'DropOff(DepositFacility, LostPersonZoe)']",Alice and Bob should both perform the DropOff action at DepositFacility since they are both holding the lost persons and are near the deposit. No need to collect water as the fire is already extinguished.,"Alice is currently trying to drop LostPersonJacob at the DepositFacility, Bob is currently trying to drop LostPersonZoe at the DepositFacility","SussexFire has been extinguished. Alice and Bob are both near DepositFacility, with Alice holding LostPersonJacob and Bob holding LostPersonZoe. They need to perform the DropOff action together."
"[34, 34]","['NavigateTo(DepositFacility)', 'NavigateTo(DepositFacility)']",Alice and Bob need to navigate to DepositFacility and perform the DropOff action simultaneously to successfully drop off LostPersonJacob and LostPersonZoe.,Alice and Bob are currently trying to drop LostPersonJacob and LostPersonZoe in DepositFacility,SussexFire has been extinguished. Alice and Bob are both carrying LostPersonJacob and LostPersonZoe respectively and need to navigate to DepositFacility to drop them off together.
"[34, 34]","['DropOff(DepositFacility, LostPersonJacob)', 'DropOff(DepositFacility, LostPersonZoe)']","Since both robots are already at the DepositFacility with the lost persons, they should now perform the drop off action together in the next step to complete the task.",Drop LostPersonJacob and LostPersonZoe in DepositFacility,SussexFire has been extinguished. Alice and Bob are at coordinates close to DepositFacility carrying LostPersonJacob and LostPersonZoe respectively. They need to drop them off together at DepositFacility.
"[34, 34]","['NavigateTo(DepositFacility)', 'NavigateTo(DepositFacility)']",Alice and Bob need to navigate to the DepositFacility and simultaneously perform the DropOff action to successfully drop off LostPersonJacob and LostPersonZoe.,Alice and Bob are currently trying to drop off LostPersonJacob and LostPersonZoe at DepositFacility,"SussexFire has been extinguished. Alice and Bob are at coordinates close to DepositFacility carrying LostPersonJacob and LostPersonZoe respectively. They need to drop them off together at DepositFacility. Alice is at (11, 24) and Bob is at (12, 23)."
"[34, 34]","['DropOff(DepositFacility, LostPersonJacob)', 'DropOff(DepositFacility, LostPersonZoe)']","Both Alice and Bob have successfully navigated to the DepositFacility but need to perform the action to drop off the persons they are carrying at the same time. Since they are both holding persons, they cannot perform any other actions until they have successfully dropped off the persons.",Alice and Bob are currently trying to drop LostPersonJacob and LostPersonZoe in DepositFacility.,"SussexFire has been extinguished. Alice and Bob are both carrying LostPersonJacob and LostPersonZoe, they need to be at DepositFacility together to drop them off."
"[34, 34]","['NavigateTo(DepositFacility)', 'NavigateTo(DepositFacility)']",Alice and Bob need to navigate to DepositFacility so they can be close enough to perform the DropOff action together.,carry LostPersonJacob and LostPersonZoe to DepositFacility,"SussexFire has been extinguished. Alice and Bob are both carrying LostPersonJacob and LostPersonZoe, they need to be at DepositFacility together to drop them off."
"[34, 34]","['DropOff(DepositFacility, LostPersonJacob)', 'DropOff(DepositFacility, LostPersonZoe)']","Alice and Bob have successfully navigated to the DepositFacility with LostPersonJacob and LostPersonZoe. Since both are at the DepositFacility and both are carrying the lost persons, they should now perform the DropOff action together to successfully complete the task.",carry LostPersonJacob and LostPersonZoe to DepositFacility,"SussexFire has been extinguished. Alice and Bob are both carrying LostPersonJacob and LostPersonZoe, they need to be at DepositFacility together to drop them off."
"[34, 34]","['NavigateTo(DepositFacility)', 'NavigateTo(DepositFacility)']",Both Alice and Bob need to navigate to the DepositFacility to be able to drop off LostPersonJacob and LostPersonZoe.,Alice and Bob are currently trying to carry LostPersonJacob and LostPersonZoe to DepositFacility and drop LostPersonJacob and LostPersonZoe in DepositFacility,"SussexFire has been extinguished. Alice and Bob are both carrying LostPersonJacob and LostPersonZoe, they need to be at DepositFacility together to drop them off."
"[34, 34]","['DropOff(DepositFacility, LostPersonJacob)', 'DropOff(DepositFacility, LostPersonZoe)']",Alice and Bob have already navigated to DepositFacility with LostPersonJacob and LostPersonZoe. They now both need to perform the 'DropOff' action at the same time to successfully drop off the lost persons in the deposit.,Alice and Bob are currently trying to drop off LostPersonJacob and LostPersonZoe in DepositFacility,"SussexFire has been extinguished. Alice and Bob are both carrying LostPersonJacob and LostPersonZoe, they need to be at DepositFacility together to drop them off. Both robots are at co-ordinates close to DepositFacility (Alice: (11, 24), Bob: (12, 23))."
"[34, 34]","['NavigateTo(DepositFacility)', 'NavigateTo(DepositFacility)']",Alice and Bob should navigate to the DepositFacility so they can drop off both LostPersonJacob and LostPersonZoe. They must do this together as both lost persons require 2 agents to carry.,Alice and Bob are currently trying to drop LostPersonJacob and LostPersonZoe at DepositFacility,"SussexFire has been extinguished. Alice and Bob are both carrying LostPersonJacob and LostPersonZoe, and they need to be at DepositFacility together to drop them off. Alice is at co-ordinates (11, 24), and Bob is at co-ordinates (12, 23)."
"[34, 34]","['NavigateTo(DepositFacility)', 'NavigateTo(DepositFacility)']",Alice and Bob should navigate to DepositFacility and perform the drop off action together now that they are both carrying the lost persons.,None,SussexFire has been extinguished. Alice and Bob are both carrying LostPersonJacob and LostPersonZoe and are close to the DepositFacility. They need to be at DepositFacility together to drop them off.
"[34, 34]","['Idle', 'NavigateTo(DepositFacility)']",Alice is already at DepositFacility with LostPersonJacob and is ready to drop them off. Bob needs to navigate to DepositFacility to join Alice so they can both drop off LostPersonJacob and LostPersonZoe together.,,SussexFire has been extinguished. Alice and Bob are both carrying LostPersonJacob and LostPersonZoe and are close to the DepositFacility. They need to be at DepositFacility together to drop them off.
"[34, 34]","['NavigateTo(DepositFacility)', 'NavigateTo(DepositFacility)']","Alice and Bob need to navigate to DepositFacility and perform the drop-off action together, as they are carrying LostPersonJacob and LostPersonZoe.",Alice and Bob are currently trying to drop off LostPersonJacob and LostPersonZoe at DepositFacility.,SussexFire has been extinguished. Alice and Bob are both carrying LostPersonJacob and LostPersonZoe and need to navigate to DepositFacility together to drop them off.
"[34, 34]","['NavigateTo(DepositFacility)', 'NavigateTo(DepositFacility)']",Alice and Bob should both navigate to DepositFacility and perform the DropOff action together to successfully drop off LostPersonJacob and LostPersonZoe.,Alice and Bob are currently navigating to DepositFacility to drop off LostPersonJacob and LostPersonZoe,SussexFire has been extinguished. Alice and Bob are both carrying LostPersonJacob and LostPersonZoe and need to navigate to DepositFacility together to drop them off.
"[34, 34]","['NavigateTo(DepositFacility)', 'NavigateTo(DepositFacility)']","Alice and Bob both need to navigate to the DepositFacility in order to drop off LostPersonJacob and LostPersonZoe, as they are both carrying the people and need to be at the deposit to complete the drop off.",Navigate to DepositFacility to drop off LostPersonJacob and LostPersonZoe,SussexFire has been extinguished. Alice and Bob are both carrying LostPersonJacob and LostPersonZoe and need to navigate to DepositFacility together to drop them off.
"[34, 34]","['NavigateTo(DepositFacility)', 'NavigateTo(DepositFacility)']","Alice and Bob need to navigate to the DepositFacility together. Once there, they can both perform the drop off action to successfully complete the task of saving LostPersonJacob and LostPersonZoe.",Alice and Bob are currently trying to drop off LostPersonJacob and LostPersonZoe at DepositFacility.,SussexFire has been extinguished. Alice and Bob are both carrying LostPersonJacob and LostPersonZoe and need to navigate to DepositFacility together to drop them off.
"[34, 34]","['DropOff(DepositFacility, LostPersonJacob)', 'DropOff(DepositFacility, LostPersonZoe)']","Alice and Bob have successfully navigated to DepositFacility with LostPersonJacob and LostPersonZoe. Now, they both need to perform the drop off action together to successfully complete the task.",Alice and Bob are currently trying to drop off LostPersonJacob and LostPersonZoe at DepositFacility,SussexFire has been extinguished. Alice and Bob are both carrying LostPersonJacob and LostPersonZoe and need to navigate to DepositFacility together to drop them off.
