Step,Action,Reason,Subtask,Memory
"[10, 10, 10, 10]","['NavigateTo(ReservoirTaj)', 'NavigateTo(ReservoirTaj)', 'NavigateTo(ReservoirTaj)', 'NavigateTo(ReservoirTaj)']","Alice, Bob, Charlie, and David need to collect Sand from ReservoirTaj to extinguish the RedFire regions. They need to prioritize the source regions of the fire, which are RedFire_Region_1, RedFire_Region_2, and RedFire_Region_3. They should also prepare to explore the environment to locate LostPersonThomas.","Alice is currently collecting sand from ReservoirTaj, Bob is currently collecting sand from ReservoirTaj, Charlie is currently collecting sand from ReservoirTaj, David is currently collecting sand from ReservoirTaj",RedFire consists of regions with low intensity chemical fire. Sand is needed to extinguish it. ReservoirTaj contains Sand. DepositFacility is empty.
"[10, 10, 10, 10]","['GetSupply(ReservoirTaj)', 'GetSupply(ReservoirTaj)', 'GetSupply(ReservoirTaj)', 'Explore()']","Now that Alice, Bob, Charlie, and David have successfully navigated to ReservoirTaj, they need to collect sand supply from ReservoirTaj to extinguish the chemical fire, RedFire. Once they have collected enough sand, they can then proceed to extinguish the different regions of RedFire. It is also necessary to start the exploration to locate LostPersonThomas.","Alice, Bob, Charlie, and David are currently collecting sand from ReservoirTaj. No robot is currently exploring to locate LostPersonThomas.",RedFire consists of regions with low intensity chemical fire. Sand is needed to extinguish it. ReservoirTaj contains Sand. DepositFacility is empty. All robots have successfully navigated to ReservoirTaj.
"[10, 10, 10, 10]","['NavigateTo(RedFire_Region_1)', 'NavigateTo(RedFire_Region_2)', 'NavigateTo(RedFire_Region_3)', 'NavigateTo(ReservoirTaj)']","Alice, Bob, and Charlie have collected sand and are ready to extinguish the RedFire regions. They should navigate to different RedFire regions and start extinguishing. David, who has no sand, should navigate to ReservoirTaj to collect sand and then assist with extinguishing the fire.","Alice is currently navigating to extinguish RedFire_Region_1 using sand, Bob is currently navigating to extinguish RedFire_Region_2 using sand, Charlie is currently navigating to extinguish RedFire_Region_3 using sand, David is currently navigating to collect sand from ReservoirTaj",RedFire consists of regions with low intensity chemical fire. Sand is needed to extinguish it. ReservoirTaj contains Sand. DepositFacility is empty. All robots except David have successfully navigated to ReservoirTaj and collected sand. LostPersonThomas has been located and requires two agents to carry. David has discovered the environment and is ready to assist.
"[10, 10, 10, 10]","['UseSupply(RedFire, Sand)', 'UseSupply(RedFire, Sand)', 'UseSupply(RedFire, Sand)', 'GetSupply(ReservoirTaj)']","Alice, Bob, and Charlie are each at a different region of RedFire and are equipped with sand to extinguish the chemical fire. They should use their sand supply on their respective fire regions. David, having just navigated to ReservoirTaj, should collect sand to be prepared for assisting with extinguishing the fire or carrying LostPersonThomas.","Alice is currently trying to extinguish RedFire_Region_1 using sand, Bob is currently trying to extinguish RedFire_Region_2 using sand, Charlie is currently trying to extinguish RedFire_Region_3 using sand, David is currently trying to collect sand from ReservoirTaj","RedFire consists of regions with low intensity chemical fire. Sand is needed to extinguish it. ReservoirTaj contains Sand. DepositFacility is empty. All robots except David have successfully navigated to ReservoirTaj and collected sand. LostPersonThomas has been located and requires two agents to carry. David has discovered the environment and is ready to assist. Alice, Bob, and Charlie are positioned at RedFire Regions 1, 2, and 3 respectively with sand to extinguish the fire."
"[10, 10, 10, 10]","['Carry(LostPersonThomas)', 'Carry(LostPersonThomas)', 'NavigateTo(DepositFacility)', 'ClearInventory()']","Alice, Bob, and Charlie have successfully used sand on the RedFire and extinguished it. Now, they need to carry LostPersonThomas to a deposit. David has sand and can help Alice, Bob, or Charlie to extinguish any remaining regions of the RedFire if required, or he can clear his inventory to assist in carrying LostPersonThomas. Since the RedFire is reported to have an average intensity of none, David should clear his inventory and prepare to help carry LostPersonThomas.","Alice and Bob will carry LostPersonThomas, Charlie will navigate to DepositFacility, and David will clear inventory to help with carrying LostPersonThomas.","RedFire has been extinguished with sand. LostPersonThomas has been located and requires two agents to carry. ReservoirTaj contains Sand. DepositFacility is empty and can be used to drop LostPersonThomas. David has 1 unit of Sand and is at coordinates (20, 6)."
"[10, 10, 10, 10]","['NavigateTo(LostPersonThomas)', 'NavigateTo(LostPersonThomas)', 'Idle', 'NavigateTo(LostPersonThomas)']","Alice and Bob need to navigate to LostPersonThomas to carry him. Charlie is already at the DepositFacility and can wait there for Alice and Bob to bring LostPersonThomas. David has 1 unit of Sand remaining; however, since the RedFire has been extinguished, David can clear his inventory or assist in carrying LostPersonThomas if needed.","Alice and Bob are currently navigating to LostPersonThomas, Charlie is currently waiting at DepositFacility, David is currently idle or can navigate towards LostPersonThomas to assist.",RedFire has been extinguished with sand. LostPersonThomas has been located and requires two agents to carry. ReservoirTaj contains Sand. DepositFacility is empty and can be used to drop LostPersonThomas.
"[10, 10, 10, 10]","['Carry(LostPersonThomas)', 'Carry(LostPersonThomas)', 'NavigateTo(DepositFacility)', 'NavigateTo(DepositFacility)']",Alice and Bob are both at the location of LostPersonThomas and should now attempt to carry him. Charlie and David should navigate towards the deposit to assist with the dropoff once Alice and Bob have successfully carried LostPersonThomas.,"Alice is currently trying to carry LostPersonThomas, Bob is currently trying to carry LostPersonThomas, Charlie is currently navigating to the deposit with LostPersonThomas, David is currently navigating to the deposit with LostPersonThomas","RedFire has been extinguished with sand. LostPersonThomas has been located at co-ordinates (5, 23). ReservoirTaj contains Sand. DepositFacility is empty and can be used to drop LostPersonThomas."
"[10, 10, 10, 10]","['NavigateTo(DepositFacility)', 'NavigateTo(DepositFacility)', 'Done', 'Done']","Alice and Bob are already carrying LostPersonThomas and need to navigate to DepositFacility to drop him off. Since Charlie and David are already at DepositFacility, they can wait for Alice and Bob to arrive for the drop-off.","Alice and Bob are currently navigating to deposit with LostPersonThomas, Charlie and David are currently waiting at DepositFacility for Alice and Bob to arrive for drop-off","RedFire has been extinguished with sand. LostPersonThomas has been located at co-ordinates (5, 23). ReservoirTaj contains Sand. DepositFacility is empty and can be used to drop LostPersonThomas. Alice and Bob are carrying LostPersonThomas. Charlie and David are at DepositFacility."
"[10, 10, 10, 10]","['NavigateTo(DepositFacility)', 'NavigateTo(DepositFacility)', 'Idle', 'Idle']","Alice and Bob are currently carrying LostPersonThomas and need to navigate to the DepositFacility to drop him off. Since Charlie and David are already at the DepositFacility, they should prepare to assist in the drop-off process by being idle and ready for the next step.","Alice and Bob are currently navigating to deposit with LostPersonThomas, Charlie and David are currently idle at the deposit.","RedFire has been extinguished with sand. LostPersonThomas has been located at co-ordinates (5, 23). ReservoirTaj contains Sand. DepositFacility is empty and can be used to drop LostPersonThomas. Alice and Bob are carrying LostPersonThomas. Charlie and David are at DepositFacility."
"[10, 10, 10, 10]","['DropOff(DepositFacility, LostPersonThomas)', 'DropOff(DepositFacility, LostPersonThomas)', 'ClearInventory()', 'ClearInventory()']","Alice and Bob are carrying LostPersonThomas and need to navigate to the DepositFacility to drop him off. Since they are already at the location, they should proceed to the dropoff action. Charlie and David are idle at the DepositFacility and can assist in the dropoff process if needed, or they can clear their inventories since there are no more fires to extinguish.","Alice and Bob are currently navigating to deposit with LostPersonThomas, Charlie and David are currently idle at DepositFacility","RedFire has been extinguished with sand. LostPersonThomas has been located at co-ordinates (5, 23). ReservoirTaj contains Sand. DepositFacility is empty and can be used to drop LostPersonThomas. Alice and Bob are carrying LostPersonThomas. Charlie and David are at DepositFacility."
"[10, 10, 10, 10]","['Done', 'Done', 'Done', 'Done']","All the robots have completed their previous tasks successfully. Since the RedFire has been extinguished and LostPersonThomas has been dropped off at the deposit, the main task is completed. All robots can now report 'Done' as there are no more subtasks open or remaining actions to perform.",None,RedFire has been extinguished with sand. LostPersonThomas has been dropped off at DepositFacility. ReservoirTaj contains Sand. ReservoirLibre contains Water.
