Step,Action,Reason,Subtask,Memory
"[21, 21]","['NavigateTo(ReservoirTaj)', 'NavigateTo(ReservoirTaj)']","Alice and Bob should start by collecting sand from ReservoirTaj to extinguish the chemical fire RedFire. As they can both see the fire's location and the reservoir, both should navigate to the reservoir to collect sand. Additionally, since no lost people have been located yet, Bob should start exploring to find LostPersonThomas after collecting sand.","Alice is currently trying to collect sand from ReservoirTaj, Bob is currently trying to collect sand from ReservoirTaj",RedFire is of Chemical type and requires sand to extinguish. ReservoirTaj contains Sand. No lost people have been located yet.
"[21, 21]","['GetSupply(ReservoirTaj)', 'GetSupply(ReservoirTaj)']","Both Alice and Bob are in proximity to the ReservoirTaj and need to collect sand to extinguish the chemical fire, RedFire. After collecting sand, they should proceed to extinguish the fire starting with the regions, RedFire_Region_1, RedFire_Region_2, and RedFire_Region_3. They also need to explore to locate LostPersonThomas, but currently, the priority is to extinguish the fire.","Alice is currently trying to collect sand from ReservoirTaj, Bob is currently trying to collect sand from ReservoirTaj",RedFire is of Chemical type and requires sand to extinguish. ReservoirTaj contains Sand. No lost people have been located yet.
"[21, 21]","['NavigateTo(RedFire_Region_1)', 'NavigateTo(RedFire_Region_2)']","Both Alice and Bob have collected sand successfully and are ready to extinguish the RedFire regions. They should navigate to the regions of RedFire to use their sand. Since the fire is spreading, they need to extinguish it quickly. Afterwards, they need to explore to find LostPersonThomas.","Alice is currently trying to extinguish RedFire_Region_1, Bob is currently trying to extinguish RedFire_Region_2","RedFire is of Chemical type and requires sand to extinguish. ReservoirTaj contains Sand. No lost people have been located yet. Alice's location is (20, 6) with one unit of Sand. Bob's location is (21, 5) with one unit of Sand."
"[21, 21]","['UseSupply(RedFire, Sand)', 'UseSupply(RedFire, Sand)']","Alice and Bob are both at the locations with regions of RedFire, and they both have a unit of sand each to use on the fire. They should now use their sand supply on their respective regions of RedFire they navigated to. After using the sand, they should navigate back to the ReservoirTaj to collect more sand if needed or continue to explore for LostPersonThomas.","Alice is currently trying to extinguish RedFire_Region_1 using sand, Bob is currently trying to extinguish RedFire_Region_2 using sand","RedFire is of Chemical type and requires sand to extinguish. ReservoirTaj contains Sand. No lost people have been located yet. Alice's location is (18, 7) with one unit of Sand. Bob's location is (14, 9) with one unit of Sand."
"[21, 21]","['GetSupply(ReservoirTaj)', 'GetSupply(ReservoirTaj)']","Both Alice and Bob have to continue extinguishing the RedFire. However, their inventories are empty, so they need to collect more sand from ReservoirTaj. After collecting the sand, they should navigate to and extinguish the remaining regions of RedFire. Additionally, they need to explore the environment to locate LostPersonThomas.","Alice is currently collecting sand from ReservoirTaj, Bob is currently collecting sand from ReservoirTaj","RedFire is of Chemical type and requires sand to extinguish. ReservoirTaj contains Sand. No lost people have been located yet. Alice's location is (18, 7). Bob's location is (14, 9). Both Alice and Bob have used their sand on RedFire successfully and have no resources left."
"[21, 21]","['UseSupply(RedFire, Sand)', 'NavigateTo(ReservoirTaj)']","Alice has 1 unit of sand and can head straight to RedFire to extinguish it. Bob needs to navigate to ReservoirTaj to collect sand first, as he currently has none.","Alice is currently extinguishing RedFire using sand, Bob is currently collecting sand from ReservoirTaj","RedFire is of Chemical type and requires sand to extinguish. ReservoirTaj contains Sand. No lost people have been located yet. Alice's location is (18, 7) with 1 unit of sand. Bob's location is (14, 9) with no resources. Alice and Bob have used their sand on RedFire successfully before and need to continue extinguishing it."
"[21, 21]","['NavigateTo(ReservoirTaj)', 'GetSupply(ReservoirTaj)']","Alice should navigate to ReservoirTaj to collect more sand since RedFire is of Chemical type and requires sand to extinguish. Bob has successfully navigated to ReservoirTaj and should now collect sand. Both should then use the sand to continue extinguishing the RedFire, targeting the regions with remaining low intensity.","Alice is currently navigating to ReservoirTaj to collect sand, Bob is currently collecting sand from ReservoirTaj,","RedFire is of Chemical type and requires sand to extinguish. ReservoirTaj contains Sand. ReservoirLibre contains Water. No lost people have been located yet. Alice's location is (18, 7) with 0 units of sand. Bob's location is (20, 6) with no resources. Alice and Bob have used their sand on RedFire successfully before and need to continue extinguishing it."
"[21, 21]","['GetSupply(ReservoirTaj)', 'NavigateTo(RedFire_Region_1)']","Alice needs to collect sand from ReservoirTaj to extinguish the RedFire, while Bob, who already has sand, should navigate to the RedFire to use his supply. Both robots are working on extinguishing the fire efficiently by collecting and using the sand resource.","Alice is currently collecting sand from ReservoirTaj, Bob is currently navigating to RedFire","RedFire is of Chemical type and requires sand to extinguish. ReservoirTaj contains Sand. ReservoirLibre contains Water. No lost people have been located yet. Alice's location is (18, 7) with 0 units of sand. Bob's location is (20, 6) with 1 unit of sand. Alice and Bob have used their sand on RedFire successfully before and need to continue extinguishing it."
"[21, 21]","['UseSupply(RedFire, Sand)', 'Explore()']",Alice is holding 1 unit of sand and should use it to extinguish RedFire_Region_3 which is of medium intensity and of a chemical type fire. Bob should explore to locate LostPersonThomas since he is in an area where he has extinguished the fire and has a free inventory space.,"Alice is currently trying to extinguish RedFire_Region_3 using sand, Bob is currently trying to locate LostPersonThomas","RedFire is of Chemical type and requires sand to extinguish. ReservoirTaj contains Sand. ReservoirLibre contains Water. No lost people have been located yet. Alice's location is (21, 5) with 1 unit of sand. Bob's location is (20, 6) with 1 unit of sand. Alice and Bob have used their sand on RedFire successfully before and need to continue extinguishing it."
"[21, 21]","['NavigateTo(ReservoirTaj)', 'NavigateTo(RedFire_Region_3)']","Since RedFire is a chemical type, Alice needs to navigate to ReservoirTaj to collect more sand to extinguish RedFire. Bob, who already has 1 unit of sand, should navigate to RedFire_Region_3 to use the sand and help extinguish the fire. They need to address the fire regions using sand as it's a chemical fire. After that, they can focus on rescuing LostPersonThomas together.","Alice is currently navigating to ReservoirTaj to collect sand, Bob is currently navigating to RedFire_Region_3 to extinguish the fire using sand","RedFire is of Chemical type and requires sand to extinguish. ReservoirTaj contains Sand. ReservoirLibre contains Water. LostPersonThomas has been located and requires 2 agents to carry. Alice's location is (21, 5). Bob's location is (10, 16) and has 1 unit of sand."
"[21, 21]","['GetSupply(ReservoirTaj)', 'UseSupply(RedFire, Sand)']",Alice should collect sand from ReservoirTaj since the RedFire is chemical and requires sand to be extinguished. Bob should use his sand supply on an adjacent region of RedFire since he is already at the location of RedFire and has sand in his inventory.,"Alice is currently collecting sand from ReservoirTaj, Bob is currently extinguishing RedFire_Region_2 using sand","RedFire is of Chemical type and requires sand to extinguish. ReservoirTaj contains Sand. ReservoirLibre contains Water. LostPersonThomas has been located and requires 2 agents to carry. Alice's location is (20, 6). Bob's location is (16, 11) and has 1 unit of sand. RedFire_Region_3 has been extinguished by Bob."
"[21, 21]","['UseSupply(RedFire, Sand)', 'GetSupply(ReservoirTaj)']","Alice has one unit of sand and should use it on RedFire to lower its intensity. Bob, who is currently at the center of RedFire, needs to collect sand from ReservoirTaj to extinguish the chemical fire. After using their current supplies, both should collect more sand to continue extinguishing the fire.","Alice is currently trying to extinguish RedFire using sand, Bob is currently trying to collect sand from ReservoirTaj","RedFire is of Chemical type and requires sand to extinguish. ReservoirTaj contains Sand. ReservoirLibre contains Water. LostPersonThomas has been located and requires 2 agents to carry. Alice's location is (20, 6) with 1 unit of sand. Bob's location is (16, 11). RedFire_Region_3 has been extinguished by Bob. RedFire average intensity is low. Bob is at the center of RedFire with low intensity."
"[21, 21]","['UseSupply(RedFire, Sand)', 'NavigateTo(ReservoirTaj)']","Alice should continue to use sand on the RedFire to lower the intensity of the regions around her. Since RedFire_Region_3 is extinguished, she can target the main fire or other regions. Bob needs to navigate to ReservoirTaj to collect sand, which is required to extinguish the RedFire.",Alice is currently extinguishing RedFire using sand. Bob is currently navigating to ReservoirTaj to collect sand.,"RedFire is of Chemical type and requires sand to extinguish. ReservoirTaj contains Sand. ReservoirLibre contains Water. LostPersonThomas has been located and requires 2 agents to carry. Alice's location is (20, 6) with 1 unit of sand. Bob's location is (16, 11). RedFire_Region_3 has been extinguished by Bob. RedFire average intensity is low. Bob is at the center of RedFire with low intensity."
"[21, 21]","['NavigateTo(RedFire_Region_1)', 'GetSupply(ReservoirTaj)']","Alice should navigate to a specific region of RedFire that has not been extinguished yet, such as RedFire_Region_1. Bob should collect sand from ReservoirTaj to have enough supply to extinguish the fire. Once both robots have enough sand, they can work on extinguishing the remaining regions of RedFire.","Alice is currently trying to extinguish RedFire_Region_1 using sand, Bob is currently trying to collect sand from ReservoirTaj.","RedFire is of Chemical type and requires sand to extinguish. ReservoirTaj contains Sand. ReservoirLibre contains Water. LostPersonThomas has been located and requires 2 agents to carry. Alice's location is (20, 6). Bob's location is (21, 5). RedFire_Region_3 has been extinguished by Bob. RedFire average intensity is low."
"[21, 21]","['Explore()', 'NavigateTo(RedFire_Region_3)']","Alice should explore to find RedFire_Region_1 since it is not currently visible to her. Bob, who has sand in his inventory, should navigate to RedFire_Region_3 to use the sand and extinguish that part of the fire.","Alice is currently trying to extinguish RedFire_Region_1 using sand, Bob is currently trying to extinguish RedFire_Region_3 using sand","RedFire is of Chemical type and requires sand to extinguish. ReservoirTaj contains Sand. ReservoirLibre contains Water. LostPersonThomas has been located and requires 2 agents to carry. Alice's location is (20, 6). Bob's location is (21, 5). RedFire_Region_3 has been extinguished by Bob. RedFire average intensity is low. Bob has 1 unit of sand in his inventory."
"[21, 21]","['NavigateTo(ReservoirTaj)', 'UseSupply(RedFire, Sand)']","Alice needs to navigate to the sand reservoir, ReservoirTaj, to collect sand since she currently has none. Bob, who is currently at the RedFire and has sand, should use his sand supply on the fire to reduce its intensity.","Alice is currently navigating to get sand, Bob is currently using sand on RedFire","RedFire is of Chemical type and requires sand to extinguish. ReservoirTaj contains Sand. ReservoirLibre contains Water. LostPersonThomas has been located and requires 2 agents to carry. Bob's location is (16, 11) and he has 1 unit of sand in his inventory. RedFire_Region_3 has been extinguished by Bob. RedFire average intensity is low. Alice's location is (28, 0) and she has no resources in her inventory."
"[21, 21]","['NavigateTo(ReservoirTaj)', 'NavigateTo(RedFire_Region_1)']","Alice should navigate to ReservoirTaj to collect sand, which is needed to extinguish the chemical fire. Bob should navigate to RedFire_Region_1 to use his remaining sand to extinguish it.","Alice is currently navigating to ReservoirTaj to collect sand, Bob is currently navigating to RedFire_Region_1 to extinguish the fire","RedFire is of Chemical type and requires sand to extinguish. ReservoirTaj contains Sand. ReservoirLibre contains Water. LostPersonThomas has been located and requires 2 agents to carry. Bob's location is (16, 11) and he has 1 unit of sand in his inventory. RedFire_Region_3 has been extinguished by Bob. RedFire average intensity is none. Alice's location is (20, 6) and she has no resources in her inventory."
"[21, 21]","['NavigateTo(LostPersonThomas)', 'NavigateTo(LostPersonThomas)']","Since the RedFire is extinguished, Alice and Bob should now focus on rescuing LostPersonThomas. Alice should navigate to LostPersonThomas to be ready to assist Bob in carrying him. Bob, who is currently not carrying any resources or person, should also navigate to LostPersonThomas so they can both carry him to a deposit.","Alice is currently navigating to LostPersonThomas, Bob is currently navigating to LostPersonThomas.","RedFire has been completely extinguished, as indicated by Bob's surroundings and the global observation of RedFire with an average intensity of none. ReservoirTaj contains Sand. ReservoirLibre contains Water. LostPersonThomas has been located and requires 2 agents to carry. Both Alice and Bob are free to focus on rescuing LostPersonThomas."
"[21, 21]","['Carry(LostPersonThomas)', 'Carry(LostPersonThomas)']","Since the RedFire has been completely extinguished, both Alice and Bob should now focus on carrying LostPersonThomas to a deposit. They are both at the location of LostPersonThomas and should start the carrying process.",Alice and Bob are currently trying to carry LostPersonThomas,RedFire has been completely extinguished. ReservoirTaj contains Sand. ReservoirLibre contains Water. LostPersonThomas has been located and requires 2 agents to carry. Both Alice and Bob are free to focus on rescuing LostPersonThomas.
"[21, 21]","['NavigateTo(DepositFacility)', 'NavigateTo(DepositFacility)']","As both Alice and Bob are carrying LostPersonThomas, they should now navigate to the DepositFacility to drop him off, fulfilling one of the open subtasks. Since the RedFire is already extinguished, there's no need to address the subtasks related to extinguishing the fire with sand.",navigate to deposit with LostPersonThomas,RedFire has been completely extinguished. ReservoirTaj contains Sand. ReservoirLibre contains Water. LostPersonThomas has been located and requires 2 agents to carry. Both Alice and Bob are carrying LostPersonThomas.
"[21, 21]","['DropOff(DepositFacility, LostPersonThomas)', 'DropOff(DepositFacility, LostPersonThomas)']",Alice and Bob are both already carrying LostPersonThomas and have successfully navigated to DepositFacility in the previous step. They should now drop LostPersonThomas in the deposit to complete the task.,drop LostPersonThomas in deposit,RedFire has been completely extinguished. ReservoirTaj contains Sand. ReservoirLibre contains Water. LostPersonThomas has been located and requires 2 agents to carry. Both Alice and Bob are carrying LostPersonThomas.
"[21, 21]","['Done', 'Done']","All the fires have been extinguished and LostPersonThomas has been successfully dropped off at the DepositFacility. As there are no open subtasks left, both Alice and Bob have completed their task.",None,RedFire has been completely extinguished. ReservoirTaj contains Sand. ReservoirLibre contains Water. LostPersonThomas has been located and successfully dropped off at DepositFacility by both Alice and Bob.
