Step,Action,Reason,Subtask,Memory
"[12, 12, 12]","['NavigateTo(ReservoirOmaha)', 'NavigateTo(ReservoirWhosville)', 'Explore()']",Alice should navigate to ReservoirOmaha to collect sand in order to extinguish the chemical EnglandFire. Bob should navigate to ReservoirWhosville to collect water to extinguish the non-chemical TownFire. Charlie should explore to find LostPersonJeremy since the person's location is still unknown.,"Alice is currently navigating to ReservoirOmaha, Bob is currently navigating to ReservoirWhosville, Charlie is currently exploring to locate LostPersonJeremy","['EnglandFire is a chemical fire requiring sand', 'TownFire is a non-chemical fire requiring water', 'ReservoirOmaha contains sand', 'ReservoirWhosville contains water']"
"[12, 12, 12]","['GetSupply(ReservoirOmaha)', 'GetSupply(ReservoirWhosville)', 'Explore()']","Alice should collect sand from ReservoirOmaha to use on EnglandFire. Bob should collect water from ReservoirWhosville to use on TownFire. Since Charlie has already explored successfully, Charlie should continue to explore to locate LostPersonJeremy.","Alice is currently collecting sand from ReservoirOmaha, Bob is currently collecting water from ReservoirWhosville, Charlie is currently exploring to locate LostPersonJeremy","['EnglandFire is a chemical fire requiring sand', 'TownFire is a non-chemical fire requiring water', 'ReservoirOmaha contains sand', 'ReservoirWhosville contains water', 'Alice is at coordinates (4, 19) near ReservoirOmaha', 'Bob is at coordinates (8, 18) near ReservoirWhosville', 'Charlie is at coordinates (23, 24) and has explored successfully']"
"[12, 12, 12]","['UseSupply(EnglandFire, Sand)', 'NavigateTo(TownFire_Region_1)', 'Explore()']","Alice can start extinguishing EnglandFire_Region_1 with the sand she has. Bob is equipped with water and should start extinguishing TownFire_Region_1. Charlie, having no resources, should continue exploring to locate LostPersonJeremy.","Alice is currently working on extinguishing EnglandFire_Region_1, Bob is currently working on extinguishing TownFire_Region_1, Charlie is currently exploring to locate LostPersonJeremy","['EnglandFire is a chemical fire requiring sand', 'TownFire is a non-chemical fire requiring water', 'ReservoirOmaha contains sand', 'ReservoirWhosville contains water', 'Alice is at coordinates (4, 19)', 'Bob is at coordinates (8, 18)', 'Charlie is at coordinates (13, 29) and has explored successfully', 'Charlie successfully explored and should continue to explore to find LostPersonJeremy']"
"[12, 12, 12]","['NavigateTo(EnglandFire_Region_1)', 'UseSupply(TownFire, Water)', 'Explore()']","Alice should navigate to EnglandFire_Region_1 to use her sand supply on the fire. Bob is already at the location with water, so he should use his water supply on the TownFire where he is. Charlie should continue exploring to find LostPersonJeremy.","Alice is currently navigating to EnglandFire_Region_1, Bob is currently using water supply on TownFire, Charlie is currently exploring to locate LostPersonJeremy","['EnglandFire is a chemical fire requiring sand', 'TownFire is a non-chemical fire requiring water', 'Alice is at coordinates (4, 19) with sand', 'Bob is at coordinates (17, 19) by TownFire with water', 'Charlie is at coordinates (13, 9) and should continue to explore to find LostPersonJeremy']"
"[12, 12, 12]","['UseSupply(EnglandFire, Sand)', 'NavigateTo(ReservoirWhosville)', 'NavigateTo(DepositFacility)']",Alice should use her sand supply on the low intensity flammable object at EnglandFire_Region_1 since she's already navigated there. Bob should move towards ReservoirWhosville to collect water to extinguish TownFire. Charlie should move towards DepositFacility and wait there for another robot to help carry LostPersonJeremy.,"Alice is currently trying to extinguish EnglandFire_Region_1 using sand, Bob is currently trying to extinguish TownFire_Region_1 using water, Charlie is currently trying to navigate to DepositFacility with LostPersonJeremy","Alice is at coordinates (5, 14) near EnglandFire with sand. Bob is at coordinates (17, 19) by TownFire with no resources. Charlie is at coordinates (29, 9) and has successfully found LostPersonJeremy, who requires two agents to carry. EnglandFire is a chemical fire requiring sand, and TownFire is a non-chemical fire requiring water."
"[12, 12, 12]","['NavigateTo(ReservoirWhosville)', 'GetSupply(ReservoirWhosville)', 'Explore()']","Alice should collect water from ReservoirWhosville to extinguish TownFire since EnglandFire is already extinguished. Bob, being near ReservoirWhosville, should also collect water to help with extinguishing TownFire. Charlie, being at DepositFacility, should explore to find LostPersonJeremy.",Alice and Bob are currently trying to collect water from ReservoirWhosville to extinguish TownFire. Charlie is currently trying to explore to locate LostPersonJeremy.,"Alice is at coordinates (5, 14) near EnglandFire with no resources. Bob is at coordinates (8, 18) near ReservoirWhosville with no resources. Charlie is at coordinates (11, 27) near DepositFacility with no resources. TownFire is a non-chemical fire requiring water. EnglandFire, a chemical fire, has been extinguished."
"[12, 12, 12]","['NavigateTo(TownFire_Region_2)', 'NavigateTo(TownFire_Region_2)', 'Move(Down)']","Alice can now navigate to TownFire_Region_2 to prepare to use water on it. Bob can navigate to TownFire_Region_2 to use his water supply on the fire. Charlie should move in a direction that allows for exploration, possibly 'Down' or 'Left' since 'Right' has an obstacle.","Alice is currently navigating to TownFire_Region_2, Bob is currently navigating to TownFire_Region_2 to extinguish it, Charlie is continuing to explore.","Alice is at coordinates (9, 17) with no resources. Bob is at coordinates (8, 18) with water. Charlie is at coordinates (11, 27) with no resources. TownFire is a non-chemical fire requiring water located in the global view. EnglandFire has been extinguished. LostPersonJeremy requires two agents to carry."
"[12, 12, 12]","['GetSupply(ReservoirWhosville)', 'UseSupply(TownFire, Water)', 'NavigateTo(ReservoirWhosville)']","Alice and Bob are both near TownFire_Region_2 and should work on extinguishing it using water. Bob already has water in his inventory and can start extinguishing immediately, while Alice should collect water from the nearest reservoir. Charlie should navigate towards ReservoirWhosville to collect water and assist with extinguishing fires or move towards LostPersonJeremy to prepare for carrying.","Alice is currently trying to extinguish TownFire_Region_2, Bob is currently trying to extinguish TownFire_Region_2, Charlie is currently trying to collect water from ReservoirWhosville or move towards LostPersonJeremy.","Alice is at coordinates (19, 19) with no resources. Bob is at coordinates (18, 19) with water. Charlie is at coordinates (11, 28) with no resources. TownFire is a non-chemical fire requiring water located in the global view. EnglandFire has been extinguished. LostPersonJeremy requires two agents to carry. Alice and Bob are near TownFire_Region_2, Charlie should collect water to assist with extinguishing fires or carry LostPersonJeremy."
"[12, 12, 12]","['NavigateTo(ReservoirWhosville)', 'NavigateTo(LostPersonJeremy)', 'NavigateTo(LostPersonJeremy)']","Alice should navigate to ReservoirWhosville to collect water, as she previously failed due to not being close enough. Bob should navigate to LostPersonJeremy to prepare for carrying them. Charlie should also navigate to LostPersonJeremy so that they have two robots to carry the person, as required.","Alice is currently navigating to ReservoirWhosville, Bob is currently navigating to LostPersonJeremy, Charlie is currently navigating to LostPersonJeremy","Alice is at coordinates (19, 19) with no resources. Bob is at coordinates (18, 19) with no resources. Charlie is at coordinates (8, 18) with no resources. TownFire is a non-chemical fire requiring water located in the global view. EnglandFire has been extinguished. LostPersonJeremy requires two agents to carry. Alice and Bob are near DepositFacility, Charlie should collect water to assist with extinguishing fires or carry LostPersonJeremy."
"[12, 12, 12]","['NavigateTo(DepositFacility)', 'Carry(LostPersonJeremy)', 'Carry(LostPersonJeremy)']","Since all fires have been extinguished, Alice, Bob, and Charlie can now focus on rescuing LostPersonJeremy. Bob and Charlie are already at the location of LostPersonJeremy, so they should carry him. Alice should navigate to the DepositFacility to be ready for the dropoff once Bob and Charlie navigate there with LostPersonJeremy.","Bob and Charlie are currently trying to carry LostPersonJeremy, Alice is currently navigating to DepositFacility","Alice is at coordinates (9, 17) with no resources. Bob is at coordinates (25, 4) with no resources. Charlie is at coordinates (26, 3) with no resources. TownFire is a non-chemical fire requiring water located in the global view. EnglandFire has been extinguished. LostPersonJeremy requires two agents to carry. Alice and Bob are near DepositFacility, Charlie should collect water to assist with extinguishing fires or carry LostPersonJeremy."
"[12, 12, 12]","['NavigateTo(DepositFacility)', 'NavigateTo(DepositFacility)', 'NavigateTo(DepositFacility)']","Since both fires have been extinguished, Alice does not need to collect any resources and should navigate to DepositFacility to prepare for dropping off LostPersonJeremy. Bob and Charlie are both carrying LostPersonJeremy; they should navigate to DepositFacility to drop off LostPersonJeremy there.","Alice, Bob, and Charlie are currently navigating to DepositFacility with LostPersonJeremy","Alice is at coordinates (11, 27) with no resources. Bob is at coordinates (25, 4) with LostPersonJeremy. Charlie is at coordinates (26, 3) with LostPersonJeremy. TownFire and EnglandFire have been extinguished. LostPersonJeremy requires two agents to carry. Alice is near DepositFacility."
"[12, 12, 12]","['Idle', 'DropOff(DepositFacility, LostPersonJeremy)', 'DropOff(DepositFacility, LostPersonJeremy)']","Since the fires have been extinguished and LostPersonJeremy has been found and is being carried by Bob and Charlie, the next step is for them to drop off LostPersonJeremy at the DepositFacility. Alice can wait as she does not have any resources or tasks at the moment.","Bob and Charlie are currently navigating to DepositFacility to drop off LostPersonJeremy, Alice is currently waiting.","Alice is at coordinates (12, 26) near DepositFacility with no resources. Bob is at coordinates (11, 27) with LostPersonJeremy. Charlie is at coordinates (12, 28) with LostPersonJeremy. TownFire and EnglandFire have been extinguished. LostPersonJeremy requires two agents to carry and is currently being carried by Bob and Charlie. All agents are near DepositFacility."
"[12, 12, 12]","['Done', 'Done', 'Done']","All subtasks have been completed successfully. Alice, Bob, and Charlie have extinguished the fires and dropped off LostPersonJeremy at DepositFacility. They can now report that they are done with their tasks.",None,"All fires have been extinguished. LostPersonJeremy has been successfully dropped off at DepositFacility. Alice is at coordinates (12, 26) with no resources. Bob is at coordinates (11, 27) with no resources. Charlie is at coordinates (12, 28) with no resources."
