Step,Action,Reason,Subtask,Memory
"[10, 10, 10, 10, 10]","['NavigateTo(ReservoirTaj)', 'NavigateTo(ReservoirTaj)', 'Explore()', 'NavigateTo(ReservoirTaj)', 'NavigateTo(ReservoirTaj)']","To address the chemical fire, the robots need to collect sand from ReservoirTaj. Since no lost persons have been located yet, some robots should start exploring to find LostPersonThomas. The fire regions are currently at low intensity, but they will increase if not addressed quickly.","Alice is currently collecting sand, Bob is currently collecting sand, Charlie is currently exploring to locate LostPersonThomas, David is currently collecting sand, Emma is currently collecting sand",RedFire is of Chemical type and requires sand to extinguish. ReservoirTaj contains sand. RedFire regions have average intensity of Low.
"[10, 10, 10, 10, 10]","['GetSupply(ReservoirTaj)', 'GetSupply(ReservoirTaj)', 'Explore()', 'GetSupply(ReservoirTaj)', 'GetSupply(ReservoirTaj)']","Alice, Bob, David, and Emma should collect sand from ReservoirTaj to extinguish the chemical fire RedFire. Charlie should continue exploring to locate LostPersonThomas.","Alice is currently collecting sand, Bob is currently collecting sand, Charlie is currently exploring, David is currently collecting sand, Emma is currently collecting sand","RedFire is of Chemical type and requires sand to extinguish. ReservoirTaj contains sand. RedFire regions have average intensity of Low. Alice, Bob, David, and Emma are all near ReservoirTaj. Charlie has successfully explored and is at coordinates (29, 14)."
"[10, 10, 10, 10, 10]","['NavigateTo(RedFire_Region_1)', 'NavigateTo(RedFire_Region_2)', 'Explore()', 'NavigateTo(RedFire_Region_3)', 'NavigateTo(RedFire_Region_1)']","Alice, Bob, David, and Emma have collected sand and are ready to extinguish the RedFire regions. They should navigate to each region and use the sand. Charlie, who has explored and found no lost person, should continue exploring or navigate to collect sand for the fire.","Alice is currently extinguishing RedFire_Region_1, Bob is currently extinguishing RedFire_Region_2, David is currently extinguishing RedFire_Region_3, Emma is currently extinguishing RedFire_Region_1, Charlie is currently exploring","RedFire is of Chemical type and requires sand to extinguish. ReservoirTaj contains sand. RedFire regions have average intensity of Low. Alice, Bob, David, and Emma are all near ReservoirTaj with one unit of sand each. Charlie has successfully explored and is at coordinates (19, 24)."
"[10, 10, 10, 10, 10]","['UseSupply(RedFire, Sand)', 'UseSupply(RedFire, Sand)', 'NavigateTo(ReservoirTaj)', 'UseSupply(RedFire, Sand)', 'NavigateTo(LostPersonThomas)']","Alice, Bob, and David should use their sand supply on their respective regions of RedFire to lower its intensity. Charlie should navigate towards the sand reservoir to collect sand for extinguishing the fire. Emma should navigate to LostPersonThomas to initiate the carrying process, as it requires two agents.","Alice is currently extinguishing RedFire_Region_1, Bob is currently extinguishing RedFire_Region_2, David is currently extinguishing RedFire_Region_3, Charlie is currently navigating to ReservoirTaj, Emma is currently navigating to LostPersonThomas","RedFire is of Chemical type and requires sand to extinguish. ReservoirTaj contains sand. RedFire regions have average intensity of Low. Alice, Bob, David, and Emma are all near RedFire regions with one unit of sand each. Charlie has successfully explored and is at coordinates (0, 24). LostPersonThomas has been located and requires two agents to carry."
"[10, 10, 10, 10, 10]","['NavigateTo(LostPersonThomas)', 'NavigateTo(LostPersonThomas)', 'Explore()', 'Explore()', 'ClearInventory()']","Since the RedFire has been extinguished, the next subtask is to carry LostPersonThomas to a deposit. Alice and Bob, who have no resources, can navigate to LostPersonThomas to carry him. Charlie, David, and Emma, who are also free, can explore the environment to find any additional lost persons not yet discovered. Charlie is already on the move, while David and Emma can initiate exploration. Emma, who is holding one unit of sand, should clear her inventory as it's no longer needed for the extinguished RedFire.","Alice and Bob are currently trying to carry LostPersonThomas, Charlie is exploring, David is exploring, and Emma is clearing inventory","RedFire is of Chemical type and requires sand to extinguish. ReservoirTaj contains sand. RedFire regions have been extinguished. LostPersonThomas has been located and requires two agents to carry. Alice, Bob, Charlie, David, and Emma are at coordinates (16, 7), (14, 9), (20, 6), (18, 11), and (5, 23) respectively."
"[10, 10, 10, 10, 10]","['Carry(LostPersonThomas)', 'Carry(LostPersonThomas)', 'NavigateTo(DepositFacility)', 'NavigateTo(DepositFacility)', 'NavigateTo(DepositFacility)']","Alice and Bob have successfully navigated to LostPersonThomas and should now carry him to a deposit. Charlie, David, and Emma can move towards the DepositFacility to assist with the drop-off or to be ready for any other tasks.","Alice and Bob are currently carrying LostPersonThomas, Charlie, David, and Emma are currently navigating to the deposit.","RedFire is of Chemical type and requires sand to extinguish. ReservoirTaj contains sand. RedFire regions have been extinguished. LostPersonThomas has been located and requires two agents to carry. Alice and Bob are at coordinates (6, 22) and (6, 24) respectively and are ready to carry LostPersonThomas. Charlie, David, and Emma are at coordinates (10, 16), (18, 29), and (5, 23) respectively."
"[10, 10, 10, 10, 10]","['NavigateTo(DepositFacility)', 'NavigateTo(DepositFacility)', 'NavigateTo(DepositFacility)', 'NavigateTo(DepositFacility)', 'NavigateTo(DepositFacility)']","Alice and Bob have successfully carried LostPersonThomas and should now navigate to the DepositFacility to drop them off. Charlie, David, and Emma have successfully navigated to the DepositFacility and can now assist in the dropoff process if needed or explore to locate any additional tasks.","Alice and Bob are currently navigating to deposit with LostPersonThomas, Charlie, David, and Emma are currently navigating to deposit with LostPersonThomas","RedFire is of Chemical type and requires sand to extinguish. ReservoirTaj contains sand. RedFire regions have been extinguished. LostPersonThomas has been located and requires two agents to carry. Alice and Bob are at coordinates (6, 22) and (6, 24) respectively and are ready to carry LostPersonThomas. Charlie, David, and Emma are at coordinates (23, 14), (24, 13), and (24, 15) respectively and have navigated towards the deposit."
"[10, 10, 10, 10, 10]","['DropOff(DepositFacility, LostPersonThomas)', 'DropOff(DepositFacility, LostPersonThomas)', 'Explore()', 'Explore()', 'Explore()']","Alice and Bob have successfully navigated to DepositFacility with LostPersonThomas and should now perform the DropOff action. Charlie, David, and Emma are not holding any resources or persons and should explore to potentially find any other tasks or assist with the carrying and dropping off of LostPersonThomas if required.","Alice and Bob are currently trying to drop LostPersonThomas in deposit, Charlie, David, and Emma do not have a subtask and should explore","RedFire is of Chemical type and requires sand to extinguish. ReservoirTaj contains sand. RedFire regions have been extinguished. LostPersonThomas has been located and requires two agents to carry. Alice and Bob are at coordinates (25, 14) and (23, 13) respectively and are ready to drop off LostPersonThomas. Charlie, David, and Emma are at coordinates (23, 15), (23, 14), and (24, 13) respectively and have navigated towards the deposit."
"[10, 10, 10, 10, 10]","['ClearInventory()', 'ClearInventory()', 'Explore()', 'Move(Down)', 'ClearInventory()']","Since RedFire has been extinguished and LostPersonThomas has been dropped off at the deposit, the main tasks are completed. Alice and Bob can clear their inventory and prepare for any further tasks. Charlie can continue exploring to ensure all lost persons have been found. David should try exploring in a different direction due to the obstacle. Emma can also clear her inventory and stay on standby for further instructions.",No open subtasks are available as all have been completed.,"RedFire is of Chemical type and requires sand to extinguish. ReservoirTaj contains sand. RedFire regions have been extinguished. LostPersonThomas has been located and has been dropped off at the deposit by Alice and Bob. Charlie, David, and Emma have navigated towards the deposit."
"[10, 10, 10, 10, 10]","['ClearInventory()', 'ClearInventory()', 'Explore()', 'ClearInventory()', 'ClearInventory()']","Since the RedFire has been extinguished and LostPersonThomas has been dropped off at the deposit by Alice and Bob, the remaining tasks are to collect sand to be prepared for any future fires and to clear the inventory for all robots. Alice, Bob, David, and Emma can clear their inventory as they are not holding any resources or person. Charlie can continue to explore to ensure that there are no additional tasks or lost people to attend to.","Alice, Bob, David, and Emma are currently clearing inventory, Charlie is currently exploring.","RedFire is of Chemical type and requires sand to extinguish. ReservoirTaj contains sand. RedFire regions have been extinguished. LostPersonThomas has been located and has been dropped off at the deposit by Alice and Bob. Charlie, David, and Emma have navigated towards the deposit."
"[10, 10, 10, 10, 10]","['Done', 'Done', 'Done', 'Done', 'Done']","All subtasks have been completed, including extinguishing the RedFire and finding, carrying, and dropping off LostPersonThomas at the deposit. All robots have cleared their inventories and are ready for new tasks. There are no open subtasks left, so all robots should report 'Done'.",All subtasks are completed.,"RedFire is of Chemical type and requires sand to extinguish. ReservoirTaj contains sand. RedFire regions have been extinguished. LostPersonThomas has been located and has been dropped off at the deposit by Alice and Bob. Charlie, David, and Emma have navigated towards the deposit."
