Step,Action,Reason,Subtask,Memory
"[21, 21]","['NavigateTo(ReservoirUtah)', 'NavigateTo(ReservoirYork)']","Alice should collect sand from ReservoirUtah to extinguish the chemical-based CaldorFire regions, while Bob should collect water from ReservoirYork to extinguish the non-chemical-based GreatFire regions. Since both robots are starting with empty inventories, they need to collect the appropriate resources first before they can address the fires.","Alice is currently trying to collect sufficient sand from ReservoirUtah, Bob is currently trying to collect sufficient water from ReservoirYork",CaldorFire with average intensity of Low of Chemical type. GreatFire with average intensity of Low of Non-chemical type. ReservoirUtah containing Sand. ReservoirYork containing Water.
"[21, 21]","['GetSupply(ReservoirUtah)', 'GetSupply(ReservoirYork)']","Alice has successfully navigated to ReservoirUtah and should now collect Sand to use on CaldorFire. Bob has successfully navigated to ReservoirYork and should now collect Water to use on GreatFire. After collecting resources, they should use them on the respective fires starting with region 1 of each fire. They have not yet located LostPersonTimmy, so they should explore to find them after addressing the fires.","Alice is currently collecting sand from ReservoirUtah, Bob is currently collecting water from ReservoirYork",CaldorFire regions with intensity of Low of Chemical type. GreatFire regions with intensity of Low of Non-chemical type. ReservoirUtah contains Sand. ReservoirYork contains Water.
"[21, 21]","['NavigateTo(CaldorFire_Region_1)', 'NavigateTo(GreatFire_Region_1)']","Alice can start extinguishing the CaldorFire Region 1 with the sand she has, and Bob can do the same with GreatFire Region 1 using the water he has. Both robots have inventory with the necessary resources to start addressing the fires. Meanwhile, they should also keep an eye out for LostPersonTimmy while they navigate the environment.","Alice is currently trying to extinguish CaldorFire_Region_1, Bob is currently trying to extinguish GreatFire_Region_1",CaldorFire regions with intensity of Low of Chemical type. GreatFire regions with intensity of Low of Non-chemical type. ReservoirUtah contains Sand. ReservoirYork contains Water.
"[21, 21]","['UseSupply(CaldorFire, Sand)', 'UseSupply(GreatFire, Water)']","Alice is already at CaldorFire_Region_1 and has a sand supply to use on the chemical fire. Bob is at GreatFire_Region_1 and has a water supply to use on the non-chemical fire. After extinguishing these fire regions, they should explore to find LostPersonTimmy.","Alice is currently trying to extinguish CaldorFire_Region_1 using sand, Bob is currently trying to extinguish GreatFire_Region_1 using water",CaldorFire regions with intensity of Low of Chemical type. GreatFire regions with intensity of Low of Non-chemical type. ReservoirUtah contains Sand. ReservoirYork contains Water.
"[21, 21]","['GetSupply(ReservoirUtah)', 'Explore()']","Alice has just successfully used sand on CaldorFire, so her next step should be to collect more sand from ReservoirUtah to continue extinguishing CaldorFire. Bob has successfully used water on GreatFire, which now has an average intensity of none, indicating it is extinguished. Bob should now start exploring to locate the lost person LostPersonTimmy.","Alice is currently trying to extinguish CaldorFire using sand, Bob is currently trying to explore to locate the lost person LostPersonTimmy",CaldorFire regions with intensity of Low of Chemical type. GreatFire regions with intensity of None of Non-chemical type. ReservoirUtah contains Sand. ReservoirYork contains Water.
"[21, 21]","['NavigateTo(ReservoirUtah)', 'Explore()']","Alice should navigate to ReservoirUtah to be close enough to collect Sand, which is required to extinguish the CaldorFire regions. Bob, having successfully explored and not found LostPersonTimmy, should continue to explore unobserved parts of the environment to locate LostPersonTimmy.","Alice is currently navigating to collect sand, Bob is currently exploring to locate the lost person LostPersonTimmy",CaldorFire regions with intensity of Low of Chemical type. GreatFire regions with intensity of None of Non-chemical type. ReservoirUtah contains Sand. ReservoirYork contains Water.
"[21, 21]","['GetSupply(ReservoirUtah)', 'Explore()']","Alice should now collect sand from ReservoirUtah since she has successfully navigated to it and can extinguish CaldorFire regions. Bob should continue exploring to locate LostPersonTimmy, as he has not encountered any lost persons yet.","Alice is currently trying to collect sand to extinguish CaldorFire, Bob is currently trying to explore to locate LostPersonTimmy","CaldorFire regions with intensity of Low of Chemical type. GreatFire regions with intensity of None of Non-chemical type. ReservoirUtah contains Sand. ReservoirYork contains Water. Alice is at (14, 5) and near ReservoirUtah. Bob is at (12, 10) and has explored successfully."
"[21, 21]","['NavigateTo(CaldorFire_Region_2)', 'NavigateTo(ReservoirUtah)']","Alice is holding 1 unit of Sand and is near the CaldorFire regions, she should navigate to CaldorFire_Region_2 to use her sand supply to extinguish it. Bob, after exploring successfully, should now collect sand from ReservoirUtah to assist in extinguishing CaldorFire.","Alice is currently trying to extinguish CaldorFire_Region_2 using sand, Bob is currently trying to collect sufficient sand from ReservoirUtah","CaldorFire regions with intensity of Low of Chemical type. GreatFire regions with intensity of None of Non-chemical type. ReservoirUtah contains Sand. ReservoirYork contains Water. Alice is at (14, 5) with 1 unit of Sand. Bob is at (2, 0) and has explored successfully."
"[21, 21]","['UseSupply(CaldorFire, Sand)', 'GetSupply(ReservoirUtah)']",Alice can use her sand supply on CaldorFire_Region_2 since she has navigated there and has sand in her inventory. Bob can get a supply of sand from ReservoirUtah since he has navigated there and needs sand to extinguish CaldorFire.,"Alice is currently trying to extinguish CaldorFire_Region_2 using sand, Bob is currently trying to collect sufficient sand from ReservoirUtah","CaldorFire regions with intensity of Low of Chemical type. GreatFire regions with intensity of None of Non-chemical type. ReservoirUtah contains Sand. ReservoirYork contains Water. Alice is at (6, 5) with 1 unit of Sand. Bob is at (14, 5) and has navigated to ReservoirUtah."
"[21, 21]","['UseSupply(CaldorFire, Sand)', 'NavigateTo(CaldorFire_Region_2)']","Alice should continue to use her sand supply on the low intensity flammable objects of the CaldorFire to prevent it from spreading further. Bob should navigate to the CaldorFire and prepare to use his sand supply to help extinguish the fire. Since GreatFire has an average intensity of None, it's considered extinguished, so no further action is needed there. Since neither robot has located LostPersonTimmy yet, exploration is needed to find them.","Alice is currently trying to extinguish all of CaldorFire using sand, Bob is currently navigating to CaldorFire, and both need to explore to locate LostPersonTimmy.","CaldorFire regions with intensity of Low of Chemical type. GreatFire regions with intensity of None of Non-chemical type. ReservoirUtah contains Sand. ReservoirYork contains Water. Alice is at (6, 5) with 1 unit of Sand. Bob is at (14, 5) and has navigated to ReservoirUtah. Bob has 1 unit of Sand in inventory."
"[21, 21]","['NavigateTo(CaldorFire_Region_2)', 'UseSupply(CaldorFire, Sand)']","Alice needs to navigate to CaldorFire_Region_2 to use her sand supply to extinguish the fire. Bob, who is already at CaldorFire_Region_2, can use his sand supply on the fire. Since GreatFire has an average intensity of None, no action is needed there. Both robots should also start exploring to find LostPersonTimmy after dealing with the fire.","Alice is currently navigating to CaldorFire_Region_2, Bob is currently using sand supply on CaldorFire_Region_2","CaldorFire regions with intensity of Low of Chemical type. GreatFire regions with intensity of None of Non-chemical type. ReservoirUtah contains Sand. ReservoirYork contains Water. Alice is at (6, 5) with no resources. Bob is at (5, 5) with 1 unit of Sand."
"[21, 21]","['Explore()', 'Explore()']","Since both fires are reported as having an average intensity of None, there is no need to extinguish them anymore. Now, the priority is to find LostPersonTimmy. Both Alice and Bob should explore to locate LostPersonTimmy. Once found, they can plan to carry and drop them off at a deposit.",Alice and Bob are currently exploring to locate the lost person LostPersonTimmy,"CaldorFire is fully extinguished. GreatFire has an average intensity of None. ReservoirUtah contains Sand. ReservoirYork contains Water. Alice is at (6, 5) with no resources. Bob is at (5, 5) with 1 unit of Sand. LostPersonTimmy still needs to be found."
"[21, 21]","['NavigateTo(LostPersonTimmy)', 'NavigateTo(LostPersonTimmy)']","Now that the fires are extinguished and LostPersonTimmy has been located, Alice and Bob should navigate to LostPersonTimmy to carry them. After securing LostPersonTimmy, they should navigate to the DepositFacility to drop them off.","Alice is currently trying to carry LostPersonTimmy, Bob is currently trying to carry LostPersonTimmy",CaldorFire is fully extinguished. GreatFire has an average intensity of None. ReservoirUtah contains Sand. ReservoirYork contains Water. DepositFacility is empty. LostPersonTimmy has been located and requires 2 agents to carry.
"[21, 21]","['NavigateTo(DepositFacility)', 'NavigateTo(DepositFacility)']","Since both fires are reported as having an average intensity of none, they are considered fully extinguished. Alice and Bob have successfully navigated to LostPersonTimmy and are now ready to carry them. The next step is to navigate both Alice and Bob to the DepositFacility with LostPersonTimmy so they can drop him off. As both robots are together and have no resources that would prevent them from carrying LostPersonTimmy, they can proceed to navigate to the deposit.",Alice and Bob are currently trying to navigate to deposit with LostPersonTimmy,CaldorFire is fully extinguished. GreatFire has an average intensity of None. ReservoirUtah contains Sand. ReservoirYork contains Water. DepositFacility is empty. LostPersonTimmy has been located and requires 2 agents to carry.
"[21, 21]","['NavigateTo(LostPersonTimmy)', 'NavigateTo(LostPersonTimmy)']","Since both Alice and Bob have successfully navigated to the DepositFacility and LostPersonTimmy has been located requiring 2 agents to carry, both should now navigate to LostPersonTimmy's location to carry him. As both fires are extinguished and the DepositFacility is empty, the primary task is to carry LostPersonTimmy to the deposit.",Alice and Bob are currently supposed to locate LostPersonTimmy and navigate to deposit with LostPersonTimmy,CaldorFire is fully extinguished. GreatFire is fully extinguished. ReservoirUtah contains Sand. ReservoirYork contains Water. DepositFacility is empty. LostPersonTimmy has been located and requires 2 agents to carry.
"[21, 21]","['NavigateTo(DepositFacility)', 'NavigateTo(DepositFacility)']","Both Alice and Bob have successfully located LostPersonTimmy and are in a position to carry him to the deposit. Since both fires are extinguished and there are no other tasks, Alice and Bob should focus on completing the task with LostPersonTimmy. They should navigate to the deposit with LostPersonTimmy and then drop him off.",Alice and Bob are currently navigating to deposit with LostPersonTimmy,CaldorFire is fully extinguished. GreatFire is fully extinguished. ReservoirUtah contains Sand. ReservoirYork contains Water. DepositFacility is empty. LostPersonTimmy has been located and requires 2 agents to carry.
"[21, 21]","['Carry(LostPersonTimmy)', 'Carry(LostPersonTimmy)']","Since both fires have been extinguished and both robots are at the DepositFacility, they should now carry LostPersonTimmy together and drop him off at the DepositFacility.",Alice and Bob are currently carrying LostPersonTimmy to the DepositFacility.,CaldorFire is fully extinguished. GreatFire is fully extinguished. ReservoirUtah contains Sand. ReservoirYork contains Water. DepositFacility is empty. LostPersonTimmy has been located and requires 2 agents to carry.
"[21, 21]","['NavigateTo(LostPersonTimmy)', 'NavigateTo(LostPersonTimmy)']","Both Alice and Bob need to navigate to LostPersonTimmy's location to be able to carry him. Since both fires are extinguished, and they are both holding no resources, their next step should be to move towards LostPersonTimmy and carry him to a deposit.",Alice and Bob are currently trying to navigate to LostPersonTimmy,"CaldorFire is fully extinguished. GreatFire is fully extinguished. ReservoirUtah contains Sand. ReservoirYork contains Water. DepositFacility is empty. LostPersonTimmy has been located and requires 2 agents to carry. Alice at co-ordinates (22, 12). Bob at co-ordinates (23, 11)."
"[21, 21]","['Carry(LostPersonTimmy)', 'Carry(LostPersonTimmy)']","Both Alice and Bob need to perform the carry action simultaneously to successfully carry LostPersonTimmy. After successfully carrying LostPersonTimmy, they must navigate to the DepositFacility to drop him off.",Alice and Bob are currently trying to carry LostPersonTimmy.,"CaldorFire is fully extinguished. GreatFire is fully extinguished. ReservoirUtah contains Sand. ReservoirYork contains Water. DepositFacility is empty. LostPersonTimmy has been located and requires 2 agents to carry. Alice at co-ordinates (7, 22). Bob at co-ordinates (8, 21)."
"[21, 21]","['NavigateTo(DepositFacility)', 'NavigateTo(DepositFacility)']","Alice and Bob have successfully carried LostPersonTimmy and must now navigate to DepositFacility to drop him off. Since they are already carrying Timmy, they can't perform any other actions apart from navigating and the drop-off action. They should navigate to the DepositFacility, which is empty and ready to receive the lost person.",Alice and Bob are currently trying to navigate to DepositFacility with LostPersonTimmy.,"CaldorFire is fully extinguished. GreatFire is fully extinguished. ReservoirUtah contains Sand. ReservoirYork contains Water. DepositFacility is empty. LostPersonTimmy has been located and requires 2 agents to carry. Alice at co-ordinates (7, 22). Bob at co-ordinates (8, 21). Alice and Bob are both carrying LostPersonTimmy."
"[21, 21]","['DropOff(DepositFacility, LostPersonTimmy)', 'DropOff(DepositFacility, LostPersonTimmy)']","Both Alice and Bob have successfully navigated to DepositFacility with LostPersonTimmy, they should now perform the dropoff action together to complete the task of dropping LostPersonTimmy in DepositFacility.",drop LostPersonTimmy in DepositFacility,CaldorFire is fully extinguished. GreatFire is fully extinguished. ReservoirUtah contains Sand. ReservoirYork contains Water. DepositFacility is empty. LostPersonTimmy has been located and requires 2 agents to carry. Alice and Bob are both carrying LostPersonTimmy.
"[21, 21]","['Done', 'Done']","Both Alice and Bob have successfully completed the task of extinguishing fires and rescuing LostPersonTimmy. Since all fires are extinguished and LostPersonTimmy has been dropped at the DepositFacility, they can now consider the task complete.",None,CaldorFire is fully extinguished. GreatFire is fully extinguished. ReservoirUtah contains Sand. ReservoirYork contains Water. DepositFacility has LostPersonTimmy. Alice and Bob have successfully dropped off LostPersonTimmy at DepositFacility.
