Step,Action,Reason,Subtask,Memory
"[12, 12, 12]","['NavigateTo(ReservoirTaj)', 'NavigateTo(ReservoirTaj)', 'NavigateTo(ReservoirTaj)']","Alice, Bob, and Charlie should start by collecting sand to extinguish the chemical fire. Since they all are empty, they can collect sand without needing to clear inventory. After collecting sand, they can proceed to extinguish the fire, starting with the source regions. They should also begin to explore to locate LostPersonThomas.","Alice is currently collecting sand from ReservoirTaj, Bob is currently collecting sand from ReservoirTaj, Charlie is currently collecting sand from ReservoirTaj","['RedFire is of Chemical type and requires Sand to extinguish', 'ReservoirTaj contains Sand', 'DepositFacility is empty']"
"[12, 12, 12]","['GetSupply(ReservoirTaj)', 'GetSupply(ReservoirTaj)', 'GetSupply(ReservoirTaj)']","Alice, Bob, and Charlie are all near ReservoirTaj, they should collect sand to extinguish the chemical fire RedFire. Since they have an inventory capacity of 3, they can collect sand multiple times before navigating to the fire. Once they have sand, they can navigate to and extinguish RedFire regions one by one, starting with RedFire_Region_1, RedFire_Region_2, and RedFire_Region_3, before addressing the average intensity of the entire RedFire.","Alice is currently trying to collect sand from ReservoirTaj, Bob is currently trying to collect sand from ReservoirTaj, Charlie is currently trying to collect sand from ReservoirTaj",RedFire is of Chemical type and requires Sand to extinguish. ReservoirTaj contains Sand. DepositFacility is empty
"[12, 12, 12]","['UseSupply(RedFire, Sand)', 'UseSupply(RedFire, Sand)', 'UseSupply(RedFire, Sand)']","As the RedFire is of Chemical type and requires Sand to extinguish, Alice, Bob, and Charlie, who are already carrying Sand, should navigate to and extinguish different regions of RedFire. Since all three regions of RedFire have low intensity, it's crucial to start extinguishing them before the fire spreads. After extinguishing the fire, they should explore to locate LostPersonThomas. At this point, no robot should collect water since the fire requires Sand.","Alice is currently extinguishing RedFire_Region_1, Bob is currently extinguishing RedFire_Region_2, Charlie is currently extinguishing RedFire_Region_3",RedFire is of Chemical type and requires Sand to extinguish. ReservoirTaj contains Sand. DepositFacility is empty. All robots are at coordinates close to RedFire and are carrying Sand.
"[12, 12, 12]","['UseSupply(RedFire, Sand)', 'NavigateTo(RedFire_Region_1)', 'UseSupply(RedFire, Sand)']","Alice has just used sand on RedFire successfully, so she should continue to extinguish the fire regions starting with RedFire_Region_1. Bob, who failed due to distance, needs to move closer to RedFire before attempting to use his sand supply. Charlie, having used sand successfully, should also continue to extinguish other fire regions. All robots should focus on extinguishing the fire using the sand they have or can collect, and once the fire is under control, they can start exploring to locate LostPersonThomas.","Alice is currently trying to extinguish RedFire_Region_1 using sand, Bob is currently trying to move closer to RedFire to use sand, Charlie is currently trying to extinguish RedFire_Region_2 using sand",RedFire is of Chemical type and requires Sand to extinguish. ReservoirTaj contains Sand. DepositFacility is empty. All robots are at coordinates close to RedFire and are carrying Sand. Bob needs to be closer to the fire to use his sand supply. The average intensity of RedFire is Low.
"[12, 12, 12]","['GetSupply(ReservoirTaj)', 'UseSupply(RedFire, Sand)', 'GetSupply(ReservoirTaj)']","Alice needs to collect sand from ReservoirTaj before attempting to extinguish the fire again. Bob, who is already carrying sand, should use his supply on RedFire_Region_1, which he successfully navigated to previously. Charlie should also collect sand from ReservoirTaj to help with extinguishing the fire. In the meantime, one of the robots needs to begin exploring to locate LostPersonThomas.",Alice and Charlie are currently collecting sand from ReservoirTaj. Bob is currently using sand supply on RedFire_Region_1.,"RedFire is of Chemical type and requires Sand to extinguish. ReservoirTaj contains Sand. DepositFacility is empty. Alice is at coordinates (20, 6) with no resources. Bob is at coordinates (16, 7) with 1 unit of Sand. Charlie is at coordinates (21, 7) with no resources. The average intensity of RedFire is Low."
"[12, 12, 12]","['NavigateTo(RedFire_Region_2)', 'GetSupply(ReservoirTaj)', 'NavigateTo(RedFire_Region_3)']","Alice and Charlie should navigate to the specific regions of RedFire that are still active and use their sand supply to extinguish them. Bob should collect sand from ReservoirTaj to be able to help extinguish the fire. Meanwhile, as all robots are occupied with the fire, no one is available to explore for LostPersonThomas at this step.","Alice is currently navigating to RedFire_Region_2 to extinguish it, Bob is currently collecting sand from ReservoirTaj, Charlie is currently navigating to RedFire_Region_3 to extinguish it.","RedFire is of Chemical type and requires Sand to extinguish. ReservoirTaj contains Sand. DepositFacility is empty. Alice is at coordinates (20, 6) with 1 unit of Sand. Bob is at coordinates (16, 7) with no resources. Charlie is at coordinates (21, 7) with 1 unit of Sand. The average intensity of RedFire is Low. RedFire_Region_2 and RedFire_Region_3 need to be extinguished using Sand."
"[12, 12, 12]","['UseSupply(RedFire, Sand)', 'NavigateTo(ReservoirTaj)', 'UseSupply(RedFire, Sand)']","Alice is now at the correct location to use her sand supply on RedFire_Region_2. Bob needs to navigate to ReservoirTaj to get sand supply. Charlie is at the correct location to use his sand supply on RedFire_Region_3. After extinguishing the fires, they can focus on locating LostPersonThomas.","Alice is currently trying to extinguish RedFire_Region_2 using sand, Bob is currently trying to collect sand from ReservoirTaj, Charlie is currently trying to extinguish RedFire_Region_3 using sand","RedFire is of Chemical type and requires Sand to extinguish. ReservoirTaj contains Sand. DepositFacility is empty. Alice is at coordinates (14, 9) with 1 unit of Sand. Bob is at coordinates (16, 7) with no resources. Charlie is at coordinates (18, 11) with 1 unit of Sand. The average intensity of RedFire is Low. RedFire_Region_2 and RedFire_Region_3 need to be extinguished using Sand."
"[12, 12, 12]","['Explore()', 'Explore()', 'Explore()']","Now that the RedFire has been extinguished, the next subtasks involve finding and rescuing LostPersonThomas. Since none of the robots have located LostPersonThomas yet, they should all begin or continue to explore the environment to find him. Once found, they will need to coordinate to carry and navigate to a deposit to drop off LostPersonThomas.","Alice, Bob, and Charlie are all currently assigned to explore to locate LostPersonThomas.","RedFire is of Chemical type and requires Sand to extinguish. ReservoirTaj contains Sand. DepositFacility is empty. Alice, Bob, and Charlie have all successfully used sand on RedFire. The average intensity of RedFire is None, indicating all regions of RedFire have been extinguished. RedFire_Region_2 and RedFire_Region_3 have been extinguished using Sand. All robots have empty inventories and are ready for the next subtask."
"[12, 12, 12]","['NavigateTo(LostPersonThomas)', 'NavigateTo(LostPersonThomas)', 'NavigateTo(DepositFacility)']","Since all the fires have been successfully extinguished, the next step should focus on the remaining task, which is to carry LostPersonThomas and drop them off at a deposit. Alice and Bob should navigate towards LostPersonThomas to carry them, while Charlie should navigate to the deposit to prepare for receiving LostPersonThomas.","Alice and Bob are currently navigating to carry LostPersonThomas, Charlie is currently navigating to DepositFacility","All regions of RedFire have been extinguished. Alice, Bob, and Charlie have empty inventories and are ready for the next subtask. LostPersonThomas requires 2 agents to carry. DepositFacility is empty."
"[12, 12, 12]","['Carry(LostPersonThomas)', 'Carry(LostPersonThomas)', 'Idle']",Alice and Bob are both in proximity to LostPersonThomas and can now carry him to a deposit. Charlie has navigated to DepositFacility and can prepare to receive LostPersonThomas.,"Alice and Bob are currently trying to carry LostPersonThomas, Charlie is currently waiting at DepositFacility","All regions of RedFire have been extinguished. Alice, Bob, and Charlie have empty inventories and are ready for the next subtask. LostPersonThomas requires 2 agents to carry. DepositFacility is empty."
"[12, 12, 12]","['NavigateTo(DepositFacility)', 'NavigateTo(DepositFacility)', 'Explore()']","Alice and Bob are already carrying LostPersonThomas, and need to navigate to the DepositFacility to drop him off. Charlie should explore the environment to potentially assist with carrying LostPersonThomas or to start collecting sand for future use.","Alice and Bob are currently navigating to deposit with LostPersonThomas, Charlie is currently exploring",All regions of RedFire have been extinguished. Alice and Bob are both holding LostPersonThomas. DepositFacility is empty.
"[12, 12, 12]","['DropOff(DepositFacility, LostPersonThomas)', 'DropOff(DepositFacility, LostPersonThomas)', 'Idle']","Alice and Bob are currently carrying LostPersonThomas and need to navigate to DepositFacility to drop off the person. Charlie is free to perform other tasks, such as collecting resources for future use or exploring to ensure no other tasks are pending.",Alice and Bob are currently dropping off LostPersonThomas in the deposit. Charlie is currently idle.,All regions of RedFire have been extinguished. Alice and Bob are both holding LostPersonThomas. DepositFacility is empty.
"[12, 12, 12]","['Done', 'Done', 'Done']","Since Alice and Bob have successfully dropped off LostPersonThomas at the DepositFacility, their next task is to ensure that there are no more tasks left to be done. Charlie is currently idle and can also confirm if any further action is needed.",None,All regions of RedFire have been extinguished. Alice and Bob have dropped off LostPersonThomas at DepositFacility. DepositFacility currently contains 1 person.
