Step,Action,Reason,Subtask,Memory
"[13, 13, 13]","['NavigateTo(ReservoirTaj)', 'NavigateTo(ReservoirLibre)', 'Explore()']",Alice should navigate to the ReservoirTaj to collect sand since she is closest to it. Bob should navigate to ReservoirLibre to collect water as he is closest to it. Charlie should begin exploring to locate LostPersonThomas because finding lost persons is a priority and the other two robots are already tasked with resource collection.,"Alice is currently collecting sand from ReservoirTaj, Bob is currently collecting water from ReservoirLibre, Charlie is currently exploring to locate LostPersonThomas",EmberFire and its regions are chemical and require sand. AgniFire and DowntownFire and their regions are non-chemical and require water. ReservoirTaj contains sand. ReservoirLibre contains water. DepositFacility is empty.
"[13, 13, 13]","['GetSupply(ReservoirTaj)', 'GetSupply(ReservoirLibre)', 'Explore()']",Alice has successfully navigated to ReservoirTaj and should now collect sand to extinguish the EmberFire. Bob has successfully navigated to ReservoirLibre and should collect water to extinguish the AgniFire and DowntownFire. Charlie has successfully explored but did not find LostPersonThomas; Charlie should continue to explore to find LostPersonThomas.,"Alice is currently trying to collect sand from ReservoirTaj, Bob is currently trying to collect water from ReservoirLibre, Charlie is currently trying to explore to locate LostPersonThomas",EmberFire and its regions are chemical and require sand. AgniFire and DowntownFire and their regions are non-chemical and require water. ReservoirTaj contains sand. ReservoirLibre contains water. DepositFacility is empty.
"[13, 13, 13]","['NavigateTo(EmberFire_Region_1)', 'NavigateTo(AgniFire_Region_1)', 'NavigateTo(ReservoirLibre)']",Alice can navigate to and start extinguishing EmberFire_Region_1 with sand since she has 1 unit of sand. Bob can navigate to and start extinguishing AgniFire_Region_1 with water since he has 1 unit of water. Charlie can navigate to ReservoirLibre to collect water to extinguish non-chemical fires.,"Alice is currently navigating to extinguish EmberFire_Region_1, Bob is currently navigating to extinguish AgniFire_Region_1, Charlie is currently navigating to collect water from ReservoirLibre",EmberFire and its regions are chemical and require sand. AgniFire and DowntownFire and their regions are non-chemical and require water. ReservoirTaj contains sand. ReservoirLibre contains water. DepositFacility is empty. Alice has 1 unit of Sand. Bob has 1 unit of Water. Charlie is empty-handed.
"[13, 13, 13]","['UseSupply(EmberFire, Sand)', 'UseSupply(AgniFire, Water)', 'Explore()']",Alice is already at the EmberFire_Region_1 with sand in her inventory and should use it to extinguish the fire. Bob is at AgniFire_Region_1 with water in his inventory and should use it to extinguish the fire. Charlie should explore to locate LostPersonThomas as other robots are currently busy with fire extinguishing tasks.,"Alice is currently extinguishing EmberFire_Region_1 using sand, Bob is currently extinguishing AgniFire_Region_1 using water, and Charlie is currently exploring to locate LostPersonThomas.","EmberFire and its regions are chemical and require sand. AgniFire and DowntownFire and their regions are non-chemical and require water. ReservoirTaj contains sand. ReservoirLibre contains water. DepositFacility is empty. Alice has 1 unit of Sand. Bob has 1 unit of Water. Charlie is empty-handed. The last known locations are Alice at (4, 12), Bob at (16, 17), and Charlie at (9, 17)."
"[13, 13, 13]","['NavigateTo(DowntownFire_Region_1)', 'NavigateTo(ReservoirLibre)', 'Explore()']",Alice should navigate to the DowntownFire_Region_1 to use water on it. Bob should navigate to ReservoirLibre to collect water to extinguish DowntownFire. Charlie should continue to explore to find LostPersonThomas.,"Alice is currently navigating to extinguish DowntownFire_Region_1, Bob is currently navigating to collect water from ReservoirLibre, Charlie is currently exploring to locate LostPersonThomas.","EmberFire and its regions are chemical and require sand. AgniFire and DowntownFire and their regions are non-chemical and require water. ReservoirTaj contains sand. ReservoirLibre contains water. DepositFacility is empty. The last known locations are Alice at (4, 12), Bob at (16, 17), and Charlie at (0, 26)."
"[13, 13, 13]","['UseSupply(DowntownFire, Water)', 'GetSupply(ReservoirLibre)', 'Explore()']","Alice is already at DowntownFire_Region_1 and should use her water supply to extinguish it. Bob is at ReservoirLibre and needs to collect water to help extinguish DowntownFire. Charlie has explored successfully, and since all fires are known, he should now help in carrying LostPersonThomas once found or assist in extinguishing fires.","Alice is currently trying to extinguish DowntownFire_Region_1 using water, Bob is currently trying to collect water from ReservoirLibre, Charlie is currently trying to explore to locate LostPersonThomas","EmberFire and its regions are chemical and require sand. AgniFire and DowntownFire and their regions are non-chemical and require water. ReservoirTaj contains sand. ReservoirLibre contains water. DepositFacility is empty. The last known locations are Alice at (25, 22), Bob at (9, 17), and Charlie at (0, 6). DowntownFire has regions with low intensity that need to be extinguished."
"[13, 13, 13]","['UseSupply(DowntownFire, Water)', 'NavigateTo(DowntownFire_Region_1)', 'NavigateTo(DepositFacility)']",Alice can use the water supply on DowntownFire since she is already next to it. Bob should navigate to DowntownFire_Region_1 to help extinguish it with water. Charlie should navigate to DepositFacility to be ready to carry LostPersonThomas.,"Alice is currently trying to extinguish DowntownFire, Bob is currently navigating to DowntownFire_Region_1, Charlie is currently navigating to DepositFacility","EmberFire and its regions are chemical and require sand. AgniFire and DowntownFire and their regions are non-chemical and require water. ReservoirTaj contains sand. ReservoirLibre contains water. DepositFacility is empty. The last known locations are Alice at (25, 22), Bob at (9, 17), and Charlie at (20, 6). DowntownFire has regions with low intensity that need to be extinguished. Alice is near DowntownFire which has low intensity and requires water."
"[13, 13, 13]","['GetSupply(ReservoirLibre)', 'UseSupply(DowntownFire, Water)', 'Move(Down)']","Alice needs to get water from ReservoirLibre to use on DowntownFire. Bob is already at DowntownFire_Region_1 and has water, so he should use his water supply to extinguish the fire. Charlie should move towards LostPersonThomas to prepare for carrying them.","Alice is currently collecting water from ReservoirLibre, Bob is currently extinguishing DowntownFire_Region_1 using water, Charlie is currently moving towards LostPersonThomas",EmberFire and its regions are chemical and require sand. AgniFire and DowntownFire and their regions are non-chemical and require water. ReservoirTaj contains sand. ReservoirLibre contains water. DepositFacility is empty. Alice and Bob are near DowntownFire which has low intensity and requires water. Charlie is at the DepositFacility. LostPersonThomas has been located and requires 2 agents to carry.
"[13, 13, 13]","['NavigateTo(ReservoirLibre)', 'Idle', 'Explore()']","Alice should navigate to ReservoirLibre to collect water, as she previously failed to do so due to distance. Charlie should continue to explore to find LostPersonThomas since the person has been located but not yet reached. Bob and Alice, after Alice collects water, can work together to carry LostPersonThomas, as the fire tasks are complete.","Alice is currently collecting water from ReservoirLibre, Charlie is currently moving towards LostPersonThomas, Bob is currently waiting to carry LostPersonThomas.",EmberFire and its regions are chemical and require sand. AgniFire and DowntownFire and their regions are non-chemical and require water. ReservoirTaj contains sand. ReservoirLibre contains water. DepositFacility is empty. Alice and Bob are near DowntownFire which has been extinguished. LostPersonThomas has been located and requires 2 agents to carry. Charlie is at the DepositFacility.
"[13, 13, 13]","['NavigateTo(LostPersonThomas)', 'NavigateTo(LostPersonThomas)', 'NavigateTo(LostPersonThomas)']","With all fires extinguished, the robots' next task is to carry LostPersonThomas to a deposit. Alice is near ReservoirLibre and should navigate towards LostPersonThomas to assist in carrying him. Bob and Charlie are both in positions to move towards LostPersonThomas and carry him to the deposit.","Alice is currently moving towards LostPersonThomas, Bob is currently moving towards LostPersonThomas, Charlie is currently moving towards LostPersonThomas",All fires are extinguished. LostPersonThomas has been located and requires 2 agents to carry. ReservoirTaj contains sand. ReservoirLibre contains water. DepositFacility is empty. Alice is near ReservoirLibre. Bob and Charlie are near DepositFacility.
"[13, 13, 13]","['Carry(LostPersonThomas)', 'Carry(LostPersonThomas)', 'NavigateTo(DepositFacility)']","All fires have been extinguished successfully, so now the robots should focus on carrying LostPersonThomas to a deposit. Alice, Bob, and Charlie have all successfully navigated to LostPersonThomas and are in the correct position to start carrying them. Since Bob and Charlie are near the DepositFacility, they should be the ones to carry LostPersonThomas to the deposit.","carry LostPersonThomas with Alice, Bob, and Charlie",All fires are extinguished. LostPersonThomas has been located and requires 2 agents to carry. ReservoirTaj contains sand. ReservoirLibre contains water. DepositFacility is empty. Alice is near ReservoirLibre. Bob and Charlie are near DepositFacility.
"[13, 13, 13]","['NavigateTo(DepositFacility)', 'NavigateTo(DepositFacility)', 'NavigateTo(DepositFacility)']","Alice and Bob are already carrying LostPersonThomas, so they should navigate to the DepositFacility to drop him off. Charlie should join them at the DepositFacility in order to help drop off LostPersonThomas since two agents are required.","Alice is currently navigating to DepositFacility, Bob is currently navigating to DepositFacility, Charlie is currently navigating to DepositFacility",All fires are extinguished. LostPersonThomas has been located and requires 2 agents to carry. ReservoirTaj contains sand. ReservoirLibre contains water. DepositFacility is empty. Alice is near ReservoirLibre. Bob and Charlie are near DepositFacility. Alice and Bob are carrying LostPersonThomas.
"[13, 13, 13]","['DropOff(DepositFacility, LostPersonThomas)', 'DropOff(DepositFacility, LostPersonThomas)', 'DropOff(DepositFacility, LostPersonThomas)']","Alice and Bob have successfully navigated to DepositFacility with LostPersonThomas. Charlie, being at the deposit, can assist in the dropoff. With the fires extinguished and LostPersonThomas found, the final task is to drop him off at the DepositFacility. All three robots are in proximity to complete this action.","Drop LostPersonThomas in deposit with Alice, Bob, and Charlie","All fires are extinguished. LostPersonThomas has been located and requires 2 agents to carry. ReservoirTaj contains sand. ReservoirLibre contains water. DepositFacility is empty. Alice, Bob, and Charlie are near DepositFacility. Alice and Bob are carrying LostPersonThomas."
"[13, 13, 13]","['Done', 'Done', 'Done']","All tasks have been completed. All fires are extinguished, and LostPersonThomas has been successfully dropped off at the deposit. There are no remaining subtasks. The robots should report that they are done with their tasks.",None,"All fires are extinguished. LostPersonThomas has been located and dropped at DepositFacility. ReservoirTaj contains sand. ReservoirLibre contains water. DepositFacility has one person. Alice, Bob, and Charlie are near DepositFacility."
