Step,Action,Reason,Subtask,Memory
"[34, 34, 34, 34]","['NavigateTo(DepositFacility)', 'NavigateTo(DepositFacility)', 'NavigateTo(DepositFacility)', 'NavigateTo(DepositFacility)']",Alice and David should navigate to DepositFacility to be ready for the drop-off of LostPersonZoe. Bob should also navigate to DepositFacility to assist in the drop-off process. Charlie should move towards DepositFacility to assist or continue exploring to find any remaining lost persons.,"Alice is currently navigating to DepositFacility, Bob is currently navigating to DepositFacility, Charlie is currently navigating to DepositFacility, David is currently navigating to DepositFacility","SussexFire has been fully extinguished. Alice and David are at co-ordinates (11, 24) and (13, 24) respectively, both carrying LostPersonZoe and need to navigate to DepositFacility to drop her off. Bob is at co-ordinates (11, 23) and needs to navigate to DepositFacility to assist in the drop-off process. Charlie is at co-ordinates (26, 9) and should explore or assist with the deposit drop-off."
"[34, 34, 34, 34]","['NavigateTo(DepositFacility)', 'NavigateTo(LostPersonZoe)', 'NavigateTo(LostPersonZoe)', 'NavigateTo(DepositFacility)']","Alice and David should navigate to DepositFacility to prepare for dropping off LostPersonZoe, as they are already carrying LostPersonZoe. Bob and Charlie need to join Alice and David in carrying LostPersonZoe, so they should navigate to LostPersonZoe's location and perform the carry action. Once all four robots are together carrying LostPersonZoe, they should then navigate to DepositFacility and drop her off.","Alice is currently navigating to DepositFacility, Bob is currently navigating to LostPersonZoe, Charlie is currently navigating to LostPersonZoe, David is currently navigating to DepositFacility","SussexFire has been fully extinguished. Alice is at co-ordinates (12, 23) carrying LostPersonZoe. David is at co-ordinates (11, 25) also carrying LostPersonZoe. Bob is at co-ordinates (12, 25) and needs to assist in carrying LostPersonZoe. Charlie is at co-ordinates (11, 23) and should also assist with carrying LostPersonZoe."
"[34, 34, 34, 34]","['NavigateTo(DepositFacility)', 'NavigateTo(DepositFacility)', 'NavigateTo(DepositFacility)', 'NavigateTo(DepositFacility)']",Alice and David can now navigate to DepositFacility as they are holding LostPersonZoe. Bob and Charlie should also navigate to DepositFacility so that all four can drop off LostPersonZoe at the same time.,"Bob is currently navigating to DepositFacility, Alice is currently navigating to DepositFacility, Charlie is currently navigating to DepositFacility, David is currently navigating to DepositFacility","Alice finished navigating to DepositFacility when Alice was at co-ordinates (11, 24). Bob finished navigating to LostPersonZoe when Bob was at co-ordinates (12, 22). Charlie finished navigating to LostPersonZoe when Charlie was at co-ordinates (13, 23). David finished navigating to DepositFacility when David was at co-ordinates (12, 25). SussexFire has been fully extinguished."
"[34, 34, 34, 34]","['NavigateTo(DepositFacility)', 'Explore()', 'Explore()', 'NavigateTo(DepositFacility)']",Alice and David should navigate to DepositFacility to drop off LostPersonZoe since they are currently carrying the person. Bob and Charlie should explore to find LostPersonZoe.,"Alice and David are currently navigating to DepositFacility to drop off LostPersonZoe, and Bob and Charlie are exploring to find LostPersonZoe.","SussexFire has been fully extinguished. Alice, Bob, Charlie, and David are all near the DepositFacility. LostPersonZoe requires 2 agents to carry and is at an unknown location."
"[34, 34, 34, 34]","['DropOff(DepositFacility, LostPersonZoe)', 'NavigateTo(DepositFacility)', 'NavigateTo(DepositFacility)', 'DropOff(DepositFacility, LostPersonZoe)']","Alice and David are currently carrying LostPersonZoe and are at the DepositFacility, ready to drop her off. Bob and Charlie need to navigate to the DepositFacility to assist in the drop-off.","Alice and David are currently dropping off LostPersonZoe, Bob and Charlie are currently navigating to the DepositFacility","SussexFire has been fully extinguished. Alice, Bob, Charlie, and David are all near the DepositFacility. LostPersonZoe requires 2 agents to carry and is at an unknown location."
"[34, 34, 34, 34]","['Explore()', 'Explore()', 'Explore()', 'Explore()']","All robots should start exploring to find LostPersonJacob, as the fire has been extinguished and LostPersonZoe has been dropped off successfully. Once found, two robots will need to carry LostPersonJacob to a deposit.","Alice is currently tasked with locating LostPersonJacob, Bob is currently tasked with locating LostPersonJacob, Charlie is currently tasked with locating LostPersonJacob, David is currently tasked with locating LostPersonJacob","SussexFire has been fully extinguished. Alice, Bob, Charlie, and David are all near the DepositFacility. LostPersonJacob requires 2 agents to carry and is at an unknown location."
"[34, 34, 34, 34]","['Explore()', 'Explore()', 'Explore()', 'Move(Down)']","Since the SussexFire is already extinguished, all robots should now focus on finding LostPersonJacob and LostPersonZoe. Alice and Bob were successful in exploring, so they should continue to explore in different directions to find the lost people. Charlie should also explore but in a different direction than Alice and Bob to maximize the search area. David should navigate Down away from the obstacle to successfully explore.","Alice, Bob, Charlie, and David are currently exploring to find LostPersonJacob and LostPersonZoe.","SussexFire has been fully extinguished. Alice, Bob, Charlie, and David are all near the DepositFacility. LostPersonJacob requires 2 agents to carry and is at an unknown location. Bob failed to drop off LostPersonZoe probably because he was not at the deposit or not enough agents were present to drop off. Charlie failed to carry LostPersonZoe likely because they did not navigate to LostPersonZoe's location or not enough agents were present to carry."
"[34, 34, 34, 34]","['Explore()', 'Carry(LostPersonZoe)', 'Carry(LostPersonZoe)', 'Explore()']","Since all fires are extinguished and LostPersonJacob's location is still unknown, all robots should focus on exploring to find LostPersonJacob. Once found, at least two robots will be needed to carry LostPersonJacob to a deposit. Bob and Charlie need to coordinate to successfully carry LostPersonZoe to the deposit.","Alice is currently exploring to find LostPersonJacob, Bob is currently carrying LostPersonZoe, Charlie is currently carrying LostPersonZoe, David is currently exploring to find LostPersonJacob","SussexFire has been fully extinguished. Alice, Bob, Charlie, and David are all near the DepositFacility. LostPersonJacob requires 2 agents to carry and is at an unknown location. LostPersonZoe requires 2 agents to carry and has been found."
