Step,Action,Reason,Subtask,Memory
"[34, 34, 34, 34]","['NavigateTo(ReservoirYork)', 'NavigateTo(ReservoirYork)', 'Explore()', 'NavigateTo(SussexFire_Region_1)']","Since all robots' inventories are empty and there are no failures from previous actions, the initial steps should be strategized. Alice and Bob should navigate towards ReservoirYork to collect water which is needed to extinguish the SussexFire which is non-chemical. Charlie should start to explore the environment to find the lost persons. David being the closest to the SussexFire should navigate towards it to start extinguishing once he has water.","Alice is currently navigating to ReservoirYork, Bob is currently navigating to ReservoirYork, Charlie is currently exploring the environment, David is currently navigating to SussexFire_Region_1",SussexFire with average intensity of Low of Non-chemical type at global view.
"[34, 34, 34, 34]","['GetSupply(ReservoirYork)', 'GetSupply(ReservoirYork)', 'Explore()', 'UseSupply(SussexFire, Water)']","Alice, Bob, and Charlie should collect water from ReservoirYork to extinguish the SussexFire using water. Since David is already at SussexFire_Region_1, he should use the water supply on it. Meanwhile, one of the other robots should start exploring to find the lost persons, LostPersonJacob and LostPersonZoe.","Alice is currently collecting water from ReservoirYork, Bob is currently collecting water from ReservoirYork, Charlie is currently exploring to locate LostPersonJacob, David is currently extinguishing SussexFire_Region_1 using water","SussexFire with average intensity of Low of Non-chemical type at global view. Alice, Bob, and Charlie are near ReservoirYork. David is at SussexFire_Region_1."
"[34, 34, 34, 34]","['NavigateTo(SussexFire_Region_1)', 'NavigateTo(SussexFire_Region_1)', 'GetSupply(ReservoirYork)', 'NavigateTo(SussexFire_Region_1)']",Alice should navigate to SussexFire_Region_1 to use her water supply to extinguish the fire. Bob should navigate to another region of SussexFire to use his water supply to extinguish the fire. Charlie should get water from ReservoirYork to help with extinguishing the fire. David should navigate to SussexFire_Region_1 and then use his water supply to extinguish the fire.,"Alice is currently trying to extinguish SussexFire_Region_1 using water, Bob is currently trying to extinguish all of SussexFire using water, Charlie is currently trying to collect water from ReservoirYork, David is currently trying to extinguish SussexFire_Region_1 using water","SussexFire with average intensity of Low of Non-chemical type at global view. Alice, Bob, and Charlie are near ReservoirYork. David is at SussexFire_Region_1. Alice and Bob have water in their inventory. Charlie has no resources. David attempted to use water on SussexFire but failed."
"[34, 34, 34, 34]","['UseSupply(SussexFire, Water)', 'UseSupply(SussexFire, Water)', 'NavigateTo(SussexFire_Region_1)', 'GetSupply(ReservoirYork)']",Alice and Bob should use their water supply to extinguish the low intensity region of SussexFire they are currently at. Charlie should navigate to SussexFire_Region_1 to assist with extinguishing efforts. David should collect water from ReservoirYork to be able to contribute to extinguishing the fire.,"Alice and Bob are currently trying to extinguish SussexFire_Region_1 using water, Charlie is currently trying to navigate to SussexFire_Region_1, and David is currently trying to collect water from ReservoirYork.",SussexFire with average intensity of Low of Non-chemical type at global view. Alice and Bob are at SussexFire_Region_1 and have water in their inventory. Charlie has water in their inventory. David is at SussexFire_Region_1 but has no resources.
"[34, 34, 34, 34]","['Explore()', 'Explore()', 'Explore()', 'NavigateTo(ReservoirYork)']","Since the SussexFire has been extinguished, Alice and Bob can start exploring to find the lost persons. Charlie should also start exploring for lost persons since he has water but the fire is out. David should navigate to ReservoirYork to get water in case it's needed for another fire or to be ready for any new fires that may start.","Alice is currently exploring to locate LostPersonJacob, Bob is currently exploring to locate LostPersonZoe, Charlie is currently exploring new areas for lost persons, David is currently navigating to ReservoirYork to get water supply",SussexFire has been extinguished. Alice and Bob are at the location of the extinguished SussexFire. Charlie is holding water. David needs to navigate to ReservoirYork to get water.
"[34, 34, 34, 34]","['Explore()', 'Explore()', 'Explore()', 'GetSupply(ReservoirYork)']","With SussexFire extinguished, Alice, Bob, and Charlie should focus on finding LostPersonJacob and carrying both LostPersonJacob and LostPersonZoe to a deposit. David should collect water from ReservoirYork to be prepared for any future fires.","Alice, Bob, and Charlie are currently searching for LostPersonJacob. David is currently collecting water from ReservoirYork.",SussexFire has been extinguished. Alice and Bob have found LostPersonZoe. Charlie has water in their inventory. David is at ReservoirYork ready to collect water.
"[34, 34, 34, 34]","['Carry(LostPersonJacob)', 'NavigateTo(DepositFacility)', 'Carry(LostPersonZoe)', 'NavigateTo(DepositFacility)']","With the SussexFire extinguished, all robots should now focus on the remaining tasks of carrying LostPersonJacob and LostPersonZoe to a deposit. Charlie and David, already having water, do not need to collect more supplies for the extinguished fire and should assist with the lost persons. Alice and Bob can collaborate to carry one person, while Charlie and David can team up for the other. As both lost persons require two agents to carry, the robots need to pair up to complete this task.","Alice is currently carrying LostPersonJacob to a deposit, Bob is currently navigating to deposit with LostPersonJacob, Charlie is currently carrying LostPersonZoe to a deposit, David is currently navigating to deposit with LostPersonZoe",SussexFire has been extinguished. Alice and Bob have found LostPersonZoe. Charlie has water in their inventory but does not need to use it on SussexFire. David is at ReservoirYork with water in inventory. All robots know the location of LostPersonJacob and LostPersonZoe.
"[34, 34, 34, 34]","['NavigateTo(LostPersonJacob)', 'NavigateTo(LostPersonZoe)', 'NavigateTo(DepositFacility)', 'NavigateTo(LostPersonZoe)']","Alice should navigate to LostPersonJacob to carry him. Bob and David should navigate to LostPersonZoe to carry her, as they are required for the task. Charlie should navigate to DepositFacility to store water, since SussexFire is already extinguished.","Alice is currently navigating to collect LostPersonJacob, Bob and David are currently navigating to collect LostPersonZoe, Charlie is currently navigating to store water in DepositFacility.",SussexFire has been extinguished. Alice and Bob have found LostPersonZoe. Charlie has water in their inventory but does not need to use it on SussexFire. David is at ReservoirYork with water in inventory. All robots know the location of LostPersonJacob and LostPersonZoe. Alice and Charlie need to navigate to LostPersonJacob and LostPersonZoe respectively for carrying.
"[34, 34, 34, 34]","['NavigateTo(LostPersonJacob)', 'NavigateTo(DepositFacility)', 'Carry(LostPersonJacob)', 'NavigateTo(DepositFacility)']",Alice and Charlie need to navigate to LostPersonJacob and LostPersonZoe to assist in carrying them to a deposit. Bob and David should start navigating towards DepositFacility with LostPersonZoe so they can drop her off.,"Alice is currently navigating to assist Charlie in carrying LostPersonJacob, Charlie is currently carrying LostPersonJacob, Bob is currently navigating to deposit with LostPersonZoe, and David is currently navigating to deposit with LostPersonZoe.",SussexFire has been extinguished. Alice and Bob have found LostPersonZoe. Charlie has water in their inventory but does not need to use it on SussexFire. David is at ReservoirYork with water in inventory. All robots know the location of LostPersonJacob and LostPersonZoe. Alice and Charlie need to navigate to LostPersonJacob and LostPersonZoe respectively for carrying. Bob and David are with LostPersonZoe and need to navigate to DepositFacility to drop off.
"[34, 34, 34, 34]","['NavigateTo(LostPersonJacob)', 'NavigateTo(DepositFacility)', 'NavigateTo(LostPersonJacob)', 'NavigateTo(DepositFacility)']","Alice and Charlie need to navigate to LostPersonJacob and then attempt to carry him together, as he requires 2 agents. Bob and David, currently with LostPersonZoe, need to navigate to the DepositFacility to drop off LostPersonZoe, as they are the required two agents to carry her.","Alice and Charlie are currently navigating to LostPersonJacob, Bob and David are currently navigating to DepositFacility with LostPersonZoe",SussexFire has been extinguished. Alice and Bob have found LostPersonZoe. Charlie and David have water in their inventory which is not needed for extinguishing any fire. All robots know the location of LostPersonJacob and LostPersonZoe. Alice and Charlie need to navigate to LostPersonJacob for carrying. Bob and David are with LostPersonZoe and need to navigate to DepositFacility to drop off.
"[34, 34, 34, 34]","['Carry(LostPersonJacob)', 'DropOff(DepositFacility, LostPersonZoe)', 'Carry(LostPersonJacob)', 'DropOff(DepositFacility, LostPersonZoe)']","Alice and Charlie should both navigate to LostPersonJacob to carry him as two agents are required. Since SussexFire is extinguished, Charlie's water resource is not needed for fires and can be stored or cleared from the inventory. Bob and David need to navigate to DepositFacility with LostPersonZoe to drop her off as per the subtask.","Alice and Charlie are currently trying to carry LostPersonJacob, Bob and David are currently navigating to deposit with LostPersonZoe",SussexFire has been extinguished. Alice and Charlie need to navigate to LostPersonJacob for carrying. Bob and David are with LostPersonZoe and need to navigate to DepositFacility to drop off. LostPersonJacob and LostPersonZoe locations known.
"[34, 34, 34, 34]","['NavigateTo(DepositFacility)', 'NavigateTo(DepositFacility)', 'NavigateTo(DepositFacility)', 'NavigateTo(DepositFacility)']","Alice and Charlie should navigate to the deposit with LostPersonJacob. Bob and David should also navigate to the deposit to drop off LostPersonZoe. Since the fire has been extinguished, no actions are needed regarding it.","Alice and Charlie are currently navigating to the deposit with LostPersonJacob, Bob and David are currently navigating to the deposit with LostPersonZoe.","SussexFire has been extinguished. Alice and Charlie are carrying LostPersonJacob. Bob and David are with LostPersonZoe and need to navigate to DepositFacility to drop off. LostPersonJacob and LostPersonZoe locations known. Alice is at co-ordinates (17, 4), Charlie at co-ordinates (18, 3), Bob at co-ordinates (13, 24), David at co-ordinates (11, 24)."
"[34, 34, 34, 34]","['NavigateTo(DepositFacility)', 'NavigateTo(LostPersonZoe)', 'NavigateTo(DepositFacility)', 'NavigateTo(LostPersonZoe)']","Alice and Charlie, carrying LostPersonJacob, should navigate to DepositFacility to drop him off. Bob and David, being with LostPersonZoe, should each navigate to LostPersonZoe, carry her, and then navigate to DepositFacility to drop her off.","Alice and Charlie are currently navigating to DepositFacility with LostPersonJacob, Bob and David are currently navigating to LostPersonZoe to carry her.",SussexFire has been extinguished. Alice and Charlie are carrying LostPersonJacob and need to navigate to DepositFacility to drop off. Bob and David are with LostPersonZoe and need to navigate to DepositFacility to drop off. LostPersonJacob and LostPersonZoe locations known.
"[34, 34, 34, 34]","['NavigateTo(DepositFacility)', 'NavigateTo(DepositFacility)', 'NavigateTo(DepositFacility)', 'NavigateTo(DepositFacility)']","Alice and Charlie should navigate to DepositFacility to drop off LostPersonJacob. Bob and David should also navigate to DepositFacility to drop off LostPersonZoe. Since the SussexFire has been extinguished, the subtasks related to the fire can be removed from the open subtasks list.","Alice and Charlie are currently navigating to DepositFacility to drop off LostPersonJacob, Bob and David are currently navigating to DepositFacility to drop off LostPersonZoe.","SussexFire has been extinguished. Alice and Charlie are carrying LostPersonJacob and are at coordinates (11, 24) and (12, 25) respectively. Bob and David found LostPersonZoe and are at coordinates (23, 6) and (24, 5) respectively. All need to navigate to DepositFacility to drop off the lost persons. LostPersonJacob and LostPersonZoe locations are known."
"[34, 34, 34, 34]","['NavigateTo(DepositFacility)', 'NavigateTo(DepositFacility)', 'NavigateTo(DepositFacility)', 'NavigateTo(DepositFacility)']",Alice and Charlie should navigate to DepositFacility to drop off LostPersonJacob. Bob should navigate to DepositFacility and prepare to help Alice and Charlie with the dropoff. David should navigate to DepositFacility to drop off LostPersonZoe with Bob's help.,"Alice is currently navigating to DepositFacility to drop off LostPersonJacob, Bob is currently navigating to DepositFacility to drop off LostPersonZoe, Charlie is currently navigating to DepositFacility to drop off LostPersonJacob, David is currently navigating to DepositFacility to drop off LostPersonZoe","SussexFire has been extinguished. Alice and Charlie are carrying LostPersonJacob and are at coordinates (11, 24) and (12, 25) respectively. Bob and David found LostPersonZoe and are at coordinates (23, 6) and (24, 5) respectively. All need to navigate to DepositFacility to drop off the lost persons. LostPersonJacob and LostPersonZoe locations are known. DepositFacility is at coordinates (12, 23) and is empty."
"[34, 34, 34, 34]","['NavigateTo(DepositFacility)', 'NavigateTo(LostPersonZoe)', 'NavigateTo(DepositFacility)', 'Idle']","Alice and Charlie can navigate to DepositFacility to drop off LostPersonJacob. Bob can navigate to LostPersonZoe to assist David in carrying LostPersonZoe to DepositFacility. David can wait for Bob to navigate to LostPersonZoe, so they can both carry LostPersonZoe to DepositFacility.","Alice and Charlie are currently navigating to DepositFacility to drop off LostPersonJacob, Bob is currently navigating to LostPersonZoe, David is waiting for Bob to assist in carrying LostPersonZoe.","SussexFire has been extinguished. Alice and Charlie are carrying LostPersonJacob and are at coordinates (11, 24) and (13, 24) respectively. Bob and David found LostPersonZoe and are at coordinates (11, 25) and (11, 23) respectively. All need to navigate to DepositFacility to drop off the lost persons. LostPersonJacob and LostPersonZoe locations are known. DepositFacility is at coordinates (12, 23) and is empty. Alice and Charlie need to drop off LostPersonJacob at DepositFacility."
"[34, 34, 34, 34]","['DropOff(DepositFacility, LostPersonJacob)', 'NavigateTo(DepositFacility)', 'DropOff(DepositFacility, LostPersonJacob)', 'StoreSupply(DepositFacility)']","Alice and Charlie need to drop off LostPersonJacob at DepositFacility. Bob needs to navigate to DepositFacility to drop off LostPersonZoe. David, who is already at the deposit, should wait for Bob to arrive so they can drop off LostPersonZoe together.","Alice and Charlie are currently dropping off LostPersonJacob at DepositFacility, Bob is currently navigating to DepositFacility, David is currently waiting for Bob to arrive at DepositFacility.","SussexFire has been extinguished. Alice and Charlie are carrying LostPersonJacob and are at coordinates (12, 23) and (12, 25) respectively. Bob and David found LostPersonZoe and are at coordinates (23, 6) and (11, 23) respectively. All need to navigate to DepositFacility to drop off the lost persons. LostPersonJacob and LostPersonZoe locations are known. DepositFacility is at coordinates (12, 23) and is empty. Alice and Charlie need to drop off LostPersonJacob at DepositFacility. Bob needs to navigate to DepositFacility to drop off LostPersonZoe."
"[34, 34, 34, 34]","['Carry(LostPersonZoe)', 'NavigateTo(DepositFacility)', 'Explore()', 'NavigateTo(DepositFacility)']","Since SussexFire is already extinguished, no action related to it is needed. Alice can assist Bob and David in carrying LostPersonZoe. Bob and David should navigate to DepositFacility to be able to drop off LostPersonZoe, and Charlie should explore to locate LostPersonJacob.","Alice, Bob, and David are currently tasked with carrying LostPersonZoe to deposit, and Charlie is currently tasked with locating LostPersonJacob.","SussexFire has been extinguished. Alice and Charlie have successfully dropped off LostPersonJacob at DepositFacility. LostPersonZoe has been located and requires 2 agents to carry. Bob and David are at coordinates (11, 24) and (11, 23) respectively and need to navigate to DepositFacility to drop off LostPersonZoe."
"[34, 34, 34, 34]","['NavigateTo(LostPersonZoe)', 'DropOff(DepositFacility, LostPersonZoe)', 'Explore()', 'DropOff(DepositFacility, LostPersonZoe)']","Alice should navigate to LostPersonZoe to carry them. Bob and David are both at the DepositFacility and need to drop off LostPersonZoe. Charlie should explore to find the other lost person, LostPersonJacob.","Alice is trying to carry LostPersonZoe, Bob and David are trying to drop LostPersonZoe in deposit, Charlie is trying to explore to find LostPersonJacob.","SussexFire has been extinguished. Alice and Charlie have successfully dropped off LostPersonJacob at DepositFacility. LostPersonZoe has been located and requires 2 agents to carry. Bob and David have navigated to DepositFacility to drop off LostPersonZoe and are at coordinates (13, 24) and (12, 23) respectively. Alice is at coordinates (12, 23) and needs to navigate to LostPersonZoe to carry them."
"[34, 34, 34, 34]","['NavigateTo(LostPersonZoe)', 'Idle', 'Explore()', 'NavigateTo(LostPersonZoe)']","Alice needs to navigate towards LostPersonZoe to assist in carrying them. Bob and David should remain idle or navigate towards LostPersonZoe if they are not in the immediate vicinity. Charlie, being the furthest away, should explore to locate the other lost person, LostPersonJacob.","Alice, Bob, and David are currently trying to carry LostPersonZoe to deposit, Charlie is currently exploring to locate LostPersonJacob.","SussexFire has been extinguished. Alice and Charlie have successfully dropped off LostPersonJacob at DepositFacility. LostPersonZoe has been located and requires 2 agents to carry. Bob and David are at coordinates (13, 24) and (11, 24) respectively and need to navigate to LostPersonZoe to carry them. Alice is at coordinates (23, 6) and needs to navigate to LostPersonZoe to carry them."
"[34, 34, 34, 34]","['Carry(LostPersonZoe)', 'NavigateTo(LostPersonZoe)', 'Explore()', 'Carry(LostPersonZoe)']",Alice and David are already at LostPersonZoe's location and should try to carry LostPersonZoe. Bob should navigate towards LostPersonZoe to assist in carrying them to the deposit. Charlie should explore more to potentially find any additional lost persons or assist in carrying LostPersonZoe if no other tasks are open.,"Alice, Bob, and David are currently trying to carry LostPersonZoe to deposit. Charlie is currently exploring for additional tasks.","SussexFire has been extinguished. Alice and Charlie have successfully dropped off LostPersonJacob at DepositFacility. LostPersonZoe has been located and requires 2 agents to carry. Bob and David are at coordinates (13, 24) and (11, 24) respectively and need to navigate to LostPersonZoe to carry them. Alice is at coordinates (23, 6) and needs to navigate to LostPersonZoe to carry them."
"[34, 34, 34, 34]","['NavigateTo(DepositFacility)', 'NavigateTo(DepositFacility)', 'Explore()', 'NavigateTo(DepositFacility)']","Alice and David are carrying LostPersonZoe and need to navigate to DepositFacility to drop them off. Bob, who is not carrying anyone, needs to navigate to DepositFacility to assist in the drop off. Charlie, who has successfully explored and found no one else, can now assist in any remaining tasks or explore further.","Alice, Bob, and David are currently navigating to DepositFacility to drop off LostPersonZoe.","SussexFire has been extinguished. Alice and Charlie have successfully dropped off LostPersonJacob at DepositFacility. LostPersonZoe has been found and is being carried by Alice and David. Bob is at coordinates (24, 7) and needs to navigate to DepositFacility to assist in dropping off LostPersonZoe."
"[34, 34, 34, 34]","['Idle', 'NavigateTo(DepositFacility)', 'Explore()', 'Idle']","Bob needs to navigate to the DepositFacility to join Alice and David in order to drop off LostPersonZoe. Alice and David should wait at the DepositFacility for Bob to arrive. Charlie should explore the environment to find the remaining lost person, LostPersonJacob.","Bob is currently navigating to DepositFacility, Alice and David are waiting at DepositFacility, and Charlie is exploring to find LostPersonJacob.","SussexFire has been extinguished. Alice and Charlie have successfully dropped off LostPersonJacob at DepositFacility. LostPersonZoe has been found and is being carried by Alice and David. Bob is at coordinates (12, 23) and needs to navigate to DepositFacility to assist in dropping off LostPersonZoe."
"[34, 34, 34, 34]","['NavigateTo(DepositFacility)', 'NavigateTo(DepositFacility)', 'Explore()', 'NavigateTo(DepositFacility)']","As SussexFire is already extinguished, no action is required there. Alice and David, who are carrying LostPersonZoe, need to navigate to DepositFacility to drop her off. Bob, who is at coordinates (13, 24), needs to move to DepositFacility to assist in dropping off LostPersonZoe. Charlie, who is free, should explore to find the other lost person, LostPersonJacob.","Alice is currently carrying LostPersonZoe, Bob is currently navigating to DepositFacility, Charlie is currently exploring to find LostPersonJacob, David is currently carrying LostPersonZoe","SussexFire has been extinguished. Alice and David are currently carrying LostPersonZoe and need to navigate to DepositFacility to drop her off. Bob needs to navigate to DepositFacility to assist in the drop-off process. Charlie is at coordinates (6, 15) and is not currently engaged in a task."
"[34, 34, 34, 34]","['NavigateTo(DepositFacility)', 'NavigateTo(DepositFacility)', 'Explore()', 'NavigateTo(DepositFacility)']","Alice and David should navigate to DepositFacility to drop off LostPersonZoe. Bob should also navigate to DepositFacility to assist in the drop-off process, since two robots are required to carry a person. Charlie is currently not engaged in a task and should explore to find the other lost person, LostPersonJacob.","Alice and David are currently navigating to DepositFacility to drop off LostPersonZoe, Bob is currently navigating to DepositFacility to assist in the drop-off process, Charlie is currently exploring to find LostPersonJacob.","SussexFire has been extinguished. Alice and David are currently carrying LostPersonZoe and need to navigate to DepositFacility to drop her off. Bob needs to navigate to DepositFacility to assist in the drop-off process. Charlie is at coordinates (16, 5) and is not currently engaged in a task."
"[34, 34, 34, 34]","['NavigateTo(DepositFacility)', 'NavigateTo(DepositFacility)', 'Explore()', 'NavigateTo(DepositFacility)']","Alice and David should navigate to DepositFacility to drop off LostPersonZoe. Bob should also navigate to DepositFacility to assist in the drop-off process. Charlie should explore to find the other lost person, LostPersonJacob.","Alice and David are currently navigating to DepositFacility, Bob is currently navigating to DepositFacility to assist with the drop-off, Charlie is currently exploring to find LostPersonJacob","SussexFire has been extinguished. Alice and David are currently carrying LostPersonZoe and are at coordinates (11, 24) and (11, 23) respectively. They need to navigate to DepositFacility to drop her off. Bob is at coordinates (12, 25) and needs to navigate to DepositFacility to assist in the drop-off process. Charlie is at coordinates (26, 15) and is not currently engaged in a task."
"[34, 34, 34, 34]","['NavigateTo(DepositFacility)', 'NavigateTo(DepositFacility)', 'Explore()', 'NavigateTo(DepositFacility)']",Alice and David should navigate to DepositFacility to drop off LostPersonZoe since they are currently carrying her. Bob should also navigate to DepositFacility to assist in the drop-off process. Charlie should explore the environment to find any remaining lost persons or assist in the drop-off if exploration is not needed.,"Alice, Bob, and David are currently navigating to DepositFacility to drop off LostPersonZoe. Charlie is currently exploring to find lost persons or assisting in the drop-off process.",SussexFire has been fully extinguished. Alice and David are currently carrying LostPersonZoe and need to navigate to DepositFacility to drop her off. Bob needs to navigate to DepositFacility to assist in the drop-off process. Charlie is not currently engaged in a task and should be directed to explore or assist with the deposit drop-off.
