Step,Action,Reason,Subtask,Memory
"[34, 34, 34]","['DropOff(DepositFacility, LostPersonJacob)', 'DropOff(DepositFacility, LostPersonZoe)', 'DropOff(DepositFacility, LostPersonZoe)']",Alice and Bob are already at DepositFacility and carrying LostPersonJacob and LostPersonZoe. Charlie has navigated to DepositFacility so now all three robots are in position to perform the drop off.,All three robots are currently trying to drop off the persons they are carrying at DepositFacility.,"SussexFire is extinguished. ReservoirYork contains Water. LostPersonJacob and LostPersonZoe have been located and require 2 agents each to carry. Alice and Bob are carrying LostPersonJacob and LostPersonZoe, respectively. All three robots are near DepositFacility. Alice and Bob are ready to drop off the persons they are carrying at the deposit. Charlie has successfully navigated to DepositFacility."
"[34, 34, 34]","['Idle', 'Idle', 'NavigateTo(DepositFacility)']","Alice and Bob should wait for Charlie to finish navigating to DepositFacility. Charlie should navigate to DepositFacility in order to be close enough to DropOff LostPersonZoe. Once all three robots are at the deposit, they can perform the DropOff action together.","Charlie is currently navigating to DepositFacility, Alice and Bob are currently waiting to drop off the lost persons at DepositFacility","SussexFire is extinguished. ReservoirYork contains Water. LostPersonJacob and LostPersonZoe have been located and require 2 agents each to carry. Alice and Bob are carrying LostPersonJacob and LostPersonZoe, respectively. All three robots are near DepositFacility and need to navigate there to drop off the persons they are carrying."
"[34, 34, 34]","['Idle', 'Idle', 'NavigateTo(DepositFacility)']","Since SussexFire is already extinguished, the current task is to drop off LostPersonJacob and LostPersonZoe at the DepositFacility. Alice and Bob are already at the deposit and carrying the lost persons. Charlie needs to navigate to the deposit to join Alice and Bob so that they can all perform the DropOff action together.","Alice is currently waiting to drop off LostPersonJacob, Bob is currently waiting to drop off LostPersonZoe, Charlie is currently navigating to DepositFacility.","SussexFire is extinguished. ReservoirYork contains Water. LostPersonJacob and LostPersonZoe have been located and require 2 agents each to carry. Alice and Bob are carrying LostPersonJacob and LostPersonZoe, respectively. All three robots are near DepositFacility and need to navigate there to drop off the persons they are carrying. Charlie is at co-ordinates (11, 24) with no resources."
"[34, 34, 34]","['NavigateTo(DepositFacility)', 'NavigateTo(DepositFacility)', 'NavigateTo(DepositFacility)']","Alice and Bob need to navigate to DepositFacility so they can be in the same location to drop off LostPersonJacob and LostPersonZoe. Charlie should also move to the DepositFacility to assist in the drop off process, even though he is not carrying anyone.","Alice and Bob are currently tasked with dropping LostPersonJacob and LostPersonZoe at the DepositFacility, and Charlie is assisting in this process.","SussexFire is extinguished. ReservoirYork contains Water. LostPersonJacob and LostPersonZoe have been located and require 2 agents each to carry. Alice and Bob are carrying LostPersonJacob and LostPersonZoe, respectively, and need to navigate to the DepositFacility to drop off the persons. Charlie is at coordinates (13, 24) with no resources."
"[34, 34, 34]","['DropOff(DepositFacility, LostPersonJacob)', 'DropOff(DepositFacility, LostPersonZoe)', 'NavigateTo(DepositFacility)']","Alice and Bob should navigate to DepositFacility and perform the drop-off action for LostPersonJacob and LostPersonZoe, respectively. Since Charlie is not carrying anyone and has no resources, Charlie can assist in carrying the persons by navigating to DepositFacility and helping with the drop-off.",Alice and Bob are currently navigating to DepositFacility to drop off LostPersonJacob and LostPersonZoe. Charlie is currently assisting in the drop-off process.,"SussexFire is extinguished. ReservoirYork contains Water. LostPersonJacob and LostPersonZoe have been located and require 2 agents each to carry. Alice and Bob are carrying LostPersonJacob and LostPersonZoe, respectively, and need to navigate to the DepositFacility to drop off the persons. Charlie is free with no resources."
"[34, 34, 34]","['NavigateTo(DepositFacility)', 'NavigateTo(DepositFacility)', 'Move(Up)']","Alice and Bob should navigate to the DepositFacility to be able to drop off LostPersonJacob and LostPersonZoe. Charlie should move to assist Alice and Bob as two agents are required to carry each person, and currently, each person is only being carried by one agent.","Alice is currently navigating to DepositFacility with LostPersonJacob, Bob is currently navigating to DepositFacility with LostPersonZoe, Charlie is currently moving to assist in carrying.","SussexFire is extinguished. ReservoirYork contains Water. LostPersonJacob and LostPersonZoe have been located and require 2 agents each to carry. Alice and Bob are carrying LostPersonJacob and LostPersonZoe, respectively, and need to navigate to the DepositFacility to drop off the persons. Charlie is free with no resources."
"[34, 34, 34]","['DropOff(DepositFacility, LostPersonJacob)', 'DropOff(DepositFacility, LostPersonZoe)', 'NavigateTo(ReservoirYork)']",Alice and Bob need to perform the DropOff action together at DepositFacility to successfully drop off LostPersonJacob and LostPersonZoe. Charlie should collect water from ReservoirYork to be prepared for any future fires or to replenish the DepositFacility's supply.,"Alice and Bob are currently dropping off LostPersonJacob and LostPersonZoe at DepositFacility, Charlie is currently collecting water from ReservoirYork","SussexFire is extinguished. ReservoirYork contains Water. LostPersonJacob and LostPersonZoe have been located and require 2 agents each to carry. Alice and Bob are carrying LostPersonJacob and LostPersonZoe, respectively, and are at the DepositFacility ready to drop off the persons."
