Step,Action,Reason,Subtask,Memory
"[34, 34, 34]","['GetSupply(ReservoirYork)', 'GetSupply(ReservoirYork)', 'Explore()']","Alice, Bob, and Charlie should begin by collecting water from ReservoirYork to extinguish the SussexFire. Since SussexFire is non-chemical, water is the appropriate resource. After collecting water, they can navigate to SussexFire_Region_1 and use the water supply on it. In the meantime, one of them can also start exploring to locate LostPersonJacob and LostPersonZoe.","Alice is currently collecting water from ReservoirYork, Bob is currently collecting water from ReservoirYork, Charlie is currently exploring to locate LostPersonJacob",SussexFire is a non-chemical fire with an average intensity of Low and requires water to extinguish. There are reservoirs available with water (ReservoirYork) and sand (ReservoirUtah). DepositFacility is empty.
"[34, 34, 34]","['NavigateTo(ReservoirYork)', 'NavigateTo(ReservoirYork)', 'NavigateTo(LostPersonJacob)']","Alice should now navigate to ReservoirYork to be close enough to get the water supply. Bob should also navigate to ReservoirYork to collect water. Charlie, who has already successfully explored, can start navigating towards one of the lost persons to prepare for carrying them.","Alice is currently trying to collect water from ReservoirYork, Bob is currently trying to collect water from ReservoirYork, Charlie is currently trying to navigate to LostPersonJacob.",SussexFire is a non-chemical fire that requires water to extinguish. There are reservoirs available with water (ReservoirYork) and sand (ReservoirUtah). DepositFacility is empty. LostPersonJacob and LostPersonZoe have been located and require 2 agents each to carry.
"[34, 34, 34]","['GetSupply(ReservoirYork)', 'GetSupply(ReservoirYork)', 'Explore()']","Alice and Bob should collect water from ReservoirYork to extinguish the SussexFire, as they are already near it. Charlie should wait for another robot to help carry LostPersonJacob since it requires 2 agents. Meanwhile, Charlie can explore to potentially find LostPersonZoe.","Alice is currently collecting water from ReservoirYork, Bob is currently collecting water from ReservoirYork, Charlie is currently exploring for LostPersonZoe","SussexFire is a non-chemical fire that requires water to extinguish. There are reservoirs available with water (ReservoirYork) and sand (ReservoirUtah). DepositFacility is empty. LostPersonJacob and LostPersonZoe have been located and require 2 agents each to carry. Alice is at co-ordinates (8, 19), and Bob is at (9, 18), both are near ReservoirYork. Charlie is at co-ordinates (17, 4) and has successfully navigated to LostPersonJacob."
"[34, 34, 34]","['NavigateTo(SussexFire_Region_1)', 'NavigateTo(SussexFire_Region_1)', 'NavigateTo(ReservoirYork)']","Alice and Bob are both holding one unit of water and are close to the SussexFire_Region_1. They should navigate to SussexFire_Region_1 and use their water supplies to extinguish the fire. Charlie, who has no water, should navigate to ReservoirYork to collect water to help extinguish the fire.","Alice is currently navigating to SussexFire_Region_1, Bob is currently navigating to SussexFire_Region_1, Charlie is currently navigating to ReservoirYork","SussexFire is a non-chemical fire that requires water to extinguish. There are reservoirs available with water (ReservoirYork) and sand (ReservoirUtah). DepositFacility is empty. LostPersonJacob and LostPersonZoe have been located and require 2 agents each to carry. Alice is at co-ordinates (8, 19), and Bob is at (9, 18), both are near ReservoirYork. Charlie is at co-ordinates (0, 4) and has successfully explored and found LostPersonJacob."
"[34, 34, 34]","['UseSupply(SussexFire, Water)', 'UseSupply(SussexFire, Water)', 'NavigateTo(DepositFacility)']","Alice and Bob are both at SussexFire_Region_1 and have water to extinguish it. They should use their water supplies on the fire to lower its intensity. Charlie, who is not carrying any resources, should navigate towards the deposit to prepare to assist with carrying the lost persons to the deposit later.","Alice and Bob are currently extinguishing SussexFire_Region_1 using water, while Charlie is navigating to the deposit.",SussexFire is a non-chemical fire requiring water to extinguish. There are reservoirs available with water (ReservoirYork) and sand (ReservoirUtah). DepositFacility is empty. LostPersonJacob and LostPersonZoe have been located and require 2 agents each to carry. Alice and Bob are near SussexFire_Region_1 with water to extinguish the fire. Charlie is free to assist with carrying people or collecting more water.
"[34, 34, 34]","['Carry(LostPersonJacob)', 'Carry(LostPersonZoe)', 'Explore()']","Since SussexFire has an average intensity of None, it's already extinguished, and no further action is needed there. Alice and Bob should now focus on the lost persons. Charlie should begin exploring to find a path to assist with the lost persons or to find any new arising tasks.","Alice is currently to carry LostPersonJacob, Bob is currently to carry LostPersonZoe, Charlie is currently to explore the environment to assist with tasks","SussexFire is Non-chemical and requires Water to extinguish, it has average intensity of None. ReservoirYork contains Water. DepositFacility is empty. LostPersonJacob and LostPersonZoe have been located and require 2 agents each to carry. Alice and Bob have successfully used Water on SussexFire. Charlie is at the DepositFacility."
"[34, 34, 34]","['NavigateTo(LostPersonJacob)', 'NavigateTo(LostPersonZoe)', 'Explore()']","Alice and Bob should navigate to the respective lost persons they attempted to carry in the previous step. Alice should navigate to LostPersonJacob, and Bob should navigate to LostPersonZoe. Once they are close enough, they can attempt to carry the lost persons again. Charlie should continue to explore the environment to assist with any other tasks or to be ready to help with carrying if needed.","Alice is currently navigating to LostPersonJacob, Bob is currently navigating to LostPersonZoe, Charlie is currently exploring.","SussexFire is Non-chemical and requires Water to extinguish, it has average intensity of None. ReservoirYork contains Water. DepositFacility is empty. LostPersonJacob and LostPersonZoe have been located and require 2 agents each to carry. Alice and Bob are close to LostPersonJacob and LostPersonZoe, respectively, but need to navigate closer to carry. Charlie has been exploring and is currently at co-ordinates (11,4)."
"[34, 34, 34]","['Carry(LostPersonJacob)', 'Idle', 'NavigateTo(LostPersonJacob)']","Since the SussexFire is already extinguished, the focus should be on rescuing the lost people. Alice and Bob need to pair up with another robot to carry LostPersonJacob and LostPersonZoe. Charlie should navigate to assist either Alice or Bob in carrying the lost persons. Alice and Bob are already at the location of the lost persons, so they should attempt to carry them now with Charlie's help.","Alice and Charlie to carry LostPersonJacob, Bob to wait for Alice or Charlie to assist with LostPersonZoe.","SussexFire is Non-chemical and requires Water to extinguish, it has average intensity of None. ReservoirYork contains Water. DepositFacility is empty. LostPersonJacob and LostPersonZoe have been located and require 2 agents each to carry. Alice and Bob are close to LostPersonJacob and LostPersonZoe, respectively. Charlie is at co-ordinates (16, 4) with an empty inventory."
"[34, 34, 34]","['NavigateTo(DepositFacility)', 'NavigateTo(LostPersonZoe)', 'Explore()']",Alice is already carrying LostPersonJacob and needs to navigate to the DepositFacility to drop them off. Bob needs to navigate to LostPersonZoe to help carry them to a deposit. Charlie should continue to explore the environment to assist with any remaining tasks or prepare for new fire regions that may appear.,"Alice is currently navigating to deposit with LostPersonJacob, Bob is currently navigating to carry LostPersonZoe, Charlie is currently exploring to assist with tasks","SussexFire is Non-chemical and requires Water to extinguish, it has average intensity of None. ReservoirYork contains Water. DepositFacility is empty. LostPersonJacob and LostPersonZoe have been located and require 2 agents each to carry. Alice is carrying LostPersonJacob. Alice and Bob are close to LostPersonJacob and LostPersonZoe, respectively. Charlie is at co-ordinates (18, 3) with an empty inventory."
"[34, 34, 34]","['NavigateTo(DepositFacility)', 'Carry(LostPersonZoe)', 'Explore()']","Since Alice is already carrying LostPersonJacob, she needs to navigate to the DepositFacility to drop him off. Bob, who is close to LostPersonZoe, should carry her so that they can both be transported to a deposit later. Charlie should continue to explore the environment to assist with tasks or be ready to help carry LostPersonZoe to a deposit when needed.","Alice is currently navigating to DepositFacility with LostPersonJacob, Bob is currently carrying LostPersonZoe, Charlie is continuing exploration to assist with tasks","SussexFire is Non-chemical and requires Water to extinguish, it has average intensity of None. ReservoirYork contains Water. DepositFacility is empty. LostPersonJacob and LostPersonZoe have been located and require 2 agents each to carry. Alice is carrying LostPersonJacob. Alice and Bob are close to LostPersonJacob and LostPersonZoe, respectively. Charlie is at co-ordinates (0, 3) with an empty inventory."
"[34, 34, 34]","['NavigateTo(DepositFacility)', 'NavigateTo(DepositFacility)', 'Carry(LostPersonZoe)']","Since Alice and Bob are each carrying LostPersonJacob and LostPersonZoe, they should navigate to the DepositFacility to drop them off. Charlie should move to assist with carrying one of the lost persons to fulfill the requirement of two agents needed for carrying.","Alice is currently navigating to deposit with LostPersonJacob, Bob is currently navigating to deposit with LostPersonZoe, Charlie is currently assisting with carrying LostPersonZoe","SussexFire is Non-chemical and requires Water to extinguish, it has average intensity of None. ReservoirYork contains Water. DepositFacility is empty. LostPersonJacob and LostPersonZoe have been located and require 2 agents each to carry. Alice and Bob are each successfully carrying LostPersonJacob and LostPersonZoe, respectively. Charlie is at co-ordinates (0, 23) with an empty inventory."
"[34, 34, 34]","['NavigateTo(DepositFacility)', 'NavigateTo(DepositFacility)', 'NavigateTo(LostPersonZoe)']","Alice and Bob are holding LostPersonJacob and LostPersonZoe, so they should now navigate to DepositFacility to drop them off. Charlie should navigate to LostPersonZoe to assist in carrying her to the deposit.","Alice is currently navigating to deposit with LostPersonJacob, Bob is currently navigating to deposit with LostPersonZoe, Charlie is currently navigating to LostPersonZoe","SussexFire is Non-chemical and requires Water to extinguish, it has average intensity of None. ReservoirYork contains Water. DepositFacility is empty. LostPersonJacob and LostPersonZoe have been located and require 2 agents each to carry. Alice and Bob are each successfully carrying LostPersonJacob and LostPersonZoe, respectively. Charlie is at co-ordinates (0, 23) with an empty inventory."
"[34, 34, 34]","['NavigateTo(DepositFacility)', 'NavigateTo(DepositFacility)', 'NavigateTo(DepositFacility)']","Since Alice and Bob are both holding LostPersonJacob and LostPersonZoe respectively, they need to navigate to the DepositFacility to drop them off. As two agents are required to carry each lost person, and since Charlie is currently not carrying anyone, Charlie should navigate to DepositFacility to assist with the drop off.","Alice and Bob are currently navigating to DepositFacility to drop off LostPersonJacob and LostPersonZoe, Charlie is currently navigating to DepositFacility to assist in the drop off.","SussexFire is Non-chemical and requires Water to extinguish, it has average intensity of None. ReservoirYork contains Water. DepositFacility is empty. LostPersonJacob and LostPersonZoe have been located and require 2 agents each to carry. Alice and Bob are each successfully carrying LostPersonJacob and LostPersonZoe, respectively. Charlie is at co-ordinates (23, 6) with an empty inventory."
"[34, 34, 34]","['DropOff(DepositFacility, LostPersonJacob)', 'DropOff(DepositFacility, LostPersonZoe)', 'Explore()']","Since SussexFire has an average intensity of none, the fire is already extinguished, and no further action is needed there. Alice and Bob have successfully navigated to the DepositFacility with LostPersonJacob and LostPersonZoe, respectively. They must now perform the dropoff action to complete their task. Charlie, who has an empty inventory and no current task, should be directed to explore to ensure there are no new fires or lost persons.","Alice and Bob are currently dropping off LostPersonJacob and LostPersonZoe at DepositFacility, Charlie is currently exploring for any new fires or lost persons","SussexFire is Non-chemical and requires Water to extinguish, currently at intensity None. ReservoirYork contains Water. LostPersonJacob and LostPersonZoe have been located and require 2 agents each to carry. Alice and Bob are each successfully carrying LostPersonJacob and LostPersonZoe, respectively. Charlie is at co-ordinates (11, 24) with an empty inventory."
"[34, 34, 34]","['Idle', 'Idle', 'NavigateTo(DepositFacility)']","Alice and Bob need to wait for Charlie to navigate to DepositFacility so they can all drop off LostPersonJacob and LostPersonZoe. Since the SussexFire is already extinguished and no new fire regions have been reported, Charlie should navigate to the deposit to help Alice and Bob.","Alice is currently waiting for Charlie to finish navigating, Bob is currently waiting for Charlie to finish navigating, and Charlie is currently navigating to DepositFacility","SussexFire is Non-chemical and requires Water to extinguish, currently at intensity None. ReservoirYork contains Water. LostPersonJacob and LostPersonZoe have been located and require 2 agents each to carry. Alice at co-ordinates (12, 23) and Bob at co-ordinates (12, 25) are each carrying LostPersonJacob and LostPersonZoe, respectively. Charlie is at co-ordinates (11, 24) with an empty inventory."
"[34, 34, 34]","['NavigateTo(DepositFacility)', 'NavigateTo(DepositFacility)', 'Idle']","Alice and Bob need to navigate to the DepositFacility to drop off LostPersonJacob and LostPersonZoe. As they are already carrying the lost persons, they should navigate together to the deposit. Charlie, who is already at the DepositFacility, should wait for Alice and Bob to arrive so that they can collectively perform the dropoff action.","Alice is currently navigating to the deposit with LostPersonJacob, Bob is currently navigating to the deposit with LostPersonZoe, Charlie is currently waiting at the deposit.",SussexFire is extinguished. ReservoirYork contains Water. LostPersonJacob and LostPersonZoe have been located and require 2 agents each to carry. Alice and Bob are carrying LostPersonJacob and LostPersonZoe. Charlie is at DepositFacility with an empty inventory.
"[34, 34, 34]","['NavigateTo(DepositFacility)', 'NavigateTo(DepositFacility)', 'NavigateTo(DepositFacility)']","Alice and Bob should navigate to DepositFacility if not already there, and wait for Charlie to join them. Charlie should navigate to the DepositFacility to join Alice and Bob. Once all three are at the DepositFacility, they can perform the DropOff action simultaneously for both LostPersonJacob and LostPersonZoe.","Alice is currently waiting to drop off LostPersonJacob, Bob is currently waiting to drop off LostPersonZoe, Charlie is currently navigating to the DepositFacility.","SussexFire is extinguished. ReservoirYork contains Water. LostPersonJacob and LostPersonZoe have been located and require 2 agents each to carry. Alice and Bob are carrying LostPersonJacob and LostPersonZoe. Charlie is at co-ordinates (13, 24) with an empty inventory."
"[34, 34, 34]","['DropOff(DepositFacility, LostPersonJacob)', 'DropOff(DepositFacility, LostPersonZoe)', 'GetSupply(ReservoirYork)']","As the SussexFire has been extinguished and both lost persons have been located and are currently being carried by Alice and Bob, the next step is for Alice and Bob to navigate to the DepositFacility to drop off LostPersonJacob and LostPersonZoe. Charlie should fill up the inventory with water from ReservoirYork to be prepared for any new fire regions that may appear.","Alice and Bob are currently trying to drop off LostPersonJacob and LostPersonZoe at DepositFacility, Charlie is currently trying to collect water from ReservoirYork until inventory is full","SussexFire is extinguished. ReservoirYork contains Water. LostPersonJacob and LostPersonZoe have been located and require 2 agents each to carry. Alice and Bob are carrying LostPersonJacob and LostPersonZoe. Charlie is at co-ordinates (12, 23) with an empty inventory."
"[34, 34, 34]","['NavigateTo(DepositFacility)', 'NavigateTo(DepositFacility)', 'NavigateTo(ReservoirYork)']",Alice and Bob should navigate to the DepositFacility so they can drop off LostPersonJacob and LostPersonZoe with Charlie's help. Charlie should navigate to ReservoirYork to collect water until his inventory is full.,"Alice is currently navigating to DepositFacility, Bob is currently navigating to DepositFacility, Charlie is currently navigating to ReservoirYork to collect water.","SussexFire is extinguished. ReservoirYork contains Water. LostPersonJacob and LostPersonZoe have been located and require 2 agents each to carry. Alice and Bob are carrying LostPersonJacob and LostPersonZoe. Charlie is at co-ordinates (12, 23) with an empty inventory."
"[34, 34, 34]","['DropOff(DepositFacility, LostPersonJacob)', 'DropOff(DepositFacility, LostPersonZoe)', 'GetSupply(ReservoirYork)']","Alice and Bob should navigate to DepositFacility and drop off LostPersonJacob and LostPersonZoe now that they are carrying them. Charlie should collect water from ReservoirYork until their inventory is full, as preparation for any new fires that may appear.","Alice and Bob are currently dropping off LostPersonJacob and LostPersonZoe at DepositFacility, Charlie is currently collecting water from ReservoirYork.","SussexFire is extinguished. ReservoirYork contains Water. LostPersonJacob and LostPersonZoe have been located and require 2 agents each to carry. Alice and Bob are carrying LostPersonJacob and LostPersonZoe. Charlie is at co-ordinates (8, 19) with an empty inventory."
"[34, 34, 34]","['NavigateTo(DepositFacility)', 'NavigateTo(DepositFacility)', 'Explore()']",Alice and Bob can now navigate to DepositFacility to be close enough to drop off LostPersonJacob and LostPersonZoe. Charlie can explore to potentially find any new objects or people since all other tasks are being handled.,"Alice and Bob are carrying LostPersonJacob and LostPersonZoe to deposit, Charlie is exploring the environment","SussexFire is extinguished. ReservoirYork contains Water. LostPersonJacob and LostPersonZoe have been located and require 2 agents each to carry. Alice and Bob are carrying LostPersonJacob and LostPersonZoe. Charlie is at co-ordinates (8, 19) with 1 unit of Water in inventory."
"[34, 34, 34]","['NavigateTo(DepositFacility)', 'NavigateTo(DepositFacility)', 'NavigateTo(DepositFacility)']","Alice and Bob need to navigate to the same deposit to drop off LostPersonJacob and LostPersonZoe. Since both have a person in their inventory, they cannot carry out any action other than navigating or dropping off the person. Charlie should navigate to the DepositFacility to assist in the drop-off of the lost persons since both require 2 agents to carry and can only be dropped off with all agents present at the deposit.","Alice and Bob are currently navigating to DepositFacility to drop off LostPersonJacob and LostPersonZoe, Charlie is currently navigating to DepositFacility.","SussexFire is extinguished. ReservoirYork contains Water. LostPersonJacob and LostPersonZoe have been located and require 2 agents each to carry. Alice and Bob are carrying LostPersonJacob and LostPersonZoe. Charlie is at co-ordinates (0, 9) with 1 unit of Water in inventory."
"[34, 34, 34]","['NavigateTo(DepositFacility)', 'NavigateTo(DepositFacility)', 'NavigateTo(DepositFacility)']","Alice and Bob should navigate to the DepositFacility to drop off LostPersonJacob and LostPersonZoe respectively, as they are both already carrying the lost persons. Charlie should navigate to the DepositFacility as well to assist in the dropoff since he is not carrying anyone and has a unit of water which is no longer needed as the fire is extinguished.","Alice and Bob are currently navigating to the DepositFacility, Charlie is currently navigating to the DepositFacility to assist in the dropoff",SussexFire is extinguished. ReservoirYork contains Water. LostPersonJacob and LostPersonZoe have been located and require 2 agents each to carry. Alice and Bob are carrying LostPersonJacob and LostPersonZoe. Charlie has 1 unit of Water in inventory.
"[34, 34, 34]","['Idle', 'Idle', 'NavigateTo(DepositFacility)']","Alice and Bob need to remain idle and wait for Charlie to navigate to DepositFacility so that all three can drop off LostPersonJacob and LostPersonZoe. Since SussexFire is already extinguished, Charlie doesn't need to use his water supply and should instead help with dropping off the persons.","Alice and Bob are currently waiting to drop off LostPersonJacob and LostPersonZoe at DepositFacility, while Charlie is currently navigating to DepositFacility to assist in the drop off.",SussexFire is extinguished. ReservoirYork contains Water. LostPersonJacob and LostPersonZoe have been located and require 2 agents each to carry. Alice and Bob are carrying LostPersonJacob and LostPersonZoe. Charlie has 1 unit of Water in inventory. All three robots are near DepositFacility.
"[34, 34, 34]","['NavigateTo(DepositFacility)', 'NavigateTo(DepositFacility)', 'Idle']","Alice and Bob need to navigate to DepositFacility to drop off LostPersonJacob and LostPersonZoe. Charlie, who is already at DepositFacility, should wait for Alice and Bob to arrive so they can collectively drop off the persons they are carrying.","Alice and Bob are currently navigating to DepositFacility, Charlie is currently waiting at DepositFacility.","SussexFire is extinguished. ReservoirYork contains Water. LostPersonJacob and LostPersonZoe have been located and require 2 agents each to carry. Alice and Bob are carrying LostPersonJacob and LostPersonZoe, respectively. Charlie has 1 unit of Water in inventory. All three robots are near DepositFacility."
"[34, 34, 34]","['NavigateTo(DepositFacility)', 'Idle', 'NavigateTo(DepositFacility)']","Alice and Bob should navigate to the DepositFacility if they are not already there, then wait for Charlie to arrive so they can all drop off LostPersonJacob and LostPersonZoe together. Charlie should move towards the DepositFacility to join Alice and Bob for the drop off.","Alice is currently waiting to drop off LostPersonJacob, Bob is currently waiting to drop off LostPersonZoe, Charlie is currently navigating to the DepositFacility for the drop off.","SussexFire is extinguished. ReservoirYork contains Water. LostPersonJacob and LostPersonZoe have been located and require 2 agents each to carry. Alice and Bob are carrying LostPersonJacob and LostPersonZoe, respectively. Charlie has 1 unit of Water in inventory. All three robots are near DepositFacility. Alice and Bob are ready to drop off the persons they are carrying at the deposit."
"[34, 34, 34]","['NavigateTo(DepositFacility)', 'NavigateTo(DepositFacility)', 'ClearInventory()']","Alice and Bob should navigate to DepositFacility to be at the same location and then perform the DropOff action simultaneously to successfully drop off LostPersonJacob and LostPersonZoe. Charlie, who is already at the deposit and has water in his inventory, has no fire to extinguish and no person to carry. He should clear his inventory to make space for future tasks.","Alice is currently navigating to the deposit, Bob is currently navigating to the deposit, Charlie is currently clearing his inventory","SussexFire is extinguished. ReservoirYork contains Water. LostPersonJacob and LostPersonZoe have been located and require 2 agents each to carry. Alice and Bob are carrying LostPersonJacob and LostPersonZoe, respectively. Charlie has 1 unit of Water in inventory. All three robots are near DepositFacility. Alice and Bob are ready to drop off the persons they are carrying at the deposit. Charlie is at the deposit but not carrying a person."
"[34, 34, 34]","['DropOff(DepositFacility, LostPersonJacob)', 'DropOff(DepositFacility, LostPersonZoe)', 'NavigateTo(DepositFacility)']","Alice and Bob should navigate to the DepositFacility to drop off LostPersonJacob and LostPersonZoe, as they are both carrying a person and are close to the deposit. Charlie should navigate to the DepositFacility as well to be ready to assist with any further tasks.","Alice and Bob are currently trying to drop off LostPersonJacob and LostPersonZoe at the DepositFacility, Charlie is currently idle","SussexFire is extinguished. ReservoirYork contains Water. LostPersonJacob and LostPersonZoe have been located and require 2 agents each to carry. Alice and Bob are carrying LostPersonJacob and LostPersonZoe, respectively. All three robots are near DepositFacility. Alice and Bob are ready to drop off the persons they are carrying at the deposit."
