Step,Action,Reason,Subtask,Memory
"[34, 34, 34, 34, 34]","['UseSupply(RedFire, Sand)', 'UseSupply(RedFire, Sand)', 'NavigateTo(RedFire_Region_1)', 'UseSupply(RedFire, Sand)', 'UseSupply(RedFire, Sand)']","Alice, Bob, David, and Emma should use their sand supplies on different regions of RedFire to reduce its intensity. Charlie needs to navigate to a region of RedFire to use the sand supply he is holding. All robots need to make sure they are targeting different regions to efficiently combat the fire. Since RedFire is a chemical fire, sand is the appropriate resource to use.","Alice is currently extinguishing RedFire_Region_1, Bob is currently extinguishing RedFire_Region_2, Charlie is currently navigating to RedFire_Region_6, David is currently extinguishing RedFire_Region_4, Emma is currently extinguishing RedFire_Region_7","Deposit Facility holds LostPersonThomas. RedFire is a chemical fire and requires sand to be extinguished. Alice, Bob, David, and Emma have collected sand and are ready to extinguish RedFire. Charlie has collected sand and needs to navigate to a region of RedFire to use it. David is at RedFire_Region_1 with sand."
"[34, 34, 34, 34, 34]","['GetSupply(ReservoirLibre)', 'GetSupply(ReservoirLibre)', 'NavigateTo(RedFire_Region_1)', 'GetSupply(ReservoirLibre)', 'GetSupply(ReservoirLibre)']","Alice, Bob, David, and Emma need to collect water instead of sand to extinguish the chemical fire, RedFire. Charlie, who is already at RedFire_Region_1 with sand, should navigate to a region of RedFire to use it. The robots need to find and carry LostPersonThomas to a deposit.","Alice is currently collecting water from ReservoirLibre, Bob is currently collecting water from ReservoirLibre, Charlie is currently navigating to extinguish RedFire_Region_6 using water, David is currently collecting water from ReservoirLibre, Emma is currently collecting water from ReservoirLibre,",Deposit Facility holds LostPersonThomas. RedFire is a chemical fire and requires sand to be extinguished. Charlie has collected sand and needs to navigate to a region of RedFire to use it. David is at RedFire_Region_1 with sand.
"[34, 34, 34, 34, 34]","['NavigateTo(ReservoirLibre)', 'NavigateTo(ReservoirLibre)', 'UseSupply(RedFire, Sand)', 'UseSupply(RedFire, Sand)', 'Explore()']","Alice, Bob, David, and Emma need to navigate to ReservoirLibre to collect water, which is the correct resource for extinguishing the chemical fire RedFire. Charlie has sand and needs to use it to extinguish a region of RedFire. David was last at RedFire_Region_1 and can start extinguishing there. Emma should start exploring to locate LostPersonThomas as the other robots are busy collecting resources or extinguishing the fire.","Alice, Bob, David, and Emma are currently trying to collect water from ReservoirLibre. Charlie is currently trying to extinguish RedFire using sand. Emma is currently trying to locate LostPersonThomas.",Deposit Facility holds LostPersonThomas. RedFire is a chemical fire and requires sand to be extinguished. Charlie and David have collected sand and need to navigate to a region of RedFire to use it. There are various regions of RedFire with different intensities that need to be extinguished using sand.
"[34, 34, 34, 34, 34]","['GetSupply(ReservoirTaj)', 'GetSupply(ReservoirTaj)', 'NavigateTo(RedFire_Region_1)', 'NavigateTo(RedFire_Region_2)', 'Explore()']","Alice and Bob should get sand from ReservoirTaj to extinguish the RedFire. Charlie, already having sand, should navigate to a specific region of RedFire to use it. David should also navigate to a fire region to use his sand. Emma should continue to explore to locate LostPersonThomas.","Alice and Bob are currently trying to collect sand from ReservoirTaj, Charlie and David are currently trying to extinguish RedFire regions using sand, Emma is currently trying to explore to locate LostPersonThomas.",Deposit Facility holds LostPersonThomas. RedFire is a chemical fire and requires sand to be extinguished. Charlie has collected sand and needs to navigate to a region of RedFire to use it. Alice and Bob have navigated to the ReservoirLibre but need to collect sand from ReservoirTaj. Emma has found no persons while exploring.
"[34, 34, 34, 34, 34]","['UseSupply(RedFire, Sand)', 'Move(Left)', 'GetSupply(ReservoirTaj)', 'NavigateTo(ReservoirTaj)', 'Explore()']","Alice can use her sand supply on RedFire_Region_6 which is at low intensity and nearby. Bob, carrying sand, can move towards RedFire_Region_6 and prepare to assist with extinguishing. Charlie should collect sand from ReservoirTaj to be able to extinguish regions of RedFire. David, with no supplies, should navigate to collect sand from ReservoirTaj. Emma, who has been exploring, should continue to do so in order to find LostPersonThomas.","Alice is currently extinguishing RedFire_Region_6, Bob is currently navigating to RedFire_Region_6, Charlie is currently collecting sand from ReservoirTaj, David is currently navigating to ReservoirTaj, Emma is currently exploring to locate LostPersonThomas",Deposit Facility holds LostPersonThomas. RedFire is a chemical fire and requires sand to be extinguished. Charlie has collected sand and needs to navigate to a region of RedFire to use it. Alice and Bob have navigated to the ReservoirLibre but need to collect sand from ReservoirTaj. Emma has found no persons while exploring.
"[34, 34, 34, 34, 34]","['UseSupply(RedFire, Sand)', 'UseSupply(RedFire, Sand)', 'NavigateTo(ReservoirTaj)', 'GetSupply(ReservoirTaj)', 'Explore()']",Alice and Bob are close to RedFire_Region_6 and RedFire_Region_4 respectively and can use sand to extinguish these parts of RedFire. Charlie attempted to get sand from ReservoirTaj but failed because he wasn't close enough; now he should navigate to ReservoirTaj to collect sand. David has successfully navigated to ReservoirTaj and should now collect sand to use on RedFire. Emma should continue exploring to locate LostPersonThomas.,"Alice is currently extinguishing RedFire_Region_6 using sand, Bob is currently extinguishing RedFire_Region_4 using sand, Charlie is currently navigating to ReservoirTaj to collect sand, David is currently collecting sand from ReservoirTaj, Emma is currently exploring to locate LostPersonThomas",Deposit Facility holds LostPersonThomas. RedFire is a chemical fire and requires sand to be extinguished. Alice and Bob are near RedFire and can extinguish it using sand. Charlie needs to collect sand from ReservoirTaj to extinguish the fire. David has successfully navigated to ReservoirTaj and can collect sand. Emma has found no persons while exploring.
"[34, 34, 34, 34, 34]","['NavigateTo(RedFire_Region_1)', 'UseSupply(RedFire, Water)', 'GetSupply(ReservoirTaj)', 'UseSupply(RedFire, Sand)', 'Explore()']","Alice needs to navigate to RedFire_Region_1 to use water on it. Bob, being close to RedFire, should use water on RedFire_Region_6. Charlie is at ReservoirTaj, should collect sand to use on the fire. David should use his sand supply on a high-intensity region of RedFire. Emma should continue exploring to locate LostPersonThomas.","Alice is currently navigating to RedFire_Region_1, Bob is currently using water on RedFire_Region_6, Charlie is currently collecting sand from ReservoirTaj, David is currently using his sand supply on the high-intensity region of RedFire, Emma is currently exploring to locate LostPersonThomas",Deposit Facility holds LostPersonThomas. RedFire is a chemical fire and requires water to be extinguished. Alice and Bob are near RedFire and can extinguish it using water. Charlie is at ReservoirTaj and can collect sand to extinguish the fire. David has sand and is near RedFire. Emma has explored but found no persons.
"[34, 34, 34, 34, 34]","['GetSupply(ReservoirLibre)', 'GetSupply(ReservoirLibre)', 'GetSupply(ReservoirLibre)', 'GetSupply(ReservoirLibre)', 'GetSupply(ReservoirLibre)']","Alice, Bob, and Emma should collect water from ReservoirLibre to extinguish RedFire. Charlie should clear his inventory of sand and collect water as well since RedFire is a chemical fire. David has sand but should also switch to collecting water for the chemical fire. Once they have water, they can use it to extinguish the various regions of RedFire.","Alice, Bob, Charlie, David, and Emma are all currently trying to extinguish RedFire using water.","Deposit Facility holds LostPersonThomas. RedFire is a chemical fire and requires water to be extinguished. Alice, Bob, David, and Emma are near RedFire and can extinguish it using water. Charlie is at ReservoirTaj and has collected sand but should collect water instead."
"[34, 34, 34, 34, 34]","['NavigateTo(ReservoirLibre)', 'UseSupply(RedFire, Water)', 'NavigateTo(ReservoirLibre)', 'UseSupply(RedFire, Water)', 'NavigateTo(ReservoirLibre)']","Alice, Charlie, and Emma need to navigate to ReservoirLibre to collect water. Bob, David, and Emma, who are already near RedFire, should use their water supply on the fire. As the fire is spreading, it is crucial for Alice, Charlie, and Emma to collect water and assist in extinguishing the fire. Bob, David, and Emma should focus on regions with High intensity first.","Alice, Charlie, and Emma are currently navigating to ReservoirLibre. Bob, David, and Emma are currently extinguishing RedFire regions with intensity High using water.","RedFire is a chemical type fire and requires water to be extinguished. Several regions of RedFire are at High intensity and need to be addressed quickly. Deposit Facility holds LostPersonThomas. Bob, David, and Charlie have water in their inventory."
"[34, 34, 34, 34, 34]","['GetSupply(ReservoirLibre)', 'NavigateTo(RedFire_Region_2)', 'NavigateTo(RedFire_Region_1)', 'NavigateTo(RedFire_Region_1)', 'GetSupply(ReservoirLibre)']","Alice and Emma are now at ReservoirLibre and should collect water. Bob, Charlie, and David should navigate to the regions of RedFire with high intensity to use their water supply. Once the high-intensity regions are extinguished, they can move on to the medium and low-intensity regions.","Alice and Emma are currently trying to collect water from ReservoirLibre, Bob is currently trying to extinguish RedFire_Region_2 using water, Charlie is currently trying to extinguish RedFire_Region_16 using water, David is currently trying to extinguish RedFire_Region_4 using water","RedFire is a chemical type fire and requires water to be extinguished. Several regions of RedFire are at high intensity and need to be addressed quickly. Deposit Facility holds LostPersonThomas. Bob, David, and Charlie need to collect water. Alice and Emma have navigated to ReservoirLibre and need to collect water."
"[34, 34, 34, 34, 34]","['UseSupply(RedFire, Water)', 'GetSupply(ReservoirLibre)', 'GetSupply(ReservoirLibre)', 'GetSupply(ReservoirLibre)', 'UseSupply(RedFire, Water)']","Alice can use her water supply on a region of RedFire. Bob should collect water from ReservoirLibre as he has no resources to fight the fire. Charlie can use his sand supply on a region of RedFire, but since it's a chemical fire, he needs to collect water instead. David should also collect water from ReservoirLibre. Emma can use her water supply on a region of RedFire.","Alice is currently extinguishing RedFire_Region_5 using water, Bob is currently recollecting water from ReservoirLibre if needed, Charlie is currently recollecting water from ReservoirLibre if needed, David is currently recollecting water from ReservoirLibre if needed, Emma is currently extinguishing RedFire_Region_7 using water","RedFire is a chemical type fire and requires water to be extinguished. Several regions of RedFire are at high intensity and need to be addressed quickly. Deposit Facility holds LostPersonThomas. Bob, David, and Charlie need to collect water. Alice and Emma have navigated to ReservoirLibre and need to collect water. Alice, Bob, Charlie, David, and Emma have all successfully navigated to the RedFire or its regions."
