Step,Action,Reason,Subtask,Memory
"[34, 34, 34, 34, 34]","['NavigateTo(ReservoirTaj)', 'NavigateTo(ReservoirTaj)', 'NavigateTo(ReservoirTaj)', 'Explore()', 'Explore()']","As all robots are at their initial state with no actions taken yet, the first step should involve each robot starting to address different subtasks. Alice, Bob, and Charlie can start collecting sand from ReservoirTaj to extinguish the chemical fire RedFire. Meanwhile, David and Emma can explore to find LostPersonThomas.","Alice is currently trying to collect sand from ReservoirTaj, Bob is currently trying to collect sand from ReservoirTaj, Charlie is currently trying to collect sand from ReservoirTaj, David is currently trying to locate LostPersonThomas, Emma is currently trying to locate LostPersonThomas",[]
"[34, 34, 34, 34, 34]","['GetSupply(ReservoirTaj)', 'GetSupply(ReservoirTaj)', 'GetSupply(ReservoirTaj)', 'NavigateTo(LostPersonThomas)', 'NavigateTo(LostPersonThomas)']","Alice, Bob, and Charlie should collect sand from ReservoirTaj to extinguish the chemical RedFire. David and Emma should navigate towards LostPersonThomas to carry and rescue him.","Alice is currently collecting sand, Bob is currently collecting sand, Charlie is currently collecting sand, David is currently navigating to LostPersonThomas, Emma is currently navigating to LostPersonThomas","Alice, Bob, and Charlie are near ReservoirTaj. David and Emma have successfully explored and found LostPersonThomas. RedFire is chemical and requires sand to extinguish."
"[34, 34, 34, 34, 34]","['UseSupply(RedFire, Sand)', 'UseSupply(RedFire, Sand)', 'UseSupply(RedFire, Sand)', 'Carry(LostPersonThomas)', 'Carry(LostPersonThomas)']","Alice, Bob, and Charlie should use their sand supply on different regions of RedFire to start extinguishing it. David and Emma should carry LostPersonThomas since they are already at his location.","Alice is currently extinguishing RedFire_Region_1, Bob is currently extinguishing RedFire_Region_2, Charlie is currently extinguishing RedFire_Region_3, David is currently carrying LostPersonThomas, Emma is currently carrying LostPersonThomas","Alice, Bob, and Charlie are near ReservoirTaj with sand in their inventory. David and Emma have successfully located LostPersonThomas. RedFire is chemical and requires sand to extinguish. Alice, Bob, and Charlie have successfully collected sand to use on RedFire."
"[34, 34, 34, 34, 34]","['NavigateTo(RedFire_Region_1)', 'NavigateTo(RedFire_Region_2)', 'NavigateTo(RedFire_Region_3)', 'NavigateTo(DepositFacility)', 'NavigateTo(DepositFacility)']","Alice should navigate to one of the remaining regions of RedFire to use her sand on it. Bob needs to navigate to the fire to be in range to use his sand. Charlie can navigate to another region of RedFire to use his sand. David and Emma, who are carrying LostPersonThomas, need to navigate to the DepositFacility to drop him off.","Alice is currently navigating to extinguish RedFire_Region_1, Bob is currently navigating to extinguish RedFire_Region_2, Charlie is currently navigating to extinguish RedFire_Region_3, David and Emma are currently navigating to deposit with LostPersonThomas.","Alice, Bob, and Charlie are near ReservoirTaj with sand in their inventory. David and Emma have successfully located LostPersonThomas and are carrying him. RedFire is chemical and requires sand to extinguish. David and Emma are at coordinates (5, 23) and (6, 22) respectively, carrying LostPersonThomas."
"[34, 34, 34, 34, 34]","['UseSupply(RedFire, Sand)', 'UseSupply(RedFire, Sand)', 'GetSupply(ReservoirTaj)', 'NavigateTo(DepositFacility)', 'NavigateTo(DepositFacility)']","Alice should use her sand supply on RedFire_Region_1 to start extinguishing the fire. Bob should do the same on RedFire_Region_2. Charlie, currently without sand, needs to collect sand from ReservoirTaj to contribute to extinguishing the fire. David and Emma are carrying LostPersonThomas and need to navigate to DepositFacility to drop him off.","Alice is currently trying to extinguish RedFire_Region_1 using sand, Bob is currently trying to extinguish RedFire_Region_2 using sand, Charlie is currently trying to collect sand from ReservoirTaj, David and Emma are currently trying to drop LostPersonThomas in deposit","Alice, Bob, and Charlie are near the RedFire with sand in their inventory. David and Emma have successfully located LostPersonThomas and are carrying him to the DepositFacility. RedFire is chemical and requires sand to extinguish."
"[34, 34, 34, 34, 34]","['NavigateTo(ReservoirLibre)', 'UseSupply(RedFire, Water)', 'NavigateTo(ReservoirLibre)', 'NavigateTo(DepositFacility)', 'NavigateTo(DepositFacility)']",Alice needs to navigate to ReservoirLibre to collect water to extinguish RedFire. Bob can start extinguishing RedFire_Region_1 using water. Charlie failed to get supply from ReservoirTaj because he wasn't close enough; he should navigate to ReservoirLibre to collect water. David and Emma should navigate to DepositFacility to drop off LostPersonThomas.,"Alice is currently navigating to ReservoirLibre, Bob is currently extinguishing RedFire_Region_1, Charlie is currently navigating to ReservoirLibre, David and Emma are currently navigating to DepositFacility with LostPersonThomas.","Alice, Bob, and Charlie are near the RedFire with empty inventories. David and Emma have successfully located LostPersonThomas and are carrying him. RedFire is chemical and requires water to extinguish."
"[34, 34, 34, 34, 34]","['GetSupply(ReservoirLibre)', 'NavigateTo(RedFire_Region_1)', 'GetSupply(ReservoirLibre)', 'NavigateTo(DepositFacility)', 'NavigateTo(DepositFacility)']","Alice, Bob, and Charlie should collect water to extinguish the RedFire. David and Emma should navigate to the DepositFacility to drop off LostPersonThomas.","Alice, Bob, and Charlie are currently collecting water from ReservoirLibre. David and Emma are currently navigating to the DepositFacility with LostPersonThomas.","Alice, Bob, and Charlie are near RedFire with empty inventories. David and Emma are carrying LostPersonThomas. RedFire is chemical and requires water to extinguish. Alice is at (21, 9), Bob is at (14, 9), Charlie is at (22, 8), David is at (23, 14), Emma is at (24, 13)."
"[34, 34, 34, 34, 34]","['UseSupply(RedFire, Water)', 'UseSupply(RedFire, Water)', 'UseSupply(RedFire, Water)', 'NavigateTo(DepositFacility)', 'NavigateTo(DepositFacility)']","Alice, Bob, and Charlie can use their water supply on RedFire to lower the intensity of different regions. David and Emma should navigate to DepositFacility to drop off LostPersonThomas. Since the remaining subtasks involve extinguishing the RedFire regions, Alice, Bob, and Charlie should focus on that while David and Emma complete the person drop-off.","Alice is currently extinguishing RedFire_Region_1, Bob is currently extinguishing RedFire_Region_3, Charlie is currently extinguishing RedFire, David and Emma are currently dropping LostPersonThomas in deposit","Alice, Bob, and Charlie are near RedFire with water in inventories. David and Emma are carrying LostPersonThomas. RedFire is chemical and requires water to extinguish. Alice is at (21, 9), Bob is at (17, 7), Charlie is at (22, 8), David is at (24, 15), Emma is at (25, 14). DepositFacility is empty. ReservoirLibre contains water. ReservoirTaj contains sand."
"[34, 34, 34, 34, 34]","['NavigateTo(RedFire_Region_1)', 'NavigateTo(RedFire_Region_3)', 'NavigateTo(RedFire_Region_1)', 'DropOff(DepositFacility, LostPersonThomas)', 'DropOff(DepositFacility, LostPersonThomas)']","Alice, Bob, and Charlie need to navigate to the specific regions of RedFire that are on fire (Region_1 and Region_3) and then use their water supply to extinguish it. Meanwhile, David and Emma are carrying LostPersonThomas and need to navigate to the DepositFacility to drop him off.","Alice is currently navigating to RedFire_Region_1, Bob is currently navigating to RedFire_Region_3, Charlie is currently navigating to RedFire_Region_1, David is currently navigating to the DepositFacility with LostPersonThomas, Emma is currently navigating to the DepositFacility with LostPersonThomas.","Alice, Bob, and Charlie are near RedFire with empty inventories. David and Emma are carrying LostPersonThomas. RedFire is chemical and requires water to extinguish. Alice is at (21, 9), Bob is at (17, 7), Charlie is at (22, 8), David is at (23, 14), Emma is at (24, 13). DepositFacility is empty. ReservoirLibre contains water. ReservoirTaj contains sand."
"[34, 34, 34, 34, 34]","['NavigateTo(ReservoirLibre)', 'NavigateTo(ReservoirLibre)', 'NavigateTo(ReservoirLibre)', 'NavigateTo(ReservoirLibre)', 'NavigateTo(ReservoirLibre)']","Alice, Bob, and Charlie should navigate to their respective reservoirs to collect water, as the RedFire is chemical and requires water to extinguish. David and Emma, having completed their task of dropping off LostPersonThomas, can now help with the fire by also getting water from the reservoir. All robots then should navigate to the appropriate regions of RedFire to extinguish it with the collected water.","Alice is currently navigating to ReservoirLibre to collect water, Bob is currently navigating to ReservoirLibre to collect water, Charlie is currently navigating to ReservoirLibre to collect water, David is currently navigating to ReservoirLibre to collect water, Emma is currently navigating to ReservoirLibre to collect water","Alice, Bob, and Charlie are near RedFire with empty inventories. David and Emma have completed dropping off LostPersonThomas. RedFire is chemical and requires water to extinguish. The locations of the robots are: Alice at (16, 7), Bob at (17, 11), Charlie at (17, 7), David at (23, 14), Emma at (24, 13). DepositFacility is empty. ReservoirLibre contains water. ReservoirTaj contains sand."
"[34, 34, 34, 34, 34]","['GetSupply(ReservoirLibre)', 'GetSupply(ReservoirLibre)', 'GetSupply(ReservoirLibre)', 'GetSupply(ReservoirLibre)', 'GetSupply(ReservoirLibre)']","Alice, Bob, Charlie, David, and Emma are all near the RedFire which is chemical and requires water to extinguish. They all have empty inventories and are near the water reservoir, so they should get water from ReservoirLibre to use on the fire. They should target different regions of the fire to efficiently work towards extinguishing it. Since the fire is spreading, it's crucial to address the regions with medium intensity first.","Alice is currently extinguishing RedFire_Region_1 using water, Bob is currently extinguishing RedFire_Region_3 using water, Charlie is currently extinguishing RedFire_Region_6 using water, David is currently extinguishing RedFire_Region_7 using water, Emma is currently extinguishing RedFire_Region_8 using water","Alice is near RedFire with an empty inventory at coordinates (21, 9). Bob is near RedFire with an empty inventory at coordinates (22, 8). Charlie is near RedFire with an empty inventory at coordinates (22, 10). David is near RedFire with an empty inventory at coordinates (23, 9). Emma is near RedFire with an empty inventory at coordinates (21, 8). RedFire is chemical and requires water to extinguish. Deposit Facility is empty. ReservoirLibre contains water. ReservoirTaj contains sand."
"[34, 34, 34, 34, 34]","['NavigateTo(RedFire_Region_1)', 'NavigateTo(RedFire_Region_3)', 'NavigateTo(RedFire_Region_1)', 'NavigateTo(RedFire_Region_1)', 'NavigateTo(RedFire_Region_1)']","Alice, Bob, Charlie, David, and Emma all have water in their inventories and are near the RedFire. They should navigate to different regions of the RedFire and use their water supplies to extinguish the fire. Regions 1 and 3 have medium intensity and should be prioritized as they will spread the fire if not addressed.","Alice is currently navigating to RedFire_Region_1, Bob is currently navigating to RedFire_Region_3, Charlie is currently navigating to RedFire_Region_Center, David is currently navigating to RedFire_Region_6, Emma is currently navigating to RedFire_Region_7","Alice is near RedFire with water supply at coordinates (21, 9). Bob is near RedFire with water supply at coordinates (22, 8). Charlie is near RedFire with water supply at coordinates (22, 10). David is near RedFire with water supply at coordinates (23, 9). Emma is near RedFire with water supply at coordinates (21, 8). RedFire is chemical and requires water to extinguish. Deposit Facility is empty. ReservoirLibre contains water. ReservoirTaj contains sand."
"[34, 34, 34, 34, 34]","['UseSupply(RedFire, Water)', 'UseSupply(RedFire, Water)', 'UseSupply(RedFire, Water)', 'Move(Left)', 'Move(Right)']",Alice can use her water supply on RedFire_Region_1. Bob can use his water supply on RedFire_Region_3. Charlie can use his water supply on the center of RedFire. David can move left to reach a different region of the fire and then use his water supply. Emma can move right to reach a different region of the fire and then use her water supply.,"Alice is currently trying to extinguish RedFire_Region_1 using water, Bob is currently trying to extinguish RedFire_Region_3 using water, Charlie is currently trying to extinguish RedFire_Region_Center using water, David is currently trying to extinguish RedFire_Region_6 using water, Emma is currently trying to extinguish RedFire_Region_7 using water","Alice is near RedFire with water supply at coordinates (17, 7). Bob is near RedFire with water supply at coordinates (17, 11). Charlie is near RedFire with water supply at coordinates (16, 7). David is near RedFire with water supply at coordinates (17, 6). Emma is near RedFire with water supply at coordinates (17, 8). RedFire is chemical and requires water to extinguish. Deposit Facility is empty. ReservoirLibre contains water. ReservoirTaj contains sand."
"[34, 34, 34, 34, 34]","['NavigateTo(ReservoirLibre)', 'NavigateTo(ReservoirLibre)', 'NavigateTo(ReservoirLibre)', 'UseSupply(RedFire, Water)', 'UseSupply(RedFire, Water)']","Alice, Bob, and Charlie should navigate to ReservoirLibre to collect water because they currently do not have any water to extinguish the RedFire. David and Emma, who already have water, should use their supply on the nearest medium intensity regions of RedFire to prevent the fire from spreading.","Alice is currently collecting water from ReservoirLibre, Bob is currently collecting water from ReservoirLibre, Charlie is currently collecting water from ReservoirLibre, David is currently extinguishing RedFire_Region_1 using water, Emma is currently extinguishing RedFire_Region_3 using water","Alice is near RedFire at coordinates (17, 7). Bob is near RedFire at coordinates (17, 11). Charlie is near RedFire at coordinates (16, 7). David has 1 water supply at coordinates (16, 6). Emma has 1 water supply at coordinates (18, 8). RedFire is chemical and requires water to extinguish. Deposit Facility is empty. ReservoirLibre contains water. ReservoirTaj contains sand. All robots are aware of RedFire's regions and their intensities."
"[34, 34, 34, 34, 34]","['GetSupply(ReservoirLibre)', 'GetSupply(ReservoirLibre)', 'GetSupply(ReservoirLibre)', 'NavigateTo(RedFire_Region_1)', 'NavigateTo(RedFire_Region_3)']","Alice, Bob, and Charlie should collect water from ReservoirLibre to use on RedFire. David should navigate to the high-intensity region of RedFire to use his water supply. Emma should navigate to a high-intensity region of RedFire to use her water supply, as they are the most urgent areas to address.","Alice is currently collecting water from ReservoirLibre, Bob is currently collecting water from ReservoirLibre, Charlie is currently collecting water from ReservoirLibre, David is currently extinguishing RedFire_Region_1 using water, Emma is currently extinguishing RedFire_Region_3 using water","RedFire is chemical and requires water to extinguish. Deposit Facility is empty. ReservoirLibre contains water. ReservoirTaj contains sand. Alice is near RedFire at coordinates (21, 9). Bob is near RedFire at coordinates (22, 8). Charlie is near RedFire at coordinates (22, 10). David has 1 water supply at coordinates (16, 6). Emma has 1 water supply at coordinates (18, 8). Fire regions have different intensities with regions 1 and 3 being high intensity."
"[34, 34, 34, 34, 34]","['NavigateTo(RedFire_Region_1)', 'NavigateTo(RedFire_Region_3)', 'NavigateTo(RedFire_Region_1)', 'UseSupply(RedFire, Water)', 'UseSupply(RedFire, Water)']","Alice, Bob, and Charlie should navigate to the specific high-intensity regions of RedFire to use their water supply effectively. David and Emma, who are already at high-intensity regions, should use their water supply on RedFire. Additionally, as there are no current observations of LostPersonThomas, one robot should explore to locate them.","Alice is navigating to extinguish RedFire_Region_1 using water, Bob is navigating to extinguish RedFire_Region_3 using water, Charlie is navigating to extinguish RedFire_Region_Center using water, David is extinguishing RedFire_Region_1 using water, Emma is extinguishing RedFire_Region_3 using water, and Alice is exploring to find LostPersonThomas.","RedFire is chemical and requires water to extinguish. Deposit Facility holds LostPersonThomas. ReservoirLibre and ReservoirTaj contain water and sand respectively. Alice, Bob, and Charlie are near RedFire but need to target specific regions with water supplies. David is at coordinates (17, 7) and Emma is at coordinates (17, 11), both near high-intensity regions of RedFire."
"[34, 34, 34, 34, 34]","['UseSupply(RedFire, Water)', 'UseSupply(RedFire, Water)', 'UseSupply(RedFire, Water)', 'UseSupply(RedFire, Water)', 'UseSupply(RedFire, Water)']","Alice, Bob, Charlie, David, and Emma should all target different regions of RedFire with their water supplies to efficiently extinguish the fire. David and Emma, being near high-intensity regions, should prioritize those regions. All robots must navigate to the specific regions they are targeting before using their water supplies.","Alice is currently trying to extinguish RedFire_Region_1, Bob is currently trying to extinguish RedFire_Region_3, Charlie is currently trying to extinguish RedFire_Region_6, David is currently trying to extinguish RedFire_Region_10, and Emma is currently trying to extinguish RedFire_Region_11","Alice, Bob, Charlie, David, and Emma are all located near different regions of RedFire and are equipped with water to extinguish it. Deposit Facility holds LostPersonThomas."
"[34, 34, 34, 34, 34]","['NavigateTo(RedFire_Region_1)', 'NavigateTo(RedFire_Region_3)', 'NavigateTo(RedFire_Region_1)', 'NavigateTo(RedFire_Region_1)', 'NavigateTo(RedFire_Region_1)']","Alice, Bob, Charlie, David, and Emma should each navigate to specific regions of the RedFire to use their water supply efficiently. Since RedFire is a chemical fire, water is the appropriate resource to use. They should target the regions with the highest intensity first to prevent the fire from spreading further.","Alice is currently trying to extinguish RedFire_Region_1, Bob is currently trying to extinguish RedFire_Region_3, Charlie is currently trying to extinguish RedFire_Region_Center, David is currently trying to extinguish RedFire_Region_6, Emma is currently trying to extinguish RedFire_Region_7","Alice, Bob, Charlie, David, and Emma are all located near different regions of RedFire and attempted to extinguish it with water but failed due to not being close enough to the target region. Deposit Facility holds LostPersonThomas."
"[34, 34, 34, 34, 34]","['GetSupply(ReservoirLibre)', 'GetSupply(ReservoirLibre)', 'GetSupply(ReservoirLibre)', 'GetSupply(ReservoirLibre)', 'GetSupply(ReservoirLibre)']","Alice, Bob, Charlie, David, and Emma should first navigate to the specific regions of RedFire they are trying to extinguish before using their water supply. As the task requires extinguishing the fire using water, they need to collect water from the ReservoirLibre to fill their inventories. Since all robots are at different coordinates near RedFire, they should coordinate to extinguish different regions of the fire to be efficient.","Alice is currently trying to extinguish RedFire_Region_1, Bob is currently trying to extinguish RedFire_Region_3, Charlie is currently trying to extinguish RedFire_Region_Center, David is currently trying to extinguish RedFire_Region_6, Emma is currently trying to extinguish RedFire_Region_7","Alice, Bob, Charlie, David, and Emma are all located near different regions of RedFire and attempted to extinguish it with water but failed due to not being close enough to the target region. Deposit Facility holds LostPersonThomas."
"[34, 34, 34, 34, 34]","['NavigateTo(ReservoirLibre)', 'NavigateTo(ReservoirLibre)', 'NavigateTo(ReservoirLibre)', 'NavigateTo(ReservoirLibre)', 'NavigateTo(ReservoirLibre)']",All robots need to navigate to ReservoirLibre to collect water as it's the required resource to extinguish the chemical fire RedFire. They should then use the water on the closest regions of RedFire to their current locations.,"Alice is currently navigating to ReservoirLibre, Bob is currently navigating to ReservoirLibre, Charlie is currently navigating to ReservoirLibre, David is currently navigating to ReservoirLibre, Emma is currently navigating to ReservoirLibre",Deposit Facility holds LostPersonThomas. RedFire is a chemical fire and requires sand to be extinguished. All robots are located near different regions of RedFire and need to navigate to ReservoirLibre to collect water.
"[34, 34, 34, 34, 34]","['GetSupply(ReservoirTaj)', 'GetSupply(ReservoirTaj)', 'GetSupply(ReservoirTaj)', 'GetSupply(ReservoirTaj)', 'GetSupply(ReservoirTaj)']","All robots have successfully navigated to ReservoirLibre in the previous action, but they need to collect sand from ReservoirTaj instead because RedFire is a chemical fire. Once they have sand, they can use it on various regions of RedFire starting with the highest intensity regions (RedFire_Region_1 and RedFire_Region_3) to prevent the fire from spreading.","Alice is currently trying to extinguish RedFire_Region_1 using sand, Bob is currently trying to extinguish RedFire_Region_3 using sand, Charlie is currently trying to extinguish RedFire_Region_6 using sand, David is currently trying to extinguish RedFire_Region_7 using sand, Emma is currently trying to extinguish RedFire_Region_8 using sand",Deposit Facility holds LostPersonThomas. RedFire is a chemical fire and requires sand to be extinguished. All robots are near RedFire and have to collect sand from ReservoirTaj to extinguish it.
"[34, 34, 34, 34, 34]","['UseSupply(RedFire, Sand)', 'UseSupply(RedFire, Sand)', 'NavigateTo(ReservoirTaj)', 'UseSupply(RedFire, Sand)', 'UseSupply(RedFire, Sand)']","Charlie needs to navigate to ReservoirTaj to collect sand. Alice, Bob, David, and Emma, who already have sand in their inventory, should use their sand supply on the nearest regions of RedFire with the highest intensity to prevent the fire from spreading further.",Charlie is currently navigating to ReservoirTaj. Alice is currently extinguishing RedFire_Region_1 using sand. Bob is currently extinguishing RedFire_Region_3 using sand. David is currently extinguishing RedFire_Region_6 using sand. Emma is currently extinguishing RedFire_Region_7 using sand.,"Deposit Facility holds LostPersonThomas. RedFire is a chemical fire and requires sand to be extinguished. All robots are near RedFire and have to collect sand from ReservoirTaj to extinguish it. Alice, Bob, David, and Emma have collected sand and are ready to extinguish RedFire."
"[34, 34, 34, 34, 34]","['UseSupply(RedFire, Sand)', 'NavigateTo(RedFire_Region_2)', 'GetSupply(ReservoirTaj)', 'NavigateTo(RedFire_Region_1)', 'UseSupply(RedFire, Sand)']","Alice and Emma have successfully used sand on RedFire, so they should continue to extinguish it. Bob and David need to navigate closer to the fire to use their sand. Charlie should collect sand from ReservoirTaj since he's already there. All robots need to target different regions of RedFire to be efficient.","Alice is extinguishing RedFire_Region_4 using water, Bob is extinguishing RedFire_Region_2 using water, Charlie is collecting sand from ReservoirTaj, David is extinguishing RedFire_Region_6 using water, Emma is extinguishing RedFire_Region_13 using water.","Deposit Facility holds LostPersonThomas. RedFire is a chemical fire and requires sand to be extinguished. Alice, Bob, David, and Emma have collected sand and are ready to extinguish RedFire. Charlie is at the ReservoirTaj and should collect sand. David is holding sand and needs to navigate closer to RedFire to use it."
"[34, 34, 34, 34, 34]","['NavigateTo(RedFire_Region_1)', 'NavigateTo(RedFire_Region_2)', 'NavigateTo(RedFire_Region_1)', 'UseSupply(RedFire, Sand)', 'NavigateTo(RedFire_Region_1)']","Alice, Bob, and Emma need to navigate to different regions of RedFire to use their sand supply. Charlie should navigate to RedFire after collecting sand. David is in position to use his sand supply on RedFire_Region_1.","Alice is currently navigating to RedFire_Region_4, Bob is currently navigating to RedFire_Region_2, Charlie is currently navigating to RedFire_Region_6, David is currently extinguishing RedFire_Region_1, Emma is currently navigating to RedFire_Region_12.","Deposit Facility holds LostPersonThomas. RedFire is a chemical fire and requires sand to be extinguished. Alice, Bob, David, and Emma have collected sand and are ready to extinguish RedFire. Charlie has collected sand and needs to navigate to a region of RedFire to use it. David is at RedFire_Region_1 with sand."
