Step,Action,Reason,Subtask,Memory
"[34, 34, 34, 34, 34]","['Idle', 'Idle', 'Explore()', 'NavigateTo(DepositFacility)', 'GetSupply(ReservoirYork)']","Since both fires have been extinguished, the focus is on transporting LostPersonTimmy to the deposit. Alice and Bob are already carrying Timmy but need a third robot to move him. David, who is at ReservoirUtah, can navigate towards DepositFacility to assist with carrying. Charlie, being the furthest, should continue exploring to ensure no other tasks are left incomplete. Emma, being successful in navigating to ReservoirYork, should collect water in case of future fires or for other robots to use.","David is currently navigating to assist with carrying LostPersonTimmy, Charlie is currently exploring, Emma is currently collecting water supply.","CaldorFire and GreatFire have been extinguished. LostPersonTimmy has been located and is currently being carried by Alice and Bob, who are near DepositFacility. David is at ReservoirUtah with 1 unit of Sand. Charlie is at coordinates (20, 29). Emma has cleared her inventory."
"[34, 34, 34, 34, 34]","['NavigateTo(DepositFacility)', 'NavigateTo(DepositFacility)', 'Explore()', 'GetSupply(ReservoirUtah)', 'NavigateTo(GreatFire_Region_1)']","Alice and Bob need to navigate to DepositFacility to successfully drop off LostPersonTimmy. Since the fires are extinguished, Charlie should continue exploring to find any other lost persons. David should collect more sand from ReservoirUtah to prepare for any potential re-ignition of the CaldorFire. Emma should navigate to the non-chemical GreatFire and use her water supply to double-check if the fire is completely extinguished.","Alice and Bob are currently trying to drop off LostPersonTimmy in DepositFacility, Charlie is exploring, David is collecting sand, and Emma is performing a double-check on GreatFire.","CaldorFire and GreatFire have been extinguished. LostPersonTimmy has been located and is currently being carried by Alice and Bob, who are near DepositFacility. David is at ReservoirUtah with 1 unit of Sand. Charlie is at coordinates (20, 29). Emma has 1 unit of Water."
"[34, 34, 34, 34, 34]","['NavigateTo(DepositFacility)', 'NavigateTo(DepositFacility)', 'Explore()', 'NavigateTo(ReservoirUtah)', 'Move(Down)']",Alice and Bob should navigate to DepositFacility to drop off LostPersonTimmy. David should navigate to ReservoirUtah to get more Sand. Charlie should continue to explore to find any additional tasks or objects that may be of use. Emma should navigate to a different region of the GreatFire to verify that it is indeed extinguished.,"Alice and Bob are currently navigating to DepositFacility to drop off LostPersonTimmy, David is currently getting supply from ReservoirUtah, Charlie is currently exploring, Emma is currently double-checking intensity of GreatFire","CaldorFire and GreatFire have been extinguished. LostPersonTimmy has been located and is currently being carried by Alice and Bob, who are near DepositFacility. David is near ReservoirUtah with 1 unit of Sand. Charlie is at coordinates (20, 29). Emma has 1 unit of Water and is near GreatFire's location."
"[34, 34, 34, 34, 34]","['DropOff(DepositFacility, LostPersonTimmy)', 'DropOff(DepositFacility, LostPersonTimmy)', 'Explore()', 'GetSupply(ReservoirUtah)', 'NavigateTo(GreatFire_Region_1)']","Alice and Bob have successfully navigated to the DepositFacility and are ready to drop off LostPersonTimmy. Charlie has successfully explored and needs to continue exploring or assist with fire-related tasks. David has successfully navigated to ReservoirUtah and should collect more sand in case of future chemical fires. Emma, holding water, should navigate to a potential location of the GreatFire to double-check its intensity.","Alice and Bob are currently trying to drop LostPersonTimmy in deposit, Charlie is currently exploring or assisting with fire-related tasks, David is currently collecting sand from ReservoirUtah, Emma is currently double-checking the intensity of GreatFire","CaldorFire and GreatFire have been extinguished. LostPersonTimmy has been located and is currently being carried by Alice and Bob, who are near DepositFacility. David is near ReservoirUtah with 1 unit of Sand. Charlie is at coordinates (20, 29). Emma has 1 unit of Water and is near GreatFire's location."
"[34, 34, 34, 34, 34]","['NavigateTo(DepositFacility)', 'NavigateTo(DepositFacility)', 'Explore()', 'ClearInventory()', 'ClearInventory()']","Alice and Bob need to navigate to DepositFacility to complete the drop off of LostPersonTimmy. David, who has sand, could navigate to a deposit to store his sand or clear inventory since the CaldorFire is out. Charlie can explore to look for any other lost persons or fires. Emma, with water, can also navigate to a deposit to store her water or clear inventory since the GreatFire is out.","Alice and Bob are currently navigating to DepositFacility, David and Emma are storing resources or clearing inventory, and Charlie is exploring.","CaldorFire and GreatFire are extinguished. LostPersonTimmy has been found and is being carried by Alice and Bob who need to navigate to DepositFacility to drop him off. David is near ReservoirUtah with 1 unit of Sand. Charlie is at coordinates (10, 19) with no supplies. Emma has 1 unit of Water and GreatFire's location is extinguished."
"[34, 34, 34, 34, 34]","['DropOff(DepositFacility, LostPersonTimmy)', 'DropOff(DepositFacility, LostPersonTimmy)', 'Explore()', 'NavigateTo(ReservoirUtah)', 'NavigateTo(DepositFacility)']",Alice and Bob can now drop off LostPersonTimmy at DepositFacility since they both have successfully navigated to it. Charlie can continue to explore to find any other lost persons. David can move towards ReservoirUtah to get more Sand if needed in the future. Emma can try navigating to the deposit or explore further to ensure there are no other tasks.,"Alice and Bob are currently dropping off LostPersonTimmy at DepositFacility, Charlie is currently exploring, David is currently moving towards ReservoirUtah, and Emma is currently navigating to the deposit or exploring.","CaldorFire and GreatFire are extinguished. LostPersonTimmy has been found and is being carried by Alice and Bob who are now at DepositFacility ready to drop him off. David is near ReservoirUtah with 1 unit of Sand. Charlie is at coordinates (10, 0) with no supplies. Emma has 1 unit of Water and is at coordinates (17, 9)."
"[34, 34, 34, 34, 34]","['NavigateTo(DepositFacility)', 'NavigateTo(DepositFacility)', 'Explore()', 'Explore()', 'Explore()']","Alice and Bob need to navigate to DepositFacility so they can drop off LostPersonTimmy. Since the fires are already extinguished, Charlie, David, and Emma can assist in the search for any remaining lost persons or help Alice and Bob.","Alice and Bob are currently navigating to DepositFacility to drop off LostPersonTimmy, Charlie is currently exploring for lost persons, David is idle, Emma is idle.","CaldorFire and GreatFire are extinguished. LostPersonTimmy has been found and is being carried by Alice and Bob who are now at DepositFacility ready to drop him off. David is near ReservoirUtah with 1 unit of Sand. Charlie is at coordinates (10, 20) with no supplies. Emma has 1 unit of Water and is at coordinates (23, 11)."
"[34, 34, 34, 34, 34]","['DropOff(DepositFacility, LostPersonTimmy)', 'DropOff(DepositFacility, LostPersonTimmy)', 'Explore()', 'Explore()', 'Move(Right)']",Alice and Bob are already at the DepositFacility and can now coordinate to drop off LostPersonTimmy. Charlie and David should continue exploring to find any other lost persons. Emma needs to navigate to a new location to successfully explore.,"Alice and Bob are currently trying to drop off LostPersonTimmy, Charlie and David are currently exploring, and Emma is currently navigating to a new location to explore.","CaldorFire and GreatFire are extinguished. LostPersonTimmy has been found and is being carried by Alice and Bob who are now at DepositFacility ready to drop him off. David is near ReservoirUtah with 1 unit of Sand. Charlie is at coordinates (10, 20) with no supplies. Emma has 1 unit of Water and is at coordinates (23, 11)."
