Step,Action,Reason,Subtask,Memory
"[34, 34, 34, 34, 34]","['NavigateTo(ReservoirUtah)', 'NavigateTo(ReservoirYork)', 'NavigateTo(ReservoirUtah)', 'Explore()', 'NavigateTo(ReservoirYork)']","The robots should begin their tasks by collecting the necessary resources to extinguish the fires. Alice and Charlie should collect sand from ReservoirUtah to address the chemical fire 'CaldorFire', while Bob and Emma should collect water from ReservoirYork to address the non-chemical fire 'GreatFire'. David should explore to locate LostPersonTimmy.","Alice and Charlie are currently collecting sand from ReservoirUtah, Bob and Emma are currently collecting water from ReservoirYork, David is currently exploring to locate LostPersonTimmy",[]
"[34, 34, 34, 34, 34]","['GetSupply(ReservoirUtah)', 'GetSupply(ReservoirYork)', 'GetSupply(ReservoirUtah)', 'Explore()', 'GetSupply(ReservoirYork)']","Alice, Charlie, and David should collect sand from ReservoirUtah to use on the CaldorFire. Bob and Emma should collect water from ReservoirYork to use on the GreatFire. David should continue exploring to find LostPersonTimmy.","Alice is currently collecting sand from ReservoirUtah, Bob is currently collecting water from ReservoirYork, Charlie is currently collecting sand from ReservoirUtah, David is currently exploring to locate LostPersonTimmy, Emma is currently collecting water from ReservoirYork","Alice is at co-ordinates (14, 5) near ReservoirUtah. Bob is at co-ordinates (17, 8) near ReservoirYork. Charlie is at co-ordinates (15, 4) near ReservoirUtah. David is at co-ordinates (4, 3) and has found no lost persons yet. Emma is at co-ordinates (18, 7) near ReservoirYork. CaldorFire and GreatFire both have an average intensity of Low."
"[34, 34, 34, 34, 34]","['NavigateTo(CaldorFire_Region_1)', 'NavigateTo(GreatFire_Region_1)', 'NavigateTo(CaldorFire_Region_2)', 'Explore()', 'NavigateTo(GreatFire_Region_1)']","Alice has sand and is close to CaldorFire regions, so she should navigate to CaldorFire_Region_1 to use her sand supply to extinguish it. Bob has water and is close to the GreatFire regions, so he should navigate to GreatFire_Region_1 to use his water supply to extinguish it. Charlie, like Alice, has sand and should navigate to CaldorFire_Region_2 to use his sand supply. David, who has no supplies, needs to explore to locate LostPersonTimmy. Emma has water and should assist Bob in extinguishing the GreatFire regions.","Alice is currently navigating to CaldorFire_Region_1, Bob is currently navigating to GreatFire_Region_1, Charlie is currently navigating to CaldorFire_Region_2, David is currently exploring to locate LostPersonTimmy, Emma is currently navigating to GreatFire_Region_1","Alice is at co-ordinates (14, 5) near ReservoirUtah with Sand. Bob is at co-ordinates (17, 8) near ReservoirYork with Water. Charlie is at co-ordinates (15, 4) near ReservoirUtah with Sand. David is at co-ordinates (24, 3) and has found no lost persons yet. Emma is at co-ordinates (18, 7) near ReservoirYork with Water. CaldorFire and GreatFire both have an average intensity of Low."
"[34, 34, 34, 34, 34]","['UseSupply(CaldorFire, Sand)', 'UseSupply(GreatFire, Water)', 'UseSupply(CaldorFire, Sand)', 'Explore()', 'NavigateTo(GreatFire_Region_1)']",Alice can use her sand supply on CaldorFire_Region_1 to reduce its intensity. Bob can use his water supply on GreatFire_Region_1 to reduce its intensity. Charlie can use his sand supply on CaldorFire_Region_2 to reduce its intensity. David should continue exploring to locate LostPersonTimmy. Emma should navigate to a different region of GreatFire to address another region since Bob is already on GreatFire_Region_1.,"Alice is currently extinguishing CaldorFire_Region_1 using sand, Bob is currently extinguishing GreatFire_Region_1 using water, Charlie is currently extinguishing CaldorFire_Region_2 using sand, David is currently exploring to locate LostPersonTimmy, Emma is currently navigating to another region of GreatFire to extinguish it using water","Alice is at co-ordinates (4, 5) near CaldorFire with Sand. Bob is at co-ordinates (22, 18) near GreatFire with Water. Charlie is at co-ordinates (6, 5) near CaldorFire with Sand. David is at co-ordinates (24, 23) and has found no lost persons yet. Emma is at co-ordinates (21, 18) near GreatFire with Water. CaldorFire and GreatFire both have an average intensity of Low."
"[34, 34, 34, 34, 34]","['Explore()', 'Explore()', 'Explore()', 'Explore()', 'Explore()']","Since both fires have been extinguished, all robots can now focus on the subtasks related to locating and rescuing LostPersonTimmy. Alice, Bob, and Charlie are already near the extinguished fires, so they should explore to find LostPersonTimmy. David has already tried exploring with no success, so he should continue exploring in different directions. Emma should attempt to explore again since her previous navigation attempt was unsuccessful.",All robots are currently assigned to 'explore to locate LostPersonTimmy'.,"Alice is at co-ordinates (4, 5) near CaldorFire with Sand. Bob is at co-ordinates (22, 18) near GreatFire with Water. Charlie is at co-ordinates (6, 5) near CaldorFire with Sand. David is at co-ordinates (29, 13) and has found no lost persons yet. Emma is at co-ordinates (21, 18) near GreatFire with Water. CaldorFire and GreatFire both have been extinguished."
"[34, 34, 34, 34, 34]","['Explore()', 'Explore()', 'Explore()', 'Explore()', 'Explore()']","All robots have successfully explored their areas and no fires are active. However, they have not located LostPersonTimmy yet. All robots should continue exploring to find LostPersonTimmy. Emma, who was unsuccessful in navigating to GreatFire previously, can now use her action to continue exploring for LostPersonTimmy since the fire is already extinguished.",All robots are currently attempting to locate LostPersonTimmy.,"Alice is at co-ordinates (14, 15). Bob is at co-ordinates (29, 28). Charlie is at co-ordinates (14, 5). David is at co-ordinates (19, 3). Emma is at co-ordinates (29, 8) and holding Water. CaldorFire and GreatFire both have been extinguished. No lost persons have been found yet."
"[34, 34, 34, 34, 34]","['Explore()', 'Explore()', 'Explore()', 'Explore()', 'Move(Left)']","Alice, Bob, Charlie, and David should continue to explore different areas to locate LostPersonTimmy. Emma should move to a different location before attempting to explore again, as staying in the same place has not yielded results.","Alice, Bob, Charlie, and David are currently trying to 'explore to locate LostPersonTimmy', Emma is currently navigating to a new location to explore.","Alice is at co-ordinates (24, 5). Bob is at co-ordinates (29, 9). Charlie is at co-ordinates (23, 0). David is at co-ordinates (29, 13). Emma is at co-ordinates (29, 8) and holding Water. CaldorFire and GreatFire have both been extinguished. No lost persons have been found yet. Emma has tried to explore unsuccessfully in the vicinity of her current location."
"[34, 34, 34, 34, 34]","['Explore()', 'Explore()', 'Explore()', 'Explore()', 'Move(Right)']","All the robots are supposed to explore to locate LostPersonTimmy as no lost persons have been found yet. Alice, Bob, Charlie, and David should explore their surrounding areas. Emma, who has already tried to explore unsuccessfully in her vicinity and is currently holding water, should continue to explore in a new direction.","Alice is currently trying to explore to locate LostPersonTimmy, Bob is currently trying to explore to locate LostPersonTimmy, Charlie is currently trying to explore to locate LostPersonTimmy, David is currently trying to explore to locate LostPersonTimmy, Emma is currently trying to explore to locate LostPersonTimmy","Alice is at co-ordinates (24, 25). Bob is at co-ordinates (9, 9). Charlie is at co-ordinates (3, 0). David is at co-ordinates (9, 13). Emma is at co-ordinates (28, 8) and holding Water. CaldorFire and GreatFire have both been extinguished. No lost persons have been found yet."
"[34, 34, 34, 34, 34]","['NavigateTo(LostPersonTimmy)', 'NavigateTo(LostPersonTimmy)', 'NavigateTo(DepositFacility)', 'NavigateTo(DepositFacility)', 'NavigateTo(DepositFacility)']","Now that the fires have been extinguished and LostPersonTimmy has been located, the robots should focus on carrying LostPersonTimmy to a deposit. Since LostPersonTimmy requires 2 agents to carry, Alice and Bob being closest to each other should navigate towards LostPersonTimmy and carry him to the deposit. Charlie, David, and Emma should navigate to the deposit in preparation to drop off LostPersonTimmy once Alice and Bob arrive with him.","Alice and Bob are currently navigating to carry LostPersonTimmy, Charlie, David, and Emma are currently navigating to the deposit with LostPersonTimmy","Alice is at co-ordinates (4, 25). Bob is at co-ordinates (0, 0). Charlie is at co-ordinates (13, 10). David is at co-ordinates (9, 29). Emma is at co-ordinates (29, 8) and holding Water. CaldorFire and GreatFire have both been extinguished. LostPersonTimmy has been located and requires 2 agents to carry."
"[34, 34, 34, 34, 34]","['Carry(LostPersonTimmy)', 'Carry(LostPersonTimmy)', 'Idle', 'Idle', 'Idle']","Alice and Bob should carry LostPersonTimmy since they are both successful in navigating to him and he requires 2 agents to carry. Charlie, David, and Emma are already at the DepositFacility, they should wait for Alice and Bob to arrive with LostPersonTimmy for a dropoff.","Alice and Bob are currently trying to carry LostPersonTimmy, Charlie, David, and Emma are waiting to drop off LostPersonTimmy in deposit","Alice and Bob are at co-ordinates (7, 22) and (8, 21) respectively, ready to carry LostPersonTimmy. Charlie, David, and Emma have navigated to DepositFacility. CaldorFire and GreatFire have both been extinguished. LostPersonTimmy has been located and requires 2 agents to carry."
"[34, 34, 34, 34, 34]","['NavigateTo(DepositFacility)', 'NavigateTo(DepositFacility)', 'NavigateTo(Alice)', 'GetSupply(ReservoirUtah)', 'GetSupply(ReservoirYork)']","Alice and Bob are already carrying LostPersonTimmy and should now navigate to the DepositFacility to drop him off. Charlie, David, and Emma are idle and can either assist in carrying LostPersonTimmy by navigating to Alice and Bob's location, or start collecting resources for future fire extinguishing tasks.","Alice and Bob are currently navigating to deposit with LostPersonTimmy, Charlie is currently navigating to Alice and Bob's location to assist, David is currently collecting Sand from ReservoirUtah, and Emma is currently collecting Water from ReservoirYork.","Alice and Bob are at co-ordinates (7, 22) and (8, 21) respectively, ready to carry LostPersonTimmy. Charlie, David, and Emma have navigated to DepositFacility. CaldorFire and GreatFire have both been extinguished. LostPersonTimmy has been located and requires 2 agents to carry. Alice and Bob are currently carrying LostPersonTimmy."
"[34, 34, 34, 34, 34]","['DropOff(DepositFacility, LostPersonTimmy)', 'DropOff(DepositFacility, LostPersonTimmy)', 'Idle', 'NavigateTo(ReservoirUtah)', 'NavigateTo(ReservoirYork)']",Alice and Bob need to perform the 'dropoff' action for LostPersonTimmy at the DepositFacility. Charlie can assist in any remaining tasks or start collecting resources for future use. David needs to navigate to ReservoirUtah before attempting to collect Sand again. Emma needs to navigate to ReservoirYork before attempting to collect Water again.,"Alice and Bob are currently trying to drop off LostPersonTimmy at DepositFacility, Charlie is currently idle, David is currently trying to collect Sand from ReservoirUtah, and Emma is currently trying to collect Water from ReservoirYork.","Alice and Bob are holding LostPersonTimmy and are at co-ordinates (24, 12) and (22, 11) respectively, ready to drop them in DepositFacility. Charlie is at co-ordinates (24, 11). David and Emma attempted to get supplies but were not close enough. CaldorFire and GreatFire have both been extinguished. LostPersonTimmy has been located and is being carried by Alice and Bob."
"[34, 34, 34, 34, 34]","['Idle', 'Idle', 'Idle', 'NavigateTo(ReservoirUtah)', 'NavigateTo(GreatFire_Region_1)']","Since both fires have been extinguished and LostPersonTimmy has been dropped off in the deposit, there are no immediate tasks left for Alice, Bob, and Charlie to undertake. They can now be directed to collect resources in preparation for any future fires or tasks. David should navigate to ReservoirUtah to collect sand, and Emma should navigate to GreatFire_Region_1 to use her water supply.","David is currently navigating to ReservoirUtah, Emma is currently navigating to GreatFire_Region_1",CaldorFire and GreatFire have both been extinguished. LostPersonTimmy has been located and is being carried by Alice and Bob.
"[34, 34, 34, 34, 34]","['NavigateTo(DepositFacility)', 'NavigateTo(DepositFacility)', 'Explore()', 'Explore()', 'Explore()']","Since both fires have been extinguished, and LostPersonTimmy has been located and is being carried by Alice and Bob, the robots should focus on dropping LostPersonTimmy in a deposit. Alice and Bob need to navigate to DepositFacility to drop off LostPersonTimmy. Charlie, David, and Emma can be on standby or explore to ensure there are no other tasks.","Alice and Bob are currently navigating to DepositFacility to drop off LostPersonTimmy, Charlie, David, and Emma are exploring.",CaldorFire and GreatFire have both been extinguished. LostPersonTimmy has been located and is being carried by Alice and Bob.
"[34, 34, 34, 34, 34]","['DropOff(DepositFacility, LostPersonTimmy)', 'DropOff(DepositFacility, LostPersonTimmy)', 'NavigateTo(DepositFacility)', 'NavigateTo(DepositFacility)', 'NavigateTo(DepositFacility)']","As the fires are already extinguished, and LostPersonTimmy has been located and is being carried by Alice and Bob, the next step for Alice and Bob is to drop off LostPersonTimmy at the DepositFacility. Charlie, David, and Emma have no specific tasks at the moment, so they should navigate towards the DepositFacility to assist in case more help is needed for carrying or any other subsequent tasks.","Alice and Bob are currently carrying LostPersonTimmy, Charlie, David, and Emma are idle.",CaldorFire and GreatFire have both been extinguished. LostPersonTimmy has been located and is being carried by Alice and Bob.
"[34, 34, 34, 34, 34]","['NavigateTo(DepositFacility)', 'NavigateTo(DepositFacility)', 'Explore()', 'Explore()', 'Explore()']","Alice and Bob need to navigate to DepositFacility to drop off LostPersonTimmy. Charlie, David, and Emma should explore to find any other lost persons as all fires have been extinguished and there are no other tasks open.","Alice and Bob are currently navigating to deposit with LostPersonTimmy, Charlie, David, and Emma are locating LostPersonTimmy",CaldorFire and GreatFire have both been extinguished. LostPersonTimmy has been located and is being carried by Alice and Bob. Emma has 1 unit of Water in inventory.
"[34, 34, 34, 34, 34]","['NavigateTo(DepositFacility)', 'NavigateTo(DepositFacility)', 'Done', 'Done', 'Done']","Alice and Bob should move to the DepositFacility to drop off LostPersonTimmy. Charlie, David, and Emma, since the fires are extinguished, should await further instructions or assist in exploring for any other potential subtasks.",Alice and Bob are currently trying to drop LostPersonTimmy in deposit,"CaldorFire and GreatFire have both been extinguished. LostPersonTimmy has been located and is being carried by Alice and Bob. Emma has 1 unit of Water in inventory. Alice and Bob are at coordinates (22,13) and (22,12) respectively, near DepositFacility."
"[34, 34, 34, 34, 34]","['DropOff(DepositFacility, LostPersonTimmy)', 'DropOff(DepositFacility, LostPersonTimmy)', 'Explore()', 'Explore()', 'Explore()']","Alice and Bob should both perform the DropOff action for LostPersonTimmy at DepositFacility since they are both at the deposit and carrying LostPersonTimmy. Charlie, David, and Emma can now explore the environment to find any remaining lost persons, as the fires have been extinguished and the lost person they are aware of is already being handled.","Alice and Bob are currently trying to drop off LostPersonTimmy. Charlie, David, and Emma are exploring to find any remaining lost persons.","CaldorFire and GreatFire have both been extinguished. LostPersonTimmy has been located and is being carried by Alice and Bob. Emma has 1 unit of Water in inventory. Alice and Bob are at coordinates (23,11) and (23,13) respectively, near DepositFacility. David previously attempted to get supply from ReservoirUtah unsuccessfully."
"[34, 34, 34, 34, 34]","['NavigateTo(DepositFacility)', 'NavigateTo(DepositFacility)', 'Explore()', 'NavigateTo(ReservoirUtah)', 'NavigateTo(DepositFacility)']","Alice and Bob are carrying LostPersonTimmy and need to navigate to DepositFacility to drop him off. Charlie should explore to find any other lost persons. David should attempt to get supply from ReservoirUtah again, as it failed previously due to not being navigated to it. Emma should move to DepositFacility to assist Alice and Bob in dropping off LostPersonTimmy, as her inventory is currently full with water that is not needed.","Alice and Bob are currently trying to drop LostPersonTimmy in deposit, Charlie is currently exploring, David is currently trying to get supply from ReservoirUtah, and Emma is currently assisting in dropping off LostPersonTimmy at DepositFacility.","CaldorFire and GreatFire have both been extinguished. LostPersonTimmy has been located and is being carried by Alice and Bob. Emma has 1 unit of Water in inventory. Alice and Bob are at coordinates (23,11) and (23,13) respectively, near DepositFacility. David previously attempted to get supply from ReservoirUtah unsuccessfully."
"[34, 34, 34, 34, 34]","['DropOff(DepositFacility, LostPersonTimmy)', 'DropOff(DepositFacility, LostPersonTimmy)', 'Explore()', 'GetSupply(ReservoirUtah)', 'Idle']","Alice and Bob should now both perform the DropOff action at DepositFacility to successfully drop off LostPersonTimmy. David should try to get the sand supply again from ReservoirUtah, now that he is near it. Emma, with water in her inventory, can be on standby or explore as all fires are extinguished. Charlie should continue to explore to find any remaining lost persons.","Alice and Bob are currently dropping off LostPersonTimmy at DepositFacility, David is currently trying to get supply from ReservoirUtah, Charlie is currently exploring, Emma is idle.","CaldorFire and GreatFire have been extinguished. LostPersonTimmy has been located and is being carried by Alice and Bob. Emma has 1 unit of Water in inventory. Alice and Bob are at coordinates (23,11) and (23,13) respectively, near DepositFacility. David is at ReservoirUtah."
"[34, 34, 34, 34, 34]","['NavigateTo(DepositFacility)', 'NavigateTo(DepositFacility)', 'Explore()', 'NavigateTo(DepositFacility)', 'NavigateTo(DepositFacility)']",Alice and Bob are carrying LostPersonTimmy and need to navigate to the DepositFacility to drop him off. Charlie can continue to explore to ensure that no other tasks are pending. David can navigate towards the DepositFacility to store his Sand supply or be ready for any other task. Emma can navigate to the DepositFacility to store her Water supply or assist with any other tasks.,Alice and Bob are currently trying to drop off LostPersonTimmy at DepositFacility. Charlie is currently exploring. David and Emma are currently idle.,"CaldorFire and GreatFire have been extinguished. LostPersonTimmy has been located and is being carried by Alice and Bob. Emma has 1 unit of Water in inventory. Alice and Bob are at coordinates (22, 12) and (23, 11) respectively, near DepositFacility. David is at ReservoirUtah with 1 unit of Sand. Charlie's coordinates are (9, 24)."
"[34, 34, 34, 34, 34]","['DropOff(DepositFacility, LostPersonTimmy)', 'DropOff(DepositFacility, LostPersonTimmy)', 'Explore()', 'ClearInventory()', 'ClearInventory()']",Alice and Bob need to perform the DropOff action together to successfully drop LostPersonTimmy at the DepositFacility. Charlie should explore further to find any additional lost persons. David and Emma can clear their inventories since the fires are already extinguished.,"Alice and Bob are currently trying to drop off LostPersonTimmy at DepositFacility, Charlie is currently exploring, David and Emma are currently idle.","CaldorFire and GreatFire have been extinguished. LostPersonTimmy has been located and is being carried by Alice and Bob. Emma has 1 unit of Water in inventory. Alice and Bob are at coordinates (22, 12) and (23, 11) respectively, near DepositFacility. David is at ReservoirUtah with 1 unit of Sand. Charlie's coordinates are (9, 24)."
"[34, 34, 34, 34, 34]","['NavigateTo(DepositFacility)', 'NavigateTo(DepositFacility)', 'Explore()', 'Explore()', 'Explore()']",Alice and Bob need to navigate to the DepositFacility to successfully drop off LostPersonTimmy. Charlie should continue to explore in order to ensure all lost persons are found. David and Emma should stand by or assist in exploration as the fires are already extinguished and carrying the person requires at least two robots.,"Alice and Bob are currently trying to drop LostPersonTimmy in deposit, Charlie is currently exploring, David and Emma are currently assisting in exploration or standing by.","CaldorFire and GreatFire have been extinguished. LostPersonTimmy has been located and is being carried by Alice and Bob. Emma has 1 unit of Water in inventory. Alice and Bob are near DepositFacility. David is at ReservoirUtah with 1 unit of Sand. Charlie's coordinates are (19, 29)."
"[34, 34, 34, 34, 34]","['DropOff(DepositFacility, LostPersonTimmy)', 'DropOff(DepositFacility, LostPersonTimmy)', 'Explore()', 'Explore()', 'NavigateTo(DepositFacility)']","Alice and Bob need to simultaneously perform the DropOff action to successfully leave LostPersonTimmy at the DepositFacility. David, after an unsuccessful exploration attempt due to an obstacle, should try exploring in a different direction. Charlie should continue exploring to potentially find any remaining lost persons. Emma can assist in carrying LostPersonTimmy.","Alice, Bob, and Emma are currently trying to drop LostPersonTimmy in deposit, Charlie is currently exploring, David is currently idle.","CaldorFire and GreatFire have been extinguished. LostPersonTimmy has been located and is being carried by Alice and Bob. Emma has 1 unit of Water in inventory. Alice and Bob are near DepositFacility. David is at ReservoirUtah with 1 unit of Sand. Charlie's coordinates are (19, 29)."
"[34, 34, 34, 34, 34]","['NavigateTo(DepositFacility)', 'NavigateTo(DepositFacility)', 'Explore()', 'NavigateTo(DepositFacility)', 'NavigateTo(DepositFacility)']","Alice and Bob need to navigate to DepositFacility to successfully drop off LostPersonTimmy. Emma, who previously tried to get to DepositFacility, should join Alice and Bob to help carry LostPersonTimmy. David, who is at ReservoirUtah, can move towards the DepositFacility to join the group. Charlie should continue exploring the environment to ensure no other tasks are left.","Alice, Bob, and Emma are currently trying to drop LostPersonTimmy at DepositFacility. David is navigating to join them. Charlie is exploring.","CaldorFire and GreatFire have been extinguished. LostPersonTimmy has been located and is being carried by Alice and Bob. Emma has 1 unit of Water in inventory. Alice and Bob are near DepositFacility. David is at ReservoirUtah with 1 unit of Sand. Charlie's coordinates are (20, 29)."
"[34, 34, 34, 34, 34]","['NavigateTo(DepositFacility)', 'NavigateTo(DepositFacility)', 'Explore()', 'NavigateTo(DepositFacility)', 'ClearInventory()']","Since both fires have been extinguished, all robots should focus on finding and rescuing LostPersonTimmy. Alice, Bob, and David should navigate to DepositFacility to drop off LostPersonTimmy. Emma should clear her inventory of water since it's no longer needed and help in the search and rescue of LostPersonTimmy. Charlie should continue to explore to find any remaining lost persons.","Alice, Bob, and David should be dropping off LostPersonTimmy at DepositFacility, Emma should clear inventory, Charlie should explore.","CaldorFire and GreatFire have been extinguished. LostPersonTimmy has been located and is being carried by Alice and Bob. Emma has 1 unit of Water in inventory. Alice and Bob are near DepositFacility. David is at ReservoirUtah with 1 unit of Sand. Charlie's coordinates are (20, 29)."
"[34, 34, 34, 34, 34]","['NavigateTo(DepositFacility)', 'NavigateTo(DepositFacility)', 'Explore()', 'NavigateTo(DepositFacility)', 'NavigateTo(ReservoirYork)']","Alice and Bob need to navigate to the DepositFacility and perform the drop-off of LostPersonTimmy together. Charlie should continue to explore the environment to possibly find any more lost persons or fires. David should move towards the DepositFacility to help with the drop-off if needed, given that all fires are extinguished. Emma should navigate to either the Sand or Water reservoir to collect resources in case of future fires.",Alice and Bob are currently navigating to DepositFacility to drop off LostPersonTimmy; Charlie is currently exploring; David is currently navigating to DepositFacility; Emma is currently navigating to a reservoir.,"CaldorFire and GreatFire have been extinguished. LostPersonTimmy has been located and is currently being carried by Alice and Bob. Alice and Bob are near DepositFacility. David is at ReservoirUtah with 1 unit of Sand. Charlie is at coordinates (20, 29). Emma has cleared her inventory."
